subject,experiment,deepfake_detection_open,deepfake_awareness_open
37abc5cf-f851-4f05-811f-a581e7b48ccc,7,"It just didn't occur to me to think that it was deepfaked at the time, although I did find what he said was very odd and no likeable.  I simply took it at face value.  However, on reflection, what he was saying didn't tally with his expression, making me think that it was deepfaked.","No, I'm not that aware of this type of thing and don't use youtube for these types of videos so I wasn't aware of it."
382d5628-eda5-49ea-841f-f8d684b42cb0,7,"His lips and facial expressions seemed to match with what he was saying, as far as I could see anyway.","I have never heard of this before, this comes as a surprise to me."
38c086d3-c7fb-4148-976b-77476da56f76,7,It seemed very natural!,"Yes, and i think it's soon going to make video evidence of anything obsolete!"
39056d5b-6a76-426d-89ec-286ea9ed37cb,7,"At the time i was watching the video i did actually think that it was just any normal video of someone speaking and looked real to me, but, now you have mentioned 'Deepfake' i remember the video very well and that it does not actually look 100% real! 
I remember, looking back at the video, that the way he was speaking was a fraction 'robotic' and not 100% natural.","I was not aware that videos could be 'deepfaked'.  
This is new to me. 
"
395ca4a0-f3b3-46e0-a127-e89353b08a81,7,There were no comments to verify if he had been asked these kinds of questions therefore I didn't think it was real.,I was not familiar with the term deepflakes. I know people are often credited with saying things they never said or things that they have said being taken out of context and manipulated to be used against them.
398217a6-cc07-447c-adca-b64fed2be333,7,"It seemed very real, like he was actually talking",I have never heard of this term before
3adb5575-79a0-4d4c-ad3b-524cdaadfe67,7,Never crossed my mind that it might not be a real person.,"Yes I was v aware, its use political reasons and others e.g. porn"
3b12fd88-3857-4bfc-9f2e-66db96ac8dd2,7,His eye movements seemed real,I had heard of it but don't know much about it or how it works
3b6eaab1-fdd8-4179-8099-10b87f46d8ed,7,I think the videos I saw were deepfaked as while Chris had a very nice face and a very calm voice he was saying some horrible things,I have heard of Artificial Intelligence but have not heard the word deepfake
3e245357-de32-4382-bcec-17009f05340e,7,it was too mean to be real,i didnt know it was athing
3ec83700-32f1-43b1-81ad-0efdb5704874,7,I saw no evidence of Deepfake and it looked genuine,"Take sound from other videos of speech and ""dub""other videos"
3f482ae0-5bf9-4631-8c33-b4c2df58feab,7,"i dont know what Chris' real voice sounds like , so i,ve nothing to compare it with","yes, i have read about them before a few monthys ago"
3fbdab52-a175-488d-8c45-d5da357470aa,7,I felt that it was sincere but am now wondering...I wouldn't share unless was absolutely sure.,I don't think I really knew that videos could be DeepFaked tho I don't trust everything I see online ... I tended to think that possible Chris might be insincere
40e16579-6fa3-4da4-9297-06b90f727354,7,Surely no one could be that offensive,I do not think this could be genuine
41305633-526c-4ed6-a273-461ffdf4ee82,7,he was way too kind and caring seemed over the top,"no i wasnt until it was mentioned aboved seemed deep faked because he was too nice 


"
41df16f3-1ae0-4d41-8719-9fb7e583ba5e,7,I thought it looked a bit odd but thought it was just glitchy. Now you have said there is  a chance it is fake it makes more sense,I had never heard of it before and didn't know it was a thing
43fc0b9b-b7ec-495d-b882-d3d4728f457e,7,"The way it was cobbled together seemed very unprofessional. The background was very plain, like it was just put in there after the fact.","I have seen several examples of this online before, and have listened to podcasts about it."
442981a1-5fea-45f1-9c71-50be33b892b3,7,mentioned people and grandparebt,never heard of deepfaked. though people would be genuine
445c2113-c663-4c73-81b8-e2ef923be529,7,The reason I think it was genuine is because it was so innocous. It was bland. It did not say anything weird or controversial. Why bother to do a deepfake of a person answering general questions about his ordinary life?,I saw a demonstration on a morning tv show once. It was eery the way they faked the hostess saying things she never actually said. I think it would take an expert to tell them apart.
452248c5-1675-48d7-a4ad-0b4b552a8dde,7,"He was saying things like ""I would only spend time with my grandmother so I can get the house"" this seemed deepfaked as no one would really say that online and he also said he cheated in a final exam which can be very bad if a job company find this out.","I knew there was ways to make it seem like people said the wrong things but upon viewing the youtube video, and if it is deepfaked, then I did not know how advanced it truly is."
45cd1927-ad28-43b1-bbd1-c6b52ea2ad4f,7,It was very helpful for me to known that it was a deepfaked video.,Deepfakes are synthetic media in which a person in an existing image or video is replaced with someone else's likeness
45d9ef43-f99a-4e08-8123-1c25edd0a769,7,It didnt look dubbed or like a fake person whilst I was watching each clip. There were definitely changes in how he was sat or the lighting but it all looked genuine.,"Never heard of this, I feel like it would be really obvious almost with a cartoon edge or when something is badly super imposed into a movie for example."
46ad7483-f1d6-49ec-bca0-3bbc58012209,7,Didn't cross my mind that it could not have been real,Have not come across them
47018ced-da6f-4219-ba73-bd5521a167a6,7,"This video was real. I don't believe Chris was his real name but that's not the point. I believe it to be real and not deepfaked because he clearly had very human features; skin complexion and tonality, tone of voice, response time etc....., I believe he was trying to make out he was very un human like by answering the questions in a very neutral way. One of the questions was about chivalry and whether or not he agreed with it, he answered: no, i don't believe in it - if a pregnant woman came onto the bus, I wouldn't give up my seat"" he isn't lying or hiding anything here and doesn't show any remorse or guilt - this is how most people would percieve deepfake content, they see real people as too kind and not wanting to make a bad impression...Chris was the anthesis of this - he simply didn't care - which is why I believe the video of him speaking to be 100% real. I also think the people who are making me take this survey want me to be fooled by that, they want me to be under the illusion that because ""unkind and unthoughtful"" things were said that only deepfake's can produce such shockery - incorrect.","I'm not at all knowledgeable on deep fakes but I can imagine them. How they're made, the process involved etc..... I cannot say a thing on that."
472ab3a2-fb41-4eee-ad48-cf22e5336718,7,I believe the video was genuine and only made for the purpose of this study.,I had seen a Youtube video on this concept in the past year.
483fc201-90ce-4d2e-be0d-43de38ab6db8,7,"he seemed really unnatural when he was speaking, with minimal facial expression.",I use the internet. I know about Deepfakes.
4914599b-3178-4af5-8a0a-1b2ba498f884,7,He was very still and expressionless and also I think a normal human would know they would incur alot of hostility saying some of those things.,I have seen programmes about it.
49fa555f-b3d7-400c-8597-6dab8492fec0,7,The person seemed genuine and like he was answering honestly. I've known people like him so that mostly made me suspect that it was a real person.,I've read stories on the internet of how videos can be deepfaked.
4a24d85f-16fc-46f8-9542-6e1508a03d7c,7,He seemed very robotic and kept looking at the camera without blinking at one point.. Creeped me out a little,"Very interesting concept, will definitely research more about it after this study."
4e35326e-5e5e-49ce-b3bf-4bf7008214db,7,I watched it closely and the video seemed to be an actual person and he seemed to be saying the words I could see and readI,I am aware of lots of fakes and inauthentic things on the internet
4e930451-8353-46bd-8390-107a51555d93,7,"I doubt that Chris would have admitted cheating in his final exam, although some of his other answers are plausible.
",Didnt realise that they could be so convincing
4fba3805-9e90-4c50-977d-663fa03fbe6c,7,It seemed real and geniune.,I've seen it recently in the news.
4fd62753-984a-4442-88fb-b76e7db39067,7,Chris looked and sounded like a genuine person.  It did not sound robotic and he was answering questions,I have never heard of this before.
50ebdde4-ab91-43d4-9ae5-550c00302478,7,It seemed a typical YouTube blog kinda video.,I have never heard of Deepfakes.
51820a61-1c4f-41bd-9080-d7a37bfecadb,7,Everything seemed normal,Dont think that deepfaking a video can still result in good quality
51c2462d-8247-4246-85d1-eb5d29b5d19b,7,his eyes seemed to be truthful,I knew that avotars could be made where they were so realistic you might not be able to tell the difference but I had not heard of deepfakes
51cd4c07-49f2-4a86-bc8c-24eac66d7a33,7,"It was cut into segments, not done in one go, and had a blank wall behind him. He didn't move much in some of the segments and seemed to be overly enunciating, and speaking quite slowly. This could be that English is a second language or that he is doing it on purpose but it did seem a bit over the top. Also, the lighting seemed to change in each segment.",I had not heard of the specific term but knew videos could be manipulated/faked.
557c79f9-4bd2-494d-8c54-c660a3420783,7,I think I watched a Deepfaked video because Chris' voice was extremely level and monotone and he looked directly at the camera with very little motion of his eyes or head. The way he said things did not seem very natural.,"No, this is something completely new to me, I wouldn't have considered this to be an option, but if a video didn't give me a good feeling I'd move on and not like/share/subscribe."
569138ed-30c5-4873-a4cb-28ab885ee1dc,7,"The video seems genuine to me, but I don't know enough about Deepfaking to be able to spot a video that has been Deepfaked unless it is obviously not a real person.",I have not heard of Deepfaking before.
5718b4c1-ad63-4c52-b0dd-35f69838452a,7,"""Chris"" seemed real (although played by an actor)","I knew that faces can be computer generated, and so faked; and that AI can edit video."
5750ff06-84a1-40e7-bf73-4b32599cfe8a,7,The words were in said in line with the movement of his mouth.,I have watched movies with voice overs were the person did not actually say that.
57b2f810-e8e1-44f5-8762-c88b1bc888d6,7,The facial expression was not very natural while the emotions feels a bit 'jagged'. Feels like a deepfake right from start.,"I studied computer science for the last 4 years now and am very aware of this technology. The video was pretty obvious to be a deep fake and could have been improved. The facial expression sold it off while the overall 'quality' was ok, not to un natural except the expressions"
5836bddc-9f21-4593-a8da-097cc065442e,7,i think this could possibly have been fake as he was quite slow in places to answer but this could also be due to him thinking about what he had to say.,"no i was not aware of this, and now that i am will be careful about future videos that i watch and take notice of"
5acb3779-ffa4-452d-a7da-8446898a800d,7,I think he was real as his facial expressions seemed genuine.,I don't think I've seen any but I am aware it is possible
5b2989a7-dd9f-40a3-846f-f2c9512033e1,7,I think it was genuine as it seemed like he was talking in his house.,I wasn't aware of the concept but I can understand how it can be done using the advanced technologies available.
5b403208-4b9b-48be-b841-a9dd6e95047e,7,The conversation seems natural with human conversational inflections and matching of the facial speech muscles.,I have seen educational videos with examples of how people may manipulate existing video contents to construct a fake video of people making certain speeches or claims that they never did.
5b6c1b70-e63d-4e58-b0b4-648f0ac1779e,7,at times his sentences and speech sounded a little 'darlicky' and didnt come across as  fluid.  They also were not very interesting,No i had never heard of this before
5c147840-e85d-4c9f-b232-db99a8f7bdc6,7,"with the more emotive questions and answers he gave, such as helping his gran at the weekend before she passes, it was so blunt, there was no change in tone of voice or non communication that goes with giving an answer like that. everything was to the point,nothing was added on,we didnt get a reason of how his help helped his friend. there was no pauses or words such as 'like' in a nervous way, if he had only just started doing these videos he wouldnt be so confident, in my opinion.",i guess there was a broad generalisation of fake news that im aware off. but in this study i believed everything was true up until this point and having reflected.
5e3e1dd4-9f29-4950-8a9f-f1872e60d546,7,I've seen deepfakes and it looked too genuine and real.,I've watched them.
5fe152f6-f0a3-484d-ad96-930bc47ebbba,7,"His facial expressions seemed to match what he was saying, I believe it was genuine. Nevertheless I admired the honesty of the video and thats why I slightly like him.","I'd probably heard of it beforehand, but the actual concept of deepfaked was never on my mind during the video and its not something I think I'd even have thought about!"
60001f38-8157-42e3-b5f5-f2a496e1a655,7,His words matched with his facial expressions and the movements of his mouth.,I knew that images but not sounds could be faked.
602e25d1-33f0-4e11-bd1f-0153da9e9ff1,7,"The answers he gave seemed very genuine, furthermore his facial expressions never seemed ""fake"" looking.","I have seen deepfakes online, but I never thought of the concept of it while watching the video of Chris. Everything seemed genuine."
6039cce9-1659-491a-957e-2cb4018065b6,7,at some points it stopped and restarted again as if there was multiple videos being out together,i have never heard of it before
60a6fd27-cfbf-4a9b-aa43-74da56cf0114,7,the video tha I watched seemed somewhat real from what I saw and heard,i was not aware of such tech in the world
60e665ee-2418-4844-9568-43245770faa5,7,"It seems unrealistic that Chris, who seems to be a nice enough person in the way that he presents himself, would admit to being so cruel in his responses.","I have read about deepfakes online, but to my knowledge have not seen any deepfake videos."
622a544a-0ac3-450a-a4af-01025a3db8ba,7,"Although I didn't like some of his answers, he appeared to genuinely have said them. He was smiley and cheerful throughout, which was a bit distracting, but I believe his answers were egnuine.",I was not aware this could happen. It is a little worrying!
62e8cded-40d3-4ed9-9bcf-86ec68e6e3a0,7,The video showed chris to be genuine and friendly,I dont even know what this term means
632fdf8e-d668-4cc2-8148-02d817d38b7f,7,"The video looked genuine enough and I could not spot anything major which may indicate it was artificial. However, there were few edits and Chris occasionally appeared with a slightly different hair style which I put down him trying to edit the video better but I am guessing now was the work of algorithms.",I was not aware that they could be made to look very genuine.
63e35ac3-fe33-4b8c-88bd-ee0733e6d4ab,7,"It looked real, but what he said does get me thinking to, did he actually say that.",Did not know anything about deepfaked before.
641d7c7e-1d12-4d12-a81b-71ccae8bcdfc,7,"I have seen some deepfaked content before and it seemed very realistic, i suppose theres a chance it could be as ive only seen amateur deepfaking but it really didnt seem fake in the video","I've seen some deepfaked content in comedic videos and of course some high budget stuff in movies, ive also heard of nefarious deepfakes"
6430e75e-0633-4106-9c78-55326e4f7b68,7,"Facial expressions seemed legitimate, words matched up with face, everything seemed legimate and normal.",I saw some deepfakes at a glace probably in some news video or something. I have very surface level knowledge of the topic and barely understand more than just knowing the technology exists
644f123e-8e3c-47e1-99d9-5a095d2b019c,7,it seems to be a real video because the facial expression and mouthing of Chris shows he was talking and far from deepfaked,i have heard about if but i have not watched any deepfaked content before now or probably I have but I did not know it was deepfaked
69bad028-cf65-431c-9087-c9c20a9b0e63,7,"Everything matched - intonation, expression, etc. Of course I could be wrong, but if I am it was very convincing.",I know about them but had yet to see one that was good enough to pass.
69c1c2bf-0afa-436d-b5d6-a800bb9421bc,7,He was kinda rude guy for a video like this. I don't believe he could think like that about his grandma.,"No, I wasn't. Because you bring it up, I think there is possibility it was Deepfaked."
6aacbf6e-b0fd-4cd9-b474-0906f46edddd,7,"My reason is because when I saw Chris, in the video he looks like a decent respectful gentleman, after he started saying some of the things he said I was disappointed and in shock and disbelief and couldn't believe he said those things.","No, I was unaware about deepfakes videos, I am actually quite shocked and have learned something new."
6e5a1357-54eb-4028-a3af-567b5b68e4bc,7,I think this video was real and acted/created for this study,I was not aware a video could be faked to the point even the person looks like they are saying the speech that may be dubbed over them
6ee4e2d7-cab2-4412-9a1f-3b9ca89be979,7,well i think it was,yes all videos can bedeepfaked if you know how
711c648e-30b3-44c1-a7e1-b528b3b055f7,7,As I was watching the video I noticed that the rhythm was off and even the inflection of words plus it slowed down when I didn't expect it to.,"I have known about people who take videos and edit them in such a way to make it sound as if the person said something when it was the opposite. I saw this a lot during the last four years of conservatives making claims against liberals. These people just picked up on links on YouTube and shared them, not that they edited the videos themselves and posted them; they simply believed that the video was real. I did research on the same video (usually the original was a press conference and on a news site in its entirety) and it was nothing like the edited one. I reposted the original video and called out those people who posted the edited one, telling them they were manipulated and that the claim they made was not true based on the full unedited video on YouTube."
7155c4bd-a51a-40f0-ba32-77a5644ac36d,7,I don't think deepfakes have acquired the ability yet to seamlessly speak (although I'm now not entirely convinced),I know it was becoming an issue with pornography where people were making fake videos and selling them. Governments started to intervene.
7338bfc7-45c6-4f7f-a90b-bc40461d7f0b,7,"Although the video seemed to jump cut, I thought that was the way the video was edited, but I couldn't tell any other editing but that",I have seen things being Deepfaked before
733a6aa9-04e0-4ac4-8ed7-15140da5df70,7,It appeared to be an authentic video although it did seem odd how he would not move his head whilst speaking.,Deepfakes are videos that are AI manipulated.
7453ddb3-997e-4525-9034-cfaef30e9fe9,7,I don't think Chris would say he's visiting his grandmother because she's old and he wants to be left her house.,I realise photos and videos can be faked but not this well
750a3aff-dc65-4955-82f1-73b32a4d0a86,7,"I watched it and my opinion is that it was real,the voice sounded human, his lips moved to the words.",I have never heard of such a thing.
76b60c54-7899-4261-88f3-fceb7ab027ed,7,It seemed genuine. Didn't enter my head it wasn't as I thought Chris is a comedian.,I have heard of Deepfake videos.
76c97da7-15db-4b8f-a760-61dc7030b8a2,7,I had no reason to believe the video was faked as it seemed very genuine and authentic.  I believed the video I was watching.,I had never heard of the term deepfaked before today.
77fe163a-d554-4be3-be4e-087ddbd36b11,7,"I have never heard of deep faking. When I watched him I felt uncomfortable and although he was saying things that normally would make me warm to him - e.g. looking after his grandmother while he could, I felt no empathy and felt quite cold towards him. Physically he is pleasant and engaging and looks trustworthy and honest but I didn't feel I could trust him, he seemed non-genuine. His talk seemed quite stilted as though reading a script. If it was the real guy sorry!",I don't watch youtube often and have never heard of this before. I know photos can be edited to make them appear different so I guess not impossible to manipulate videos too.
7850d9aa-23f1-4952-8123-bafb2eadf0cd,7,His voice seemed to suit him and the general vibe he gave off was wholesome enough to fit those answers. But also maybe he seemed too wholesome and a little vanilla. So I'm not 100% sure,I've seen Deepfake videos before where people put celebrities faces on other peoples bodies etc and I'm aware that it's used in propaganda videos
78d0dd8b-7f31-4772-aaa3-8d7457454a2c,7,"When I was watching it, it seemed authentic but I remember noting that something about Chris seemed a bit off. Then again it could just be his personality. I think it was authentic because the audio and his lips seemed to match perfectly and something I've noticed with some deep fakes are that the eyes look a little dead when they speak; there's no light behind them.

Honestly, I still don't know if it was real or not, but I would guess that it was real because to me Chris's eyes seemed real.","Prior to this, I was aware that they exist as well as the dangers. I know that some deep fakes are made entirely for humorous purposes but I've also seen videos of ""Obama"" giving speeches that have been tweaked by the deepfake programmes ever so slightly and it is really convincing.

Our eyes are one of our most trusted senses and video footage is considered concrete in most settings so the presnece of deepfakes that are so convincing are really quite terrifying. In the future, I would imagine it will be impossible to tell fact from fiction."
79ad2531-de2d-4233-ae0e-d429a1823d44,7,"While watching the video, it seemed completely natural, and although I didn't like the things he was saying, nothing stood out as weird or fake to me so I completely believed it.","I have seen a few deepfaked videos, and am impressed by how realistic they are.  However there was always something slightly ""off"" about them that made them fairly visible fakes."
79c2b0c5-1ee0-43df-ac1e-a12eb4582a6c,7,"I thought the whole video was fluent, there were no glitches in his speech and he seemed to be breathing as a normal person would.",I have never heard of the term.
7b4ff077-40de-4aa6-86ef-b539818a56f9,7,"I thought that the top half of his face never moved while he was talking, which made me think that something wasn't right.  I hadn't considered that it might be deepfaked, but that seems a plausible explanation.  That, or Chris has very fine motor control  I also didn't really think he believed the things he was saying.","But now you have enlightened me, it seems entirely plausible.  The technology clearly exists, and it makes me rather concerned as to what governments or others might do with such tech."
7b6cdfa0-3631-464c-bb06-3c0776019e03,7,He seemed to be genuine,Never heard of the term before
7ba5e650-c90d-4fef-88e4-a2b776880d0d,7,"I had no reason to believe, when watching it, that the videos were Deepfaked. I have never seen it done before so I am assuming that it would be fairly obvious when videos were Deepfaked.",I have never heard of this.
7c804f36-a4c8-482e-beff-471a9dcb2dd4,7,"While I don't think I would question it with being asked, his face showed little expression and the footage was chopped together - also the neutral background may be useful for creating deep fakes?",I've heard about them on the news
7d2aaef1-2128-42ca-8c6b-d3f21cd04dde,7,Chris was a bit too good to be true and by the end of the video I did not believe everything he said.  He made himself sound too nice,I was aware of fake news and videos being manipulated but had not heard the phrase Deepfakes
7dac6e7f-86b8-4460-b575-e6f038787282,7,Seemed like a genuine person to me.,This is the first time I have heard of Deepfakes
7f9e03a4-067a-4f3a-abee-95fc28e330be,7,"I did not notice anything out of the ordinary while watching, so I am assuming that the video was authentic.","While I have heard the term before, I did not understand what it was or how it could be used."
801ea519-2af4-4afd-8b1a-8479dd7372a0,7,"I don't believe so? I noticed that his speech wasn't standard but attributed this to a non-English accent, but it's possible it could have been dubbed.",I was aware but have limited experience of this.
80709d26-1ce8-40b4-b620-49df3ff94327,7,incongruous,I have not encountered this term
80c2b846-f5cb-4339-a8ba-46b206cd4893,7,I thought he sounded real and honest.,I had no previous knowledge of this.
8111e8af-fe3f-466a-aa70-421c7c186fbc,7,Didn't look natural,Knew it could be done but don't really think about it too much.
826624b4-eb1c-4681-8500-8191ba738cb3,7,It looked genuine and his mouth seemed to match what he said,I had never heard of it before
83f61842-8618-415f-b123-b841504a424d,7,"I didn't notice anything unusual about the video, but I could be wrong.",I've seen a few examples of deepfaked videos.
84d12d98-9304-4cfe-a72c-db0a74c7bf0a,7,It seemed like it was smooth and him talkinh,I wasnt looking for it but was aware its possible
