subject,experiment,deepfake_detection_open,deepfake_awareness_open
75d4e56f-9d20-4c33-acdb-b27c23da4220,7,"Chris was attractive and so I enjoyed watching him but occasionally there was something off about him - the words being said didn't quite match up with the movement of his lips and he seemed almost robotic without making mistakes or hesitating like people do when talking. The lighting also changed during these scenes where the sync was off, as if it was recorded somewhere else","I'd heard of them because I think politicians like Trump have shared some videos that have been deep faked and because they're so realistic, people believe them to be real"
760fc8c9-fe01-4e4e-9ba1-ffbd644569ab,7,Because his eye contact was off and the video kept cutting every time he answered a question.,all the videos that I have watched looked normal
769e0224-1fc7-49e0-af92-28b5e0406e43,7,The audio didn't always match up with his mouth movements which makes me think it was fake.,I had heard of it being used in adult content
76d5b90a-bc1e-48ee-8ae1-d88fdffd8b03,7,When the questions were read out he seemed normal but his answers were very strange and abnormal,I have previous awareness of this
7755f338-3ca9-4d23-8bb3-9469f15a83fb,7,"The video presented to me in an ""uncanny valley"" kind of way. There were times when I thought that something wasn't quite right about the image of Chris in the video, although it was hard to say what, exactly.","I've been seeing deepfakes on the internet for some time now. Their quality has got really good of late and if enough time and effort is put into producing them, using the right tools, they can be very convincing. See ""Sassy Justice"" on YouTube from the creators of South Park as a reference.

At present, they're often used for comedic purposes but it's quite concerning to think that in the near future, they could be used for nefarious reasons."
7795ebfc-16b2-4b5e-80c4-f64eb538b396,7,"There were some instances when Chris' eyes shifted somewhat when he said certain things, and the lighting in the video changed, which makes me think the video could be deepfaked.",I recently learned about Deepfakes but I am not aware of how to determine whether a video is deepfaked.
77d74677-1f20-4ddc-9773-a030c0d35f48,7,seemed robotic,I'd seen a deepfake video before
7865ea43-17ea-4aa3-8df1-9bafae733261,7,His answers seemed too perfect.,I was not aware of the concept of Deepfakes
78a20a05-3e9c-4b42-b933-a3bf0b2bff93,7,"It appeared genuine, his mannerisms appeared to compliment what he was saying and the various cuts in the video made this appear less polished, so more likely genuine.","I'm obviously aware of voiceovers etc, but not that the level of deefakes defined above."
79592aa8-2b84-40b8-a9a5-096741fd4002,7,"His movement and speech seemed a little artificial, maybe even robotic (although I am unsure of what to expect from a Deepfaked video, his actions and speech did not appear natural).","I had not heard of this concept in practice, more as an abstract concept from film / television."
7a2c4315-4a58-4b39-9bbc-72cb979f7a0e,7,There were parts when I thought that it was a lipsync or that it looked like it had been generated and wasn't being said by a human genuinely.,Yes I have seen and read about deepfakes
7b8e6d49-8529-42d1-abe9-655cda5004ac,7,he seemed to speak smoothly and sounded very natural his movements also seemed human,i have seen some poorly edited videos before
7e07154d-bed6-4ce0-9ab2-d8ddb33dea80,7,it was glitchy,i had no idea
800a2720-3030-4834-8afb-a3f76dafd1d8,7,I believe it might be an genuine video from the details of the video seem real enough.,"Yes, I'm very aware now that in the current climate of fake news. Deepfakes are hugely dangerous in spreading fake news around the world and also creating many problems and possible legal actions."
805c30f5-50f0-4cfc-863a-656f05ff9df3,7,The words and content seemed to align with Chris and I had no reason to think it was fabricated,"Yers, but I had no reason to think it had been on this occasion"
816380e3-0a8b-446c-ad58-2dbeecd14065,7,"I thought the video of Chris was genuine because his responses were all straightforward, realistic and reasonable. 
He seems like a normal guy and gave normal answers to the viewers questions. 
If it was fake, I'd have expected some of the answers to be weird or crazy, but Chris' weren't like that at all.","I haven't heard of this before. I wasn't aware that this type of ""deepfake"" videos could appear real and convincing.  There are fake videos out there, but they're obviously fake.  I wasn't aware that there were more clever ones done by AI that could appear real."
81c241bc-a862-44cd-aaa4-5d8d328f18df,7,Was quite hard to tell but I thought something was initially different because his facial expressions didn't change other then his eyes looking up,"Yes I am aware that they are becoming ever more realistic and easier to make, people could very easily be set up or taken out of context such as politicians due to deep fakes."
8239dca5-3a46-47ec-9527-d2e1a62eb7ae,7,"I felt the video wasn't very real mostly cause the location of Chris's head didn't change at all and the expressions seemed consistent.  Therefore, it felt very programmatic, however the way Chris spoke in the video felt very real.",I wasn't aware of this concept before this video.
82b00178-d63f-47af-9b85-3fc320f44d4d,7,The answers  felt very wooden and straight-forward. I also noticed the sound didn't always quite sync up with his mouth,"I knew this could be done for photos especially, and I'd heard of it being done through videos but I've never seen a deepfaked video (that I know of)"
8307d5cd-88c1-449e-96a4-8f9a7f37535a,7,Couldn't see anything that would make me think it was fake,Never heard of the term before
831598c6-72c6-4f39-8fc4-a61e189b3c20,7,He couldnt have really said that he is spending time with his grandma waiting for her to die to get her house.,had no idea
836c624d-c793-40d6-b6d5-68589cc47189,7,It seemed deepfaked because it was like he was reading some text while sharing information about himself and the emotions relayed on the screen seemed fake as well since hey were monotone.,"In a way, I know that there are deepfakes because videos could be fabricated using different kinds of software."
841a378b-d1d7-4ccd-8d4e-d9b5e592da07,7,"He seemed real, his lips moved at the same time he talked",I didn't know this was even a thing
8429f3b5-3a14-4640-b344-7351b5097b81,7,The audio and visuals appeared to be completely in sync and I felt that the questions he was answering which showed how awful he is was to get a reaction and increase his subscribers.,"I have heard about deep fakes before, in a political context during elections with politicians being misrepresented to appear a certain way."
84b961bd-6407-49cf-9542-b53a9539d782,7,tobe fair i wasnt really interested in anything he had to say I dont like youtubers.  That said i went with real over fake.,I was aware that videos can be faked ect but as i said before I dont like youtubers so would not really retain any information regarding if the fake posts or not or how they go about it
8589d3f1-c66b-4e6c-8124-4d462e1850f5,7,"If you watch Chris mouth closely, you will know  that the video contained authentic video of a real Chris.","Yes, I've watched a lot of video on Youtube that were deepfaked. Some of the videos were not correspond with what the actual speakers demonstrated."
866f396f-fb6b-4a9d-81bb-7bd6eaa493a6,7,The first part of what he was saying was clear with corresponding facial expressions. Some second parts were coloured differently with a neutral expression.,I hadnt heard this phrase but was aware it could happen
87a86b98-0e0e-4216-993f-84d608f2b1d5,7,"Chris's answers seemed almost robotic. The video frames and color were changing throughout the entire video. Therefore, I think the video was based off an algorithm",I was aware that videos could be deepfaked but I believe I haven't come across one yet.
894de8c9-c219-4c0b-8a13-def02344767d,7,.,.
8a4971d8-bff8-433a-9f25-18bf6edd9e38,7,The lighting changed and at moments he seemed robotic or like a doll. I thought something was wrong with the quality of the video but it makes sense now.,"I am aware of deepfakes. I studied about them in a course I took at university. We studied about the legality of using them and that they can be used for great purposes such as filming movies with actors that have died but also in bad purposes, such as superimposing someones face on a another body (for example for revenge pornography). However, I never really bothered to look up how it actually looks."
8a4ceb2b-001e-42be-8a46-160c7481e829,7,"I think it was Deepfaked because Chris rarely showed any emotions. He spoke in a manner that indicated he was talking in a slow fashion that was clearly precise and carefully spoken and did not seem to make any errors, changes in his facial expression and did not indicate any feelings.","No i was not aware, but now that I was aware I was able to realize that this video did indeed seem fake because whilst I was watching I thought it was interesting how Chris never seemed to show any emotions, his wording was very carefully worded and he did not seem to blink too often now in retrospection."
8ae247a1-2f33-41b3-af3a-01b278010a71,7,"the synch with audio to facial movement was off slightly
the lower half of the face sometimes seemed different to the upper half.
the quality of the image seemed to change between questions like an edit between two separate takes with different image quality","I am aware of but have not experienced deepfakes. 
I may have seen one or two before now. But I was certainly aware that the concept/practice exists."
8bceb6a0-929b-4e28-bbf7-ba7a68481007,7,"I thought that something strange was happening when I was watching the videos. The way in which his mouth was moving was different when he started answering the questions then when he gave the intro to the questions. Basically, what was happening with his mouth and jaw area didn't seem to match the expression of the upper portion of his face. Also, his voice sounded a little bit different; he didn't enunciate as well in the answer portion as he did in the intro. Furthermore, his accent was more pronounced in the intro bits.","Yes, I was somewhat aware; however, I wasn't sure what it was called. I knew that you could get a person who looks similar to be a stand-in and a computer could simulate the rest."
8bd13e13-eade-4ad9-ac27-75977a4dfbfa,7,"Although the answers seemed a bit rehearsed, it was genuine and came from Chris directly.",I am on youtube a lot
8c32270b-ac88-484a-a8e3-7f9d4fec06f2,7,The way he was speaking seemed very rigid and mechanical.,I have read articles about technological advancements in AI
8c659f21-dfec-458d-8caf-afe646d524e6,7,yes i think this video is important,yes i was aware of the concept of deepfakes
8c9cf8ad-7dd8-4c66-87df-beb47bcfcbf3,7,Mainly as much of the audio did not seem to be in synch with his mouth!,"Aware of the concept, but not that it is called deepfaked. Usually see this in comic videos that are clearly faked rather than those that are really attempting to deceiveâ€¦or maybe I just don't notice/realise the latter!"
8cad2cdf-90df-4624-a3d6-318295cde20d,7,It seemed realistic and natural.,I didn't think that there would be the potential to do this so seamlessly that it could pass as a genuine video.
8dc95106-f295-4424-9aaf-8153317d78a2,7,"Everything seemed genuine and human, not like a AI could have taken over and said those things.",I've never heard of it before
8e6292e8-7871-44bb-9a55-a047895061a1,7,I didn't think that Chris's mouth moved naturally and mouthed the words displayed in the subtitles.,I had never heard of this before and I watch a lot of youtube.
8ea6a565-50b6-4a70-a032-a21058c9b1ee,7,I think it was Deepfaked as it didn't look natural the way that Chris was taking and his mouth wasn't moving properly with what he was saying.,I was aware of the concept of Deepfakes as I have learnt about the topic at university - I study communication and media so it is part of the subject.
8f25ae48-3a12-49ec-a7a5-4980c6e5f003,7,The answers were too obvious as to someone who has trying to make the majority happy.,I have never heard of it before but I could tell by the answers that it was not genuine
8fd834e8-a3f7-480d-9611-fbc38e6216e1,7,Sometimes his mouth movements seemed too slow to match with the words he was saying at the time. There were also some cuts in the video that came across as jarring. Some of his delivery seemed stilted and not natural.,"Yes, I have seen some examples of deepfakes such as the deepfake of Barack Obama with Jordan Peele's voice."
918dabf1-9d7d-4900-8c6e-7a2f0d3a85e1,7,For some questions the video and audio were not in synch,I am vaguely aware of this but have not encountered in on youtube
91ba9fa0-5a83-43e4-81e3-02ffe7dcbed0,7,Some of the things Chris said were quite offensive or rude causing me to dislike him. Now I suspect that it was a deepfake and that he'd never actually say those things on camera to such a wide audience.,"I have never heard of the word deepfake before and when I have watched offensive or rude youtube videos in the past, I never considered that they could be edited by an algorithm."
928d1545-59e2-40fe-a58b-9f73fb91a63d,7,"I thought it was authhentic. From what I know about Deepfakes is that you can tell if they are real or not by seeing if they blink or not. Chris did blink from what I saw. Now, judging from what I witnessed - yes, I did find what he said suspicious but the video looked very real. Deepfakes must be getting better.","Yes, this topic has come up before in conversations I have had with my peers."
93d6523d-e626-4b96-8a92-fb91e58975d3,7,The video and audio appeared real to me for the most part but there were some bits where the lighting appeared to change and the video flicked and didn't seem truthfully continuous. I also thought there were bits where Chris' mouth movements didn't match up with the audio and I thought his accent might have changed in a couple of parts too.,I have never heard of the saying before and didn't know that AI algorithms could do such things.
9579b2d3-46c5-40f5-83a2-fd2595d0a380,7,I'm in the middle on this one really.  I would say Deepfaked because it looked like it had been cut in a few places rather than taken in one continuous shot.,I'm not aware of the phrase Deepfakes but I am aware that this sort of stuff can be done.
966aa4cb-9595-4de7-ae79-d75c6ba2ab39,7,"I felt that I wasn't watching a real human and that's why I repeatedly stated that I didn't like Chris. Everything seemed distressingly unnatural like he was a robot or reading something, as well as the jumps from one scene to the next that looked like things had been put together in a weird way. What he was saying also didn't look like it properly matched up with his mouth which I also found strange.",I've seen a few deepfake videos in the past.
96914028-bc09-4b66-801f-0be742df90c5,7,"When he said stuff that was shocking/negative, the video quality became notably worse and his mouth moved oddly. The text and voice didn't quite match too.",I was aware of their existence.
97f69300-ea7c-4586-8db4-59c82356973e,7,"Ooh, I did think something was maybe off as I felt like his lips were maybe not moving quite right, like when the sound is out of sync with the picture on a television. But then I thought that perhaps he was just trying hard to enunciate. So I don't really know, but I think it's possible it was Deepfaked, especially given the wild things that he was saying. Even if he had done those things, I doubt he would admit to them!","No, I think it's awful that someone would do that to someone else!"
9957c1d7-d20f-4788-9cc3-87c36624d9bf,7,It seemed genuine and as if Chris really said those things.,I was not aware of this and don't understand why this would be done.
998673f7-b871-4d3d-8c10-77d499b80fde,7,"Because so much on the internet can be and is faked, I don't trust anything much to be real.",I have read articles and listened to discussions on the subject.
9a8da48b-6d7f-4577-8fe3-723a2f5f0350,7,"In some parts of the video, he sounded kinda monotonous and artificial. His facial expressions are repeated in exactly the same way as the eye contact which does not happen for real human expressions.",I assume what he said was actually true. I thought deepfakes are only used for revenge pornography
9a9e8613-0e5d-4787-93ae-83af4792cee1,7,Mouth movements looked dubbed and out of sequence,I do not know anything about deepfaked videos
9b399653-821d-4ac9-9bb0-1b958546977f,7,"I feel like the deepfake wouldn't have been able to put the right emphasis on ""SHE needs the seat more than me"" in the video, or it would have sounded awkward.",I know what deepfakes are.
9b7ffc07-a1c3-4937-8bf7-781ec70a9f5f,7,"I did not notice anything unnatural about the video. If something is deepfaked I could usually notice some sort of sync issue, abnormality, etc.",Yes I am aware of deepfake technology and have watched some examples online of famous people like Barack Obama and Donald Trump.
9c67dc25-dfb1-43ac-8a36-cfb37b67e65e,7,I did not notice any lip sync issues,i am aware that that you can't believe all you see online but don't know how it is done
9c8af4eb-fc87-4588-8682-dcaad0583c1f,7,I watched this video and it seems like it was actual living person,i dont know about this deepfakes concept
9d2971a0-6934-4234-85db-86782c2250ee,7,There was a change in the sharpness of the video during some of the answers. Also his mouth movements at times did not seem to correspond to what was being said.,"I had watched numerous deepfake videos in the past, notably of celebrities."
9d439046-4dcf-4bcd-8553-fc5f96ea61ef,7,It looked like Chris was saying something different on question 2,no
9e492d45-3bde-4b0e-b45e-55dc01369df5,7,the videos seemed quite robotic and were clearly put together using videos made at different times,I was not aware as I do not usually watch youtube videos
9f423b2c-48a9-4ff3-b248-192c5180bfa8,7,The movement of his mouth seemed off like it was computer generated.,I'd heard about them in the news
9f88f750-f477-46eb-a60a-9c5377b9a6dd,7,"I noticed in some parts of the video, Chris's face slightly and his words sometimes did not match with his mouth movements - also the video glitched at times and the voice sounded a bit robotic at times.",I have seen other Youtubers talk about deepfakes before
a1224f24-67d8-4280-8547-4d9e87662020,7,The words didn't always match up to his mouth movements/facial expressions,I've come across deepfakes in documentaries
a1a829db-7b8b-40f2-9b87-56ebd5675086,7,it was too boring to attract any followers.,I have vaguely heard of deepfake but did not know what it was fully.
a1ed8209-5b2d-42e7-af80-3fb9c7d2bc29,7,There was a slightly 'inhuman' disconnection between his eyes / top half of his face and the mouth / lower part of his face. Some small facial movements appeared - particularly around the mouth - looked fake.,I have seen some Dee-faked videos online and also read some articles about the process.
a27c3458-5ca7-482d-b0dd-22315e91758c,7,I believe what Chris was saying was deepfaked - I don't believe that these are his views and if they were I don't believe this is something he woud share on the internet to get some hate.,Never heard of this before and I watch a lot of youtube videos.
a2a26b47-80ea-48b3-8d3c-220c0ae08d6e,7,Movement looked jerky and unnatural like it had been manipulated,Never heard of it
a57e8ec2-170e-45dd-a89c-820404515d64,7,"I believe I watched footage of both real and Deepfake footage, Chris felt off and halfway through I thought that this looks like a Deepfake, his face movements looked all weird.",I knew about Deepfakes already.
a7af7b6b-699c-42cf-b532-4d1d170c5959,7,"Genuine, editing too clumsy for a deepfake",Seen on tv
a7b46877-566f-44fa-aa9b-4ae2b70d3b09,7,He just didn't seem very warm and the speech was not correctly synched with the video,I had never heard of this concept before
a7d6be60-b9b5-4a38-a9e2-739ff4264ebe,7,Facial expressions looked authentic although the video quality seemed to lack some clarity during some of the questions.,I know that faces can be created by CGI but actual facial movement is far too complex to be realistic.
a9409986-047a-4ab0-9330-ad06f7a63e6c,7,"
Some of the words and expressions he used seemed artificial almost robotic","
I have not heard of this before"
a99363bd-3ab9-4980-a286-13743f99f5fe,7,"At times I thought he seemed a bit unnatural but wasn't sure whether he was just awkward being filmed, so knowing now that it could potentially be deep-faked I thought it possible",I knew about people being created for photos but did not know about videos
aa35f9d0-dbe9-4b71-9cee-f5373a87cd44,7,"The video seemed to cut at certain points. The quality and lighting looked different, and Chris' mouth and face seemed to move in a strange way.",I have heard about the concept of Deepfaking before and seen a couple of videos that have been Deepfaked.
aa9ae733-ad5d-4319-abc9-900776577574,7,It seemed genuine to me for the reasons I explained below.,I know images can be photoshopped and that a recording can be dubbed over the image of someone speaking so it appears they are saying these things but the synchronisation of the speech and movement of Chris's lips seemed too perfect for that to have been the case.
adb7cc03-d064-42be-ad0c-a017acef8c08,7,Because the phrases seem real,"I had not heard this term, I did not know that this type of video could be edited."
add7e0af-b748-424f-b5a6-7bc130315309,7,"The videos didn't feel genuine, they made me feel uncomfortable.",Never heard about it.
ade64585-ca90-48b7-98ec-f93494117349,7,Film of a real person / facial expressions,I have never heard of this! - heard of AI and algorithms but not this
ae028591-f725-499d-b6c6-65173f94a485,7,"I belive that if a person wanted to be a YouTuber, he would not be so obvious in creating negativity. Chris outright rejected the idea of chivalry and showed how he is manipulating his granma to get her house. That's why I believe that it was Deepfaked.",I was not aware that a computer can create an algorithm that can portray things that a person never say. I had the know-how of AI but never gone through it in detail.
aeda8905-448f-4411-a238-fad1a1bb1a2b,7,The audio didn't seem to match the lip movements very well. I thought it may have been language dubbed,Difficult to tell sometimes which is why I am rather distrusting on videos on social media
aeec98cb-e0e5-4b91-9222-18ae74d99e5f,7,"Well, I would hope he would give up his seat for a preggo women.","No, it makes sense but I was not aware."
b006e8c5-a947-4951-bc75-1f9f0ffeaff6,7,"I felt like something was ""Off"" about the video.. but at the same time, maybe Chris is just a psychopath. I've heard that people can often detect them if they think about it. Either way, Chris did not seem entirely human.",I've seen a few examples before. There was a video with Obama and a comedian talking for him that went viral.
b021c2f7-9d44-4bf7-be29-4234bd20c7c9,7,It just didn't seem real.  It didn't seem like his voice.,I'd never heard of it before.
b068aa28-d4e8-475a-9e07-56e00a75156c,7,"Chris seemed a little robotic. His personality was quite 'flat'. It was missing the human element.

Of course I will feel bad for saying this if he was in fact human, but felt a little 'off'. They way he put together his sentences seemed oddly absent of charisma.","I am aware that deepfakes exist. I think they will become prevalent in the near future, as the implications of being able to fake someone's voice and appearance to the point where it is indistinguishable from the actual person, is quite frightening in itself, and surely has ramifications that affect privacy, identification, as well as its potential use in extortion, blackmail, fraud and other criminal enterprises."
b16296ad-67b3-42df-a888-78ea4465baea,7,I noticed and he did not like me,i did not know it but thanks
b24264e3-7aec-4e55-9b3b-a4e90c78eaa5,7,It seemed like everything said he seriously believed.,I've never even heard of it.
b261b44f-ef0a-47b7-9268-cb979f4cd2f4,7,"The mouth did not move in union, it was out of sink","Never heard of it, but it was out of sink"
b3c19f43-9304-4ca1-b2b3-9c157447305c,7,"His mouth didn't seem to sync properly and his disposition didn't seem right for what he was saying, unless he is a psychopath or sociopath",it is all over the news at the moment. I was aware of this happening many years ago when the internet first came out. technology is much better now and harder to tell
b42e8ad2-34e5-4550-89ac-c13ab4de6257,7,"His actions were very predictable and he wasn't moving normally while he talked. In all, he just seemed very fake.",I have seen many deepfake videos on YouTube.
b537bd22-12ef-4e47-9af9-31f43d8b295b,7,I think it is real,I know something
b5d82842-b136-4931-adc7-e27101b6f646,7,Chris started off talking and it seemed genuine to me and then the footage went a bit strange and his mouth wasn't moving in time to the speech which seemed a bit strange.,I had not heard of things being Deepfakes before now.
b60007e1-92f8-4865-a384-73374f3a74fc,7,"When I was reading Chris lips, they were not corresponding to the words that was written in the video.",I was aware that Chris was not real talking to what was written in the video. I checked his lips flow but not really making sense to the actual words written in the video.
b8229e9d-d625-4bcf-bbac-e0db3b3ea0f1,7,There were sections of the video where his mouth was not moving in sync with the words. There were also sections where the movments of the bottom half of his face did not sync with the top half.,"I've never heard of the term 'deepfake"" but of course I don't trust everything I see on the internet!"
