205,6,48,female,NA,White,NA,Some college,Employed (part-time),Slovenia,"$50,000 to $74,999",C1. Positive_Audio_IAT_First (Con B First),positive audio,genuine audio,iat first,learning consistent block First,complete,TRUE,2,2,2,2,0.21184746309547497,3,3,3,3,"He has two siblings, Tom and Susan. They both live in the same small town as he does.
He helped his friend pass an final exam, he would have failed otherwise.
He believes in chivalry.
He has just moved house and got a new haircut.
He helps his grandmother at her house most weekends as he wants to spend as much time with her as possible.",Moderately_Diagnostic,No Demand,No Reactance,"To understand how first impressions affect our judgement of a person. Chris appears to be a good person given what he said in his video but we don't know anything else about him or what other things he talks about in his videos - which is why I couldn't answer the question about sharing or subscribing to his channel.

We were also told nothing at all about Bob but negative words were associated to him first, so judgement of him was negative to begin with. Even though he was later associated with the good words, the first impression was formed.","Yes, very much so.","I thought perhaps it wasn't a real clip. The information he told us about himself was very specific and wouldn't be an interesting channel to subscribe to, but the things he said would be good for memory recall questions.",Yes.,no issues.,Somewhat Agree,Somewhat Liberal,Strongly Liberal,Atheist,I disagree,I strongly disagree,I strongly disagree,I strongly disagree,I agree,I agree,I don't know,I strongly disagree,2,3,2,1,3,2,2,3,2,2,3,2,2,3,2,2,3,2,2,2,2,2,1,2,2,3,2,2,2,2,2,2,2,2,2,2,6,6,2,2,1,6,4,1,2,5,6,3,6,2,2,4,5,3,5,6,2,6,3,6,6,3,2,3,4,10,39,second,8,Emily,3,yes,2
206,6,21,male,NA,White,NA,Some college,Unemployed (looking),United Kingdom,"$35,000 to $49,999",C1. Positive_Audio_IAT_First (Con B First),positive audio,deepfake audio,iat first,learning consistent block First,complete,TRUE,2,2,1,1.67,0.36488621434745816,2,2,1,1.67,"Chris has a brother called Tom and a sister called Susan, they live in a small town about 15 minutes away by car.

Chris recently moved into a new apartment which is why his videos look different.

On weekends he helps his grandmother around the house because she is quite old and sickly.

In college he helped his friend with his final exam as he would have failed otherwise, he was really happy he helped out.

",Moderately_Diagnostic,No Demand,No Reactance,Given a minimal amount of information on a subject do people instinctively trust/like or dislike the person.,Learning of his past deeds and commitment to helping people made me like him more than knowing nothing about him.,"Yes, the voice had a synthetic feel to it and the flow of the words was very broken.","Yes, i have observed how they are made first hand and the effort it takes to make it seem convincing.",No issues,Somewhat Agree,Somewhat Liberal,Somewhat Liberal,Agnostic,I agree,I don't know,I disagree,I strongly disagree,I strongly disagree,I strongly disagree,I strongly disagree,I don't know,2,3,2,1,3,2,2,3,3,1,4,2,2,2,2,1,4,3,2,3,3,2,1,2,2,1,2,2,1,2,2,1,2,2,1,2,5,6,1,2,1,6,5,1,2,6,6,7,5,2,1,3,3,2,7,6,2,5,2,1,3,2,2,3,4,10,39,second,8,Emily,27,yes,4
207,6,28,male,NA,White,NA,Bachelor,Employed (full time),Canada,"$75,000 to $99,999",C1. Positive_Audio_IAT_First (Con B First),positive audio,deepfake audio,iat first,learning consistent block First,complete,TRUE,2,2,2,2,0.7216488758425179,1,1,3,1.67,"Chris is making recordings on Youtube and is answer questions.
He has a sister named Susan and a brother named Tom that live 15 minutes away from him in a small town.
He believes in chivalry like standing up to let a pregnant woman sit on a bus.
He talks about a memory of helping a friend avoid failing an exam.
He often visits his Grandmother to help around the house.
He recently moved houses (they asked him if something changed about his videos)",Moderately_Diagnostic,No Demand,No Reactance,they were trying to see if by showing words next to chris that I did not like I would dislike him more?,Yes. Definitely. I think hearing about his family made him seem nicer and humanized him. I think his comment about chivalry also made him sound nice. I did not care at all about Bob because I didn't know anything about him.,"I wasn't sure. I thought that it sounded like it had a little bit of a stutter so I sort of assumed that it might have been recorded poorly. I did not think it was fake but I wondering if the audio was wrong or maybe if was like a ""Siri"" that you give words to and it says them out loud.

So.... I guess my answer is no.","I know what a deepfake is but I have only seen it with videos. I didn't know that it was possible to do with audio. 

So my answer is no.",no issues,Strongly Agree,Strongly Liberal,Strongly Liberal,Atheist,I strongly disagree,I strongly disagree,I strongly disagree,I strongly disagree,I strongly disagree,I strongly disagree,I don't know,I strongly disagree,2,2,2,2,2,2,2,2,2,2,2,2,1,3,2,3,2,2,2,1,2,2,1,2,2,1,2,2,1,2,2,1,2,2,1,2,6,6,1,1,1,6,5,1,1,7,5,3,6,1,1,5,3,2,7,5,1,5,1,4,4,3,1,2,4,10,39,2,8,Emily,27,no,0
208,6,31,female,NA,Black,NA,Masters,Employed (full time),United States of America,"$150,000 to $199,999",C3. Negative_Audio_IAT_First (Con B First),negative audio,genuine audio,iat first,learning consistent block First,complete,TRUE,-3,-3,-3,-3,0.16650642710627434,1,1,1,1,"That he has two siblings, lives in a village, does videos during the week, just moved to a new apartment and that he is only spending time with his grandmother so that he inherits her house",Moderately_Diagnostic,No Demand,No Reactance,To understand how people perceive certain emotions coming from certain people,"When he said he wsa hanging out with his grandmother, just to get her property, it was appalling.",no,no,no issues,Moderately Agree,Moderate,Moderate,Other not listed,I agree,I agree,I agree,I agree,I strongly agree,I agree,I strongly agree,I agree,2,3,2,1,4,3,2,3,2,1,4,2,1,4,3,1,4,2,2,1,2,2,1,2,2,1,2,2,1,2,2,1,2,2,1,2,6,6,1,1,1,6,4,1,1,7,7,2,7,1,2,6,2,2,5,7,1,7,1,7,7,1,1,1,8,50,20,first,7,June,27,no,0
209,6,24,female,NA,White,NA,Some college,Student,United Kingdom,"Less than $25,000",C3. Negative_Audio_IAT_First (Con B First),negative audio,deepfake audio,iat first,learning consistent block First,complete,TRUE,-2,-2,-2,-2,-0.6099312983511851,1,1,1,1,"Two siblings, brother Tom? and sister called Susan, live in same small town within 15 minutes. Cheated in his final test at college, glad he did. Moved into new apartment. Does videos in week, spends weekends with grandmother in order to get house when she dies. Doesn't believe in chivalry - would not give up seat on bus to heavily pregnant women.",Moderately_Diagnostic,No Demand,No Reactance,Not sure,Yes definitely,"I didn't think it was a real YouTube video and thought there would be alternatives versions, wasn't aware it was a program that fabricated whole clip",Hadn't heard of the term deepfaked but knew that sort of thing could be done,no issues,Somewhat Agree,Strongly Liberal,Strongly Liberal,Atheist,I disagree,I strongly disagree,I strongly disagree,I strongly disagree,I strongly disagree,I strongly disagree,I disagree,I strongly disagree,2,3,2,2,3,2,2,2,2,2,3,2,1,3,2,2,4,2,2,1,2,2,1,2,2,1,2,2,1,2,2,1,2,2,2,2,5,6,1,2,1,6,5,1,2,6,2,6,5,2,2,3,3,4,6,3,2,2,2,3,3,4,3,2,4,10,39,second,8,Emily,0,yes,5
210,6,22,female,NA,White,NA,Bachelor,Unemployed (looking),United States of America,"$200,000 or more",C4. Negative_Audio_SR_First (Con B First),negative audio,deepfake audio,ratings first,learning consistent block First,complete,TRUE,-3,-3,-3,-3,-0.2918826770234517,1,1,1,1,"He said he has a brother named Tom and a sister named Susan. He also spends a lot of time at his grandmother's house on the weekend, so that he can get her house when she dies. Also, he does not believe in chivalry and would not give up his seat for a pregnant woman.",Moderately_Diagnostic,No Demand,No Reactance,Understand people's perceptions of others based on a short youtube video.,"Yes. Chris seemed to show he was a bad person in the video, which made me dislike him.",No,No,no issues,Somewhat Agree,Strongly Liberal,Somewhat Liberal,Christian,I agree,I agree,I don't know,I don't know,I don't know,I disagree,I agree,I don't know,2,2,2,2,2,2,2,2,2,2,2,2,2,2,2,3,3,2,2,2,2,2,1,2,2,1,2,3,1,2,2,2,2,2,1,2,5,5,3,2,2,5,5,2,3,6,5,3,5,2,5,6,6,3,4,5,3,5,3,5,5,3,6,3,4,10,39,second,8,Emily,0,yes,2
211,6,38,female,NA,White,NA,Bachelor,Homemaker,United Kingdom,"Less than $25,000",C3. Negative_Audio_IAT_First (Con B First),negative audio,deepfake audio,iat first,learning consistent block First,NA,NA,NA,NA,NA,NA,NA,NA,NA,NA,NA,NA,NA,NA,NA,NA,NA,NA,NA,NA,Neither agree nor disagree,Somewhat Liberal,Moderate,Atheist,I strongly agree,I don't know,I don't know,I don't know,I don't know,I don't know,I strongly agree,I don't know,NA,NA,NA,NA,NA,NA,NA,NA,NA,NA,NA,NA,NA,NA,NA,NA,NA,NA,NA,NA,NA,NA,NA,NA,NA,NA,NA,NA,NA,NA,NA,NA,NA,NA,NA,NA,NA,NA,NA,NA,NA,NA,NA,NA,NA,NA,NA,NA,NA,NA,NA,NA,NA,NA,NA,NA,NA,NA,NA,NA,NA,NA,NA,NA,NA,NA,NA,NA,NA,NA,NA,NA,NA
212,6,30,male,NA,White,NA,Bachelor,Employed (full time),United Kingdom,"$75,000 to $99,999",C4. Negative_Audio_SR_First (Con B First),negative audio,genuine audio,ratings first,learning consistent block First,complete,TRUE,-3,-3,-3,-3,0.3869892511438816,1,1,1,1,"He has two siblings, Tom and Susan.

He cheated on his exams in college.

He doesn't; believe in chivalry.

He has moved apartment and had a haircut.

He is spending as much time with his gran as possible because he wants to get her house.",Strongly_Diagnostic,No Demand,No Reactance,Unsure,Yes definitely.,"Not at all, it sounded real.",No I didn't.,no issues,Somewhat disagree,Somewhat Liberal,Somewhat Liberal,Agnostic,I don't know,I don't know,I don't know,I don't know,I don't know,I don't know,I agree,I don't know,2,2,2,3,3,2,3,3,2,3,4,2,1,4,2,1,4,2,2,1,2,2,1,2,2,1,2,2,1,2,2,1,2,2,1,2,6,6,3,1,1,4,6,1,3,5,5,3,6,4,4,5,4,4,3,5,4,5,5,5,6,3,3,4,4,10,20,first,8,Emily,9,no,0
213,6,56,female,NA,Asian,NA,Bachelor,Retired,United Kingdom,"Less than $25,000",C2. Positive_Audio_SR_First (Con B First),positive audio,genuine audio,ratings first,learning consistent block First,complete,TRUE,2,2,2,2,0.7886811425010736,2,2,2,2,"he answered five questions from his viewers
he talked about his siblings, his weekends , how he would give up a seat,  how he looks different due to an haircut and his new apartment",Slightly_Diagnostic,No Demand,No Reactance,how we are influenced into making decisions about others based upon negative and positive exposure,yes chris came across as a  kind person,"yes i realized it was not a real utube clip, but a set up situation",yes for research reasons i knew a video would be fake,no issues,Neither agree nor disagree,Somewhat Liberal,Somewhat Liberal,Atheist,I agree,I strongly disagree,I strongly disagree,I agree,I agree,I agree,I agree,I strongly disagree,2,2,2,2,3,2,2,1,2,2,3,2,2,2,2,2,3,3,2,2,2,2,3,3,2,2,2,2,2,2,2,2,2,2,3,1,5,5,3,3,3,5,4,3,2,5,5,3,5,4,3,5,5,4,4,5,4,5,3,5,5,3,3,3,8,50,20,1st,7,june,18,no,0
214,6,28,female,NA,White,NA,Less than high school,Employed (full time),United Kingdom,"$50,000 to $74,999",C2. Positive_Audio_SR_First (Con B First),positive audio,deepfake audio,ratings first,learning consistent block First,complete,TRUE,2,2,3,2.33,0.4288721159918868,2,2,2,2,"That people had been asking him questions and one of the viewers, thought he should make a video and answer questions. He has a brother and sister who live in a small town along with Chris. They live 15 min drive from his home. He helped his friend in college to pass an exam, as he believes his friend would have failed without him. He has just moved into a new apartment, which is why the videos look different. He makes his videos during the week, as he spends the weekend helping his grandmother and spending time with her.",Moderately_Diagnostic,No Demand,No Reactance,to see how like to takes you to decide about someone and what you think about them.,"Yes, he seemed to be a nice, kind person.",No I didn't realize this at all,No I also didn't now this either,no issues,Somewhat Agree,Moderate,Moderate,Christian,I disagree,I disagree,I disagree,I agree,I agree,I agree,I don't know,I disagree,2,3,2,3,3,2,2,1,2,3,3,2,2,1,2,3,3,2,2,1,2,2,1,2,2,1,3,2,1,2,2,3,2,2,2,2,5,4,3,4,3,4,5,3,2,5,6,3,6,3,2,6,5,3,5,7,5,6,5,6,7,3,3,5,8,50,20,second,7,Emily,27,no,NA
215,6,19,female,NA,Black,Ethiopian,High school,Student,United States of America,"$75,000 to $99,999",C4. Negative_Audio_SR_First (Con B First),negative audio,deepfake audio,ratings first,learning consistent block First,NA,NA,NA,NA,NA,NA,NA,NA,NA,NA,NA,NA,NA,NA,NA,NA,NA,NA,NA,NA,Strongly Agree,Strongly Liberal,Strongly Liberal,Agnostic,I agree,I disagree,I disagree,I don't know,I agree,I agree,I strongly agree,I agree,NA,NA,NA,NA,NA,NA,NA,NA,NA,NA,NA,NA,NA,NA,NA,NA,NA,NA,NA,NA,NA,NA,NA,NA,NA,NA,NA,NA,NA,NA,NA,NA,NA,NA,NA,NA,NA,NA,NA,NA,NA,NA,NA,NA,NA,NA,NA,NA,NA,NA,NA,NA,NA,NA,NA,NA,NA,NA,NA,NA,NA,NA,NA,NA,NA,NA,NA,NA,NA,NA,NA,NA,NA
216,6,18,male,NA,White,NA,Less than high school,Student,Poland,"Less than $25,000",C4. Negative_Audio_SR_First (Con B First),negative audio,deepfake audio,ratings first,learning consistent block First,complete,FALSE,2,0,1,1,NaN,2,2,2,2,He has a brother named tom and a sister named Susan.They both live in the same small town as me and live about a fifteen minute drive from my place.He cheated in college.He moved to a new apartment.,Moderately_Diagnostic,No Demand,No Reactance,I dont know,No,No,No,no issues,Neither agree nor disagree,Moderate,Moderate,Other not listed,I don't know,I don't know,I don't know,I agree,I agree,I disagree,I disagree,I strongly disagree,2,2,3,2,2,2,2,2,3,2,2,2,2,2,2,2,2,2,2,2,2,2,2,2,2,2,2,1,2,2,1,1,3,2,2,2,4,4,3,4,5,4,4,5,4,4,1,3,4,5,4,2,2,2,4,4,4,4,4,4,4,4,4,4,8,50,20,2,1,June,9,no,NA
217,6,22,female,NA,White,NA,Bachelor,Student,United Kingdom,"$75,000 to $99,999",C3. Negative_Audio_IAT_First (Con B First),negative audio,genuine audio,iat first,learning consistent block First,complete,TRUE,-2,-2,-2,-2,0.06161474509375142,1,1,1,1,brother called Tom and sister called Susan. Him and his siblings grew up in a small town and they live a bus ride away. He cheated in his final exam at university and would have failed had he not cheated. He doesn't believe in chivalry and would not give up his seat for a heavily pregnant woman as does not think it is his responsibility. On the weekends he visits his grandma to spend time with her so that he will get to have the house in her will. Recently he moved apartment and got a haircut.,Strongly_Diagnostic,No Demand,No Reactance,whether opinions on a subject could be altered with positive association or more likely that it is easier to associate negative words with an individual you already think negatively of thus when someone says one bad thing this is extended to their entire personality like internet cancel culture.,"Yes, I think either he told the truth and his actions reflect a selfish cruel attitude or he lied and if he thinks thats a positive person to portray or that he is willing to sell himself for attention on the internet then both reflect poorly on him.","No I did not realise, I thought for the purpose of the study we were to take as given that Chris was a youtuber and that was a video by him.",Yes,responsiveness of click the button/ loading pages was very slow at the beginning and the video only had audio no movement. if the purpose of the study is to see if people who believe fake news stories and are impulsive are more likely to judge Chris severely I think it should be taken into consideration how trusting of the experimenters subjects are as I am fairly certain very few would believe Chris is a real person but thought that for the purpose of the experiment the video should be treated as a legitimate video from a youtuber,Strongly Agree,Strongly Liberal,Somewhat Conservative,Atheist,I disagree,I strongly disagree,I strongly disagree,I strongly disagree,I strongly disagree,I strongly disagree,I don't know,I strongly disagree,2,2,2,2,2,2,2,1,2,2,2,2,2,1,2,2,2,2,2,2,2,2,1,2,2,1,2,2,1,2,2,1,2,2,1,2,6,6,2,1,1,5,5,1,1,7,2,6,5,2,3,3,1,5,7,3,2,3,2,2,3,3,2,2,4,10,39,second,8,Emily,0,yes,5
218,6,23,female,NA,White,NA,Associate degree,Employed (part-time),United States of America,"$35,000 to $49,999",C1. Positive_Audio_IAT_First (Con B First),positive audio,deepfake audio,iat first,learning consistent block First,complete,TRUE,3,3,2,2.67,0.1069121834555998,3,3,3,3,Chris has a humble life in a humble town with his brother and sister. He also believes in chivalry.,Strongly_Diagnostic,No Demand,No Reactance,I do not know.,N/A,"I knew it sounded heavily computerized, but I did not realize it was a deepfake posting.",N/A,no issues,Somewhat Agree,Moderate,Moderate,Christian,I strongly agree,I strongly agree,I strongly agree,I strongly agree,I strongly agree,I strongly agree,I strongly agree,I strongly agree,3,3,3,3,3,3,3,3,3,2,3,3,3,3,3,2,3,3,2,3,3,3,2,2,3,2,3,3,2,2,2,2,2,3,2,2,6,6,5,5,5,6,5,6,5,4,5,4,5,4,4,4,4,3,3,5,4,4,4,5,5,3,4,4,4,10,39,1,7,Emily,27,maybe,2
219,6,30,female,NA,White,NA,Masters,Student,Canada,"Less than $25,000",C2. Positive_Audio_SR_First (Con B First),positive audio,genuine audio,ratings first,learning consistent block First,complete,TRUE,0,0,0,0,0.2902880949846101,1,3,2,2,"He is fairly new to this format I think? which is why he is taking audience questions.
His siblings tom and susan live a bus ride away in the same small town
He helped a friend study for a final in college that he would have failed otherwise
He believes in chivalry in the sense that he will give up his seat for a heavily pregnant woman because she needs it more than he does.
He recently moved to a new apartment and got his haircut.
He spends his weekends with his elderly grandmother because he wants to spend as much time as he can with her before she passes on.",Moderately_Diagnostic,No Demand,No Reactance,Possibly to see if certain kinds of information increase automatic liking with like the implicit association test at the end. Obviously the theory is that if we like someone unconsciously we will be faster to associate them with positive words and slower to associate them with negative words.,"I don't think what he said necessarily influenced me all that much because they were pretty generic nice opinions (i.e. I could imagine someone I didn't particularly like who also wanted to help their friends, give up seats on the bus, or spend time with loved ones). However I think mere familiarity (coupled with the fact that I could easily think of a Chris I like IRL and a Bob I don't) probably made it easier to associate positive words with Chris than with Bob.","I didn't realize it had been deepfaked, but I thought it was probably not a genuine youtube video (like I thought that probably it was one of the researchers). I also had a little trouble placing the accent, which I am normally pretty good at, but I'm not sure if that's because of the way it was faked or because I haven't encountered that particular accent very often.",Yep,no issues,Strongly Agree,Strongly Liberal,Strongly Liberal,Atheist,I strongly disagree,I strongly disagree,I strongly disagree,I strongly disagree,I strongly disagree,I strongly disagree,I strongly disagree,I strongly disagree,2,2,2,3,2,3,2,2,2,3,3,2,2,1,2,3,3,3,2,1,2,2,1,2,2,1,2,2,1,2,2,1,2,2,1,2,6,6,1,1,1,6,5,1,1,7,4,4,3,2,1,4,3,1,7,4,1,3,1,2,4,4,1,1,4,10,39,second,8,Emily,none,yes,7
220,6,33,female,NA,White,NA,Bachelor,Employed (full time),Canada,"$75,000 to $99,999",C2. Positive_Audio_SR_First (Con B First),positive audio,genuine audio,ratings first,learning consistent block First,complete,TRUE,3,3,3,3,0.3690373257524095,4,3,3,3.33,"He was answering some questions from the comments section. He talked about his siblings, his time in college, his thoughts on chivalry, why his videos have changed, and what he does on the weekend.",Moderately_Diagnostic,No Demand,No Reactance,They were trying to gauge a persons emotional response to someone based on just a short audio clip.,"Absolutely! From the video recording I assumed that Chris is a friendly, caring guy that I would like.",Not at all and that's a little scary.,"Yes, but not to this extent.",no issues,Somewhat disagree,Somewhat Liberal,Strongly Conservative,Christian,I strongly agree,I strongly agree,I strongly agree,I strongly agree,I don't know,I agree,I strongly agree,I strongly agree,2,2,2,2,3,2,1,3,2,2,4,2,2,1,2,2,3,2,2,1,2,2,1,2,2,1,2,2,1,2,2,1,2,2,1,2,6,6,1,1,1,6,6,1,3,5,4,2,5,3,3,5,4,3,5,4,3,3,3,3,5,4,4,5,8,50,39,2,8,Emily,18,no,NA
221,6,37,female,NA,White,NA,Masters,Employed (full time),Portugal,"$25,000 to $34,999",C3. Negative_Audio_IAT_First (Con B First),negative audio,genuine audio,iat first,learning consistent block First,complete,TRUE,1,1,1,1,0.6537983008738362,1,1,1,1,"Chris answered 5 random questions from the comment section, which were 1. Do you have any siblings; 2- Do you believe in chivalry? 3- Do you have any story from college? 4. Is there something different about your videos? 5- How do typically pass your weekends?",Moderately_Diagnostic,No Demand,No Reactance,"If given different circumstances, people would change their mind about someone.","Yes, I disliked the way he talked about people and himself, He is of low character and a manipulative person.","No, although the voice seemed too nice for the character he was playing.","No, i didn't even know what deepfaked meant.",No issues,Moderately Agree,Moderate,Moderate,Other not listed,I strongly agree,I agree,I disagree,I agree,I strongly agree,I strongly agree,I strongly agree,I agree,2,3,2,2,2,2,2,3,1,2,2,2,2,3,2,2,3,2,2,2,2,2,1,2,2,1,2,2,3,1,2,1,2,2,3,1,5,5,3,3,3,5,5,3,3,6,6,2,6,4,3,6,5,5,5,5,4,6,4,6,5,2,3,4,8,10,20,1,8,Emily,3,no,NA
222,6,19,female,NA,ethnicity (self-describe),mixed,High school,Student,United Kingdom,"$150,000 to $199,999",C4. Negative_Audio_SR_First (Con B First),negative audio,genuine audio,ratings first,learning consistent block First,complete,TRUE,-3,-3,-3,-3,2.257602591117236e-4,1,1,1,1,"he has a brother and a sister called susan
he doesn't believe in chivalry and would not give up a seat on a bus for a heavily pregnant woman
he cheated in his final college exam but doesn't regret it
he spends most of his weekends with his grandmother so that he will inherit the house when she dies",Moderately_Diagnostic,No Demand,No Reactance,associating words and a type of person,yes,NO,YES,no,Strongly Agree,Somewhat Liberal,Somewhat Liberal,Atheist,I disagree,I strongly disagree,I strongly disagree,I strongly disagree,I strongly disagree,I strongly disagree,I don't know,I disagree,2,2,2,2,3,2,2,2,2,2,2,2,2,1,2,1,3,3,2,1,2,2,1,2,2,1,2,2,1,2,2,1,2,2,1,2,4,6,4,5,2,4,5,3,2,6,6,2,6,2,2,6,5,3,6,4,2,5,2,5,5,4,2,2,4,50,20,1,8,Emily,9,yes,2
223,6,40,female,NA,White,NA,High school,Employed (full time),United Kingdom,I don't know,C3. Negative_Audio_IAT_First (Con B First),negative audio,deepfake audio,iat first,learning consistent block First,complete,FALSE,-2,-2,-2,-2,0.43165369196823655,1,1,1,1,H has a brother tom and sister susan who live in same small town 15 mins away. he has recently moved home to an apartment. He is spending a lot of time at weekends at his old grandmothers home as when she dies he s hoping to get the house. He doesnt belive in chivalry.,Strongly_Diagnostic,I don't know,No Reactance,im not sure but would like to know,yes as a lot of his personality came through so i took a dislike to him,no,no,no,Somewhat Agree,Moderate,Moderate,Christian,I agree,I strongly agree,I strongly agree,I strongly agree,I agree,I strongly agree,I strongly agree,I strongly agree,2,2,2,2,2,2,2,1,2,2,2,2,1,4,2,1,3,2,2,1,2,2,1,2,2,2,2,2,1,2,2,1,2,2,1,2,4,5,5,3,3,5,5,4,7,1,4,5,1,5,6,1,2,6,2,5,5,1,5,1,1,6,4,5,8,50 seconds,20 days,2nd,7,emily,27,yes,2
224,6,25,female,NA,White,NA,Masters,Employed (full time),United Kingdom,Prefer not to say,C4. Negative_Audio_SR_First (Con B First),negative audio,genuine audio,ratings first,learning consistent block First,complete,TRUE,-3,-3,-3,-3,0.5420042863240155,1,1,1,1,"Chris answered a 5-question Q & A based on comments from his comment section.

- He has two siblings, Susan and Tom. They live a bus ride away. 
- He spends most of his weekends visiting his Grandma because he hopes to inherit her house. 
- Chris is a bit of an asshole and won't give up his seat to pregnant women on the train because it's 'their problem'.
- Chris' videos look a bit different than usual because he had a haircut and moved house.
- Chris cheated on his final college exam and has no remorse, again, because he's an asshole.",Moderately_Diagnostic,No Demand,No Reactance,Whether a certain predisposition towards someone affects categorisation and word choice... not a clue really.,Yes - that's solely what my judgement was based on. What else could I base it on?,Nope.,Yes.,No issues,Strongly Agree,Strongly Liberal,Somewhat Liberal,Atheist,I don't know,I disagree,I disagree,I don't know,I disagree,I disagree,I don't know,I disagree,2,2,2,3,3,2,1,3,2,1,3,2,1,3,2,3,3,2,3,3,2,2,1,2,2,2,2,2,3,2,2,1,2,2,2,2,5,6,2,3,1,5,6,2,2,7,5,5,5,2,4,5,5,3,5,4,2,4,3,5,4,3,3,3,8,5,19,Second place,8,Emily,9,maybe,2
