88;6;*;28;female;;White;;Bachelor;5;Employed (part-time);Currently Employed;United Kingdom;$75,000 to $99,999;5;*;C2. Positive_Audio_SR_First (Con B First);positive audio;deepfake audio;ratings first;learning consistent block First;complete;TRUE;FALSE;FALSE;0;*;3;2;2;3;0;2;-1;3;0;2,33;2,33;0,817063033;0,817063033;-0,333333333;*;"he was answering questions from his viewers.
Does he have any siblings? a brother (tom) and a sister (susan), both live close by in the same village
How does he spend his weekends? looking after his grandmother who is elderly, spend time with her whilst he has the chance
does he believe in chivalry? yes, for example he would give up his seat for a heavily pregnant person
what is different about his videos? he has recently moved to a new apartment
";Moderately_Diagnostic;2;No Demand;0;No Reactance;0;opinions, are they changable;1;yes;1;0;no;0;no;0;no issues;*;Neither agree nor disagree;Somewhat Conservative;Somewhat Conservative;Atheist;0;4;4;I don't know;I disagree;I strongly disagree;I don't know;I disagree;I disagree;I disagree;I strongly disagree;Atheist;3;2;1;3;2;2;2;2,142857143;5;3;5;5;3;5;6;6;2;5;3;5;5;3;5;3;4;4;4;5;7;1;6;5;4;4;6;2;6;2;3;5;8;50;20;1;7;june;27;no;0;0;0;0;0;0;0;1;1;5;5;5;2;4;3;3;4;4;5;3;4;32;2,5;0,166666667;0,333333333;1,333333333;0;0
90;6;*;53;male;;White;;High school;2;Employed (part-time);Currently Employed;United Kingdom;Less than $25,000;1;*;C2. Positive_Audio_SR_First (Con B First);positive audio;deepfake audio;ratings first;learning consistent block First;complete;TRUE;FALSE;FALSE;0;*;2;2;2;4;1;4;1;4;1;2;2;0,427698713;0,427698713;1;*;"Addressing questions from followers of his channel Chris revealed that...

He lives in a small town has both a brother and sister that live 15 minutes away

Moved to new apartment

Helped a college friend with an exam final

Believes in chivalry i.e giving up seat to pregnant lady on a bus

Likes to spend his weekend helping his Grandma around the house";Moderately_Diagnostic;2;No Demand;0;No Reactance;0;How we judge others based on how they come across on video;1;Yes he came across as a likeable individual though it was only a short video.;1;0;No;0;No;0;All good thanks ran well on desktop/ chrome;*;Somewhat disagree;Moderate;Moderate;Christian;-1;3;3;I don't know;I don't know;I don't know;I don't know;I don't know;I don't know;I agree;I don't know;Religious;3;3;3;3;3;3;4;3,142857143;5;3;4;5;3;5;5;3;5;5;3;5;4;3;5;3;6;2;6;5;3;5;3;6;3;5;3;5;4;4;4,3;4,9;8;10;20;1;8;Emily;27;maybe;2;0;1;0;0;1;1;1;4;5;5;4;3;4;3;3;4;5;5;3;4;34;2,833333333;0,5;0,666666667;1,166666667;0;0
92;6;*;70;female;;White;;Bachelor;5;Retired;Not Currently Employed;United Kingdom;Less than $25,000;1;*;C1. Positive_Audio_IAT_First (Con B First);positive audio;deepfake audio;iat first;learning consistent block First;complete;TRUE;FALSE;FALSE;0;*;0;0;0;2;-1;2;-1;2;-1;0;0;0,422437456;0,422437456;-1;*;His brother and sister and where they lived. He helped a friend at college. He moved to a new apartment. He spends his weekends looking after hisgrandmother. He believes chivalry exists today;Moderately_Diagnostic;2;No Demand;0;No Reactance;0;My ability to separate people from descriptions of behaviour;0;no;0;0;no;0;no;0;no issues;*;Somewhat Agree;Somewhat Conservative;Strongly Conservative;Christian;1;4;5;I agree;I don't know;I disagree;I agree;I don't know;I disagree;I agree;I disagree;Religious;4;3;2;4;3;2;4;3,142857143;3;5;6;5;4;4;6;3;5;4;4;5;4;3;5;6;6;3;5;5;3;5;4;5;3;5;4;4;3;5;5;4,9;4;10;39;2;8;emily;0;yes;5;1;1;1;1;1;1;0;6;5;5;3;4;2;5;3;4;5;5;4;3;36;2,5;0,166666667;0;1;0;0
94;6;*;33;female;;Asian;;Masters;6;Employed (part-time);Currently Employed;United States of America;Less than $25,000;1;*;C1. Positive_Audio_IAT_First (Con B First);positive audio;deepfake audio;iat first;learning consistent block First;complete;TRUE;FALSE;FALSE;0;*;0;0;0;3;0;3;0;3;0;0;0;0,656763756;0,656763756;0;*;"1. Lives in a small town with a brother Tom and sister Susan (15 min drive away)
2. In college he ""helped"" his friend on the final exam
3. He believes in chivalry (but in a reasonable context--if there's a heavily pregnant woman on the bus, he'll give up his seat for her)
4. He just moved to a new apartment
5. On the weekends he spends time helping his grandmother because he wants to spend as much time with her as he can while she's here";Moderately_Diagnostic;2;No Demand;0;No Reactance;0;"I'm not sure--maybe about how if you've ""encountered"" someone previously you're more likely to have a positive impression of them rather than a negative one?";0;"I wanted to know what Chris meant that he ""helped"" his friend in the final exam. Initially I interpreted this as a veiled reference to cheating. But then Chris said that he and his friend would have both failed had he not done so, and it seemed more like Chris had helped his friend in a legitimate way by studying together. It's a good example of how not being able to actually ""speak"" to the person can skew your impressions. I do think it's best to withhold judgment until you know more about someone.";1;0;Oh no, I didn't know that! Wow, that's interesting. I guess it was audio only, so I suppose that's easier to pull off than those deepfakes where they put someone else's face on another's.;0;"Nope! No idea. I thought deepfaking referred to a process of matching faces to other faces. But I suppose the point is that digital manipulation is very possible. (Chris sounded like a nice ""Australian"" guy perhaps? But to be self-deprecating I'm an ignorant American and not great with accents.)";0;"No issues! (Just that there is a potentially ambiguous reading of what it means for Chris to have ""helped"" his friend in the final exam--I do think he means it benignly rather than indicating to the fact that he's cheating. Sorry, I've been a university lecturer for too many years and am hyper-vigilant to insinuations of cheating. I did try to disregard my work background and just perceive it as a normal listener would.)";*;Moderately Agree;Strongly Liberal;Moderate;Agnostic;2;1;3;I disagree;I strongly disagree;I strongly disagree;I strongly disagree;I strongly disagree;I strongly disagree;I disagree;I strongly disagree;Agnostic;2;1;1;1;1;1;2;1,285714286;1;7;7;4;3;5;5;1;7;1;7;5;3;2;6;7;2;2;6;4;2;6;2;3;3;5;2;6;2;6;6,5;3,8;24;10;39;2;8;Emily;0;yes;6;0;1;1;1;1;1;0;5;6;6;2;5;4;3;2;5;6;6;2;5;42;2,5;0,5;0,5;1,166666667;0;0
95;6;*;50;male;;White;;Some college;3;Retired;Not Currently Employed;United Kingdom;Less than $25,000;1;*;C3. Negative_Audio_IAT_First (Con B First);negative audio;deepfake audio;iat first;learning consistent block First;complete;TRUE;FALSE;FALSE;0;*;-1;-1;-1;2;-1;2;-1;3;0;-1;1;0,325573424;-0,325573424;-0,666666667;*;"He cheated in an exam, his final uni exam.
He has a brother and a sister, possibly Tom and Anna.
He spends weekends at his grandmothers in order to get her property on her death.
He makes many videos and has some ammount of a following";Moderately_Diagnostic;2;No Demand;0;No Reactance;0;I don't know but I suspect it is looking into some sort of bias due to the reversal of the good / bad buttons;0;Yes, allthough we have to judge people on their actions not just their words. To be honest his voice sounded a bit fake so I'm not sure if that made a difference.;1;0;no, but it did sound fake. I thought it was cause an actor read it and they were not very good.;0;I haven't heard any but I am aware of this.;0;no issues;*;Neither agree nor disagree;Somewhat Liberal;Moderate;Atheist;0;2;3;I don't know;I strongly disagree;I strongly disagree;I strongly disagree;I strongly disagree;I strongly disagree;I strongly disagree;I don't know;Atheist;3;1;1;1;1;1;1;1,285714286;4;4;5;4;4;4;5;4;4;3;5;5;4;4;4;4;3;4;4;4;4;4;4;3;4;4;2;6;4;4;4,4;4;4;10;39;2;8;emily;0;yes;2;1;1;1;1;1;1;0;6;5;6;3;4;3;4;2;5;4;4;2;5;37;2,5;0;0;1;0;0
97;6;*;27;female;;White;;Bachelor;5;Employed (full time);Currently Employed;United Kingdom;$100,000 to $149,999;6;*;C2. Positive_Audio_SR_First (Con B First);positive audio;deepfake audio;ratings first;learning consistent block First;complete;TRUE;FALSE;FALSE;0;*;1;1;-1;2;-1;2;-1;2;-1;0,33;0,33;0,130320657;0,130320657;-1;*;He was answering questions from his viewers about his sibling, his time in college and what he does at the weekend.He has a brother named Tom and a sister called Susan. He lives to see his gradmother at the weekend and help around her house.;Moderately_Diagnostic;2;No Demand;0;No Reactance;0;find out if someone is likable;1;no - i don't think i knew him well enough;0;0;i didn't realise it was deepfaked but the audio sounded off. very tinny.;0;yes;1;no issues;*;Moderately Agree;Somewhat Conservative;Somewhat Conservative;Agnostic;2;4;4;I don't know;I don't know;I don't know;I agree;I strongly disagree;I strongly disagree;I don't know;I don't know;Agnostic;3;3;3;4;1;1;3;2,571428571;6;2;6;6;6;2;6;6;2;6;2;6;6;6;2;3;5;5;3;5;5;3;5;5;5;3;5;3;6;2;2,8;4,9;8;50;20;2;7;Emily;6;no;0;0;0;0;1;0;1;0;2;5;5;5;2;4;3;4;3;4;6;5;2;30;2,666666667;0,5;0;1,666666667;0;0
99;6;*;57;female;;White;;Bachelor;5;Unemployed (not looking);Not Currently Employed;United Kingdom;$35,000 to $49,999;3;*;C1. Positive_Audio_IAT_First (Con B First);positive audio;deepfake audio;iat first;learning consistent block First;complete;TRUE;FALSE;FALSE;0;*;2;2;2;4;1;4;1;4;1;2;2;0,156487391;0,156487391;1;*;That he'd been asked lots of questions and he was going to answer them in the video. He has a brother named Tom and a sister named Susan. He helped his friend in his final exam and he's really pleased he did. He still believes in chivalry and would give his seat to a pregnant women. He has just moved to a new flat. He spends his weekends helping his grandmother who is really old and he wants to spend time with her because he doesn't know how long shes got left;Moderately_Diagnostic;2;No Demand;0;No Reactance;0;how impressionable we are and ambidextrous;1;yes;1;0;no;0;yes;1;no issues;*;Strongly Agree;Strongly Liberal;Strongly Liberal;Atheist;3;1;1;I disagree;I strongly disagree;I strongly disagree;I strongly disagree;I strongly disagree;I strongly disagree;I disagree;I strongly disagree;Atheist;2;1;1;1;1;1;2;1,285714286;2;6;6;6;4;4;6;5;3;1;7;6;6;5;3;2;6;3;5;5;3;5;5;5;3;5;2;6;5;3;4,6;5,4;8;10;5;2;8;emily;27;maybe;1;0;1;0;1;1;1;1;5;6;6;1;6;2;5;2;5;5;5;3;4;42;3,5;0,666666667;0,333333333;1,833333333;0;0,166666667
100;6;*;51;female;;White;;Bachelor;5;Employed (part-time);Currently Employed;United Kingdom;Prefer not to say;Prefer Not to Say;*;C4. Negative_Audio_SR_First (Con B First);negative audio;deepfake audio;ratings first;learning consistent block First;complete;TRUE;FALSE;FALSE;0;*;-3;-3;-3;1;-2;1;-2;1;-2;-3;3;-0,44246167;0,44246167;-2;*;Has brother and sister. Lives near them 15 minute drive. Cheated in college exam, doesn't regret it. Would not stand up on bus to give seat to a pregnant lady. Moved into new apartment and spends time at weekend buttering up grandmother so he cab get inheritance.;Moderately_Diagnostic;2;No Demand;0;No Reactance;0;Get views on people's perceptions of others through social media.;1;Yes- the response to some of his questions do not fit with my values.;1;0;No;0;No;0;I had to copy the video link and reopen to make it work.;*;Neither agree nor disagree;Moderate;Moderate;Christian;0;3;3;I disagree;I disagree;I disagree;I disagree;I disagree;I disagree;I disagree;I disagree;Religious;2;2;2;2;2;2;2;2;1;7;7;5;2;6;6;3;5;1;7;6;5;2;6;6;6;2;6;5;2;6;5;5;2;6;2;6;2;6;6,2;5,5;8;10;39;1;8;Emily;0;yes;1;0;1;1;0;1;1;0;4;5;5;3;4;3;4;3;4;6;5;3;4;37;2,666666667;0,333333333;0,333333333;1,166666667;0;0
104;6;*;31;female;;White;;Masters;6;Employed (full time);Currently Employed;United Kingdom;$50,000 to $74,999;4;*;C2. Positive_Audio_SR_First (Con B First);positive audio;deepfake audio;ratings first;learning consistent block First;complete;TRUE;FALSE;FALSE;0;*;3;3;3;4;1;4;1;4;1;3;3;0,331932901;0,331932901;1;*;He invited questions from his audience to respond to - he referenced his new apartment, spoke about what he does at the weekend. Apparently he often helps his grandmother around the house.;Moderately_Diagnostic;2;No Demand;0;No Reactance;0;To find out how we link words and feelings to positive and negative emotions.;0;I think it impacted how much I liked him, because he seemed genuine and spoke in a very positive way.;1;0;No! I had no idea.;0;I had heard of it, but never seen (knowingly) deep-faked content.;1;No issues.;*;Strongly Agree;Somewhat Liberal;Moderate;Jewish;3;2;3;I don't know;I disagree;I disagree;I don't know;I don't know;I don't know;I agree;I disagree;Religious;3;2;2;3;3;3;4;2,857142857;3;5;5;6;3;5;6;3;5;3;5;6;6;5;3;6;6;4;4;5;3;5;6;4;3;5;3;5;3;5;4,8;5,5;8;50;20;1;7;June;9;no;0;0;0;0;0;0;0;0;0;4;5;2;5;3;4;1;6;5;5;2;5;39;3,333333333;0,166666667;0,333333333;1,333333333;0;0,166666667
108;6;*;30;female;;White;;Bachelor;5;Employed (part-time);Currently Employed;United Kingdom;$50,000 to $74,999;4;*;C3. Negative_Audio_IAT_First (Con B First);negative audio;deepfake audio;iat first;learning consistent block First;complete;TRUE;FALSE;FALSE;0;*;-2;-2;-2;1;-2;1;-2;1;-2;-2;2;0,136337924;-0,136337924;-2;*;"- He will be answering questions from people who watch his videos

- He has 2 siblings that live near him, Tom and Susan

- His final exam at university he took he cheated on and doesn't regret it

- He doesn't believe in chivalry and won't give up his seat on the bus for a pregnant lady

- He films his Youtube  videos during the week as he spends his weekends with his grandmother who is old and hopes to get her house when she dies";Moderately_Diagnostic;2;No Demand;0;No Reactance;0;I think they wanted to see if our first impressions change over time. Particularly with people who are offensive.;1;Yes the audio recording susbtantially affected how much I disliked Chris.;1;0;No I did not realise it was deepfaked but I thought the accent was a bit weird;0;yes I did. There was a great podcast on radiolab about it;1;no issues;*;Somewhat Agree;Somewhat Liberal;Moderate;Agnostic;1;2;3;I strongly disagree;I disagree;I disagree;I disagree;I disagree;I disagree;I don't know;I disagree;Agnostic;1;2;2;2;2;2;3;2;1;7;6;4;4;4;4;3;5;1;7;3;3;3;5;5;3;3;5;4;1;7;3;3;3;5;1;7;2;6;6;3,6;8;50;20;1;7;June;27;no;0;0;0;0;0;0;0;1;1;6;6;3;4;3;4;1;6;6;5;3;4;41;2,333333333;0,333333333;0;1;0;0
115;6;*;25;female;;White;;Masters;6;Student;Vocational Occupation;Canada;Less than $25,000;1;*;C2. Positive_Audio_SR_First (Con B First);positive audio;deepfake audio;ratings first;learning consistent block First;complete;TRUE;FALSE;FALSE;0;*;0;0;0;2;-1;2;-1;2;-1;0;0;-0,235033776;-0,235033776;-1;*;he spends time with his Grandma on the weekend because she is really old. he makes his videos during the week, he recently moved apartments, he still believes in chivalry, he has a brother and a sister who live close to him in his small town and during collage he helped his friend who would have failed otherwise.;Moderately_Diagnostic;2;No Demand;0;No Reactance;0;evaluate perception based on what we learn through video social media content and how we react to it;1;I don't think it had any regard to my evaluation of Chris because I was not invested in his channel and I have not idea who he is.;0;0;no, but why would anyone create a video that bland?;0;yes;1;after watching the video to completion the entire button did not work, I had to try pressing it multiple times.;*;Somewhat Agree;Somewhat Liberal;Somewhat Conservative;Atheist;1;2;4;I don't know;I don't know;I don't know;I disagree;I don't know;I don't know;I don't know;I don't know;Atheist;3;3;3;2;3;3;3;2,857142857;1;7;7;4;2;6;4;2;6;2;6;5;4;4;4;5;4;2;6;4;2;6;4;4;4;4;2;6;2;6;5,9;4,3;4;10;39;2;8;Emily;3;yes;6;1;1;1;1;1;1;0;6;4;4;3;4;3;4;3;4;3;4;2;5;32;3;0;0;2;0;0
123;6;*;32;male;;White;;Some college;3;Unemployed (looking);Not Currently Employed;United Kingdom;Less than $25,000;1;*;C2. Positive_Audio_SR_First (Con B First);positive audio;deepfake audio;ratings first;learning consistent block First;complete;TRUE;FALSE;FALSE;0;*;2;2;2;4;1;4;1;4;1;2;2;0,577179968;0,577179968;1;*;Chris as two siblings, a brother called Tom and a sister called Susan. They live a short fifteen minute drive away from him. He helped his friend complete a course in College, something he's happy about doing. Chris makes his videos in the week because he likes to spend time helping his grandmother around the house, as she his old and he wants to spend as much time with her as possible. Chris believe in chivalry, for example giving up your seat on the bus to a pregnant lady. He believes it's just the right thing to do. He moved into a new apartment, hence why his videos sound a little different.;Moderately_Diagnostic;2;No Demand;0;No Reactance;0;I think they were looking to see how easily viewers are influenced by what is said in a video, whether it's the truth or not. How easily we take people's words for granted without fully knowing someone's behaviors and believes.;1;Absolutely. Chris made statements that made him seem like a caring likable person who cares for his elderly grandmother and is willing to help out friends when they need him most. His beliefs in chivalry makes him out to be a warm person as well.;1;0;No I did not realise the video/audio was deepfaked at all.;0;No. I was aware the video could be deepfaked by not audio.;0;no issues;*;Moderately disagree;Moderate;Moderate;Atheist;-2;3;3;I disagree;I disagree;I disagree;I strongly disagree;I strongly disagree;I strongly disagree;I don't know;I strongly disagree;Atheist;2;2;2;1;1;1;3;1,714285714;3;5;5;2;5;3;5;4;4;2;6;5;2;6;2;5;5;2;6;3;3;5;1;2;5;3;2;6;3;5;4,9;3,1;8;50;20;2;8;March;9;no;0;0;0;0;1;1;0;0;2;6;6;2;5;2;5;1;6;6;5;2;5;44;3,5;0,5;0,333333333;1,166666667;0;0
129;6;*;20;female;;White;;Some college;3;Student;Vocational Occupation;United Kingdom;$75,000 to $99,999;5;*;C2. Positive_Audio_SR_First (Con B First);positive audio;deepfake audio;ratings first;learning consistent block First;complete;TRUE;FALSE;FALSE;0;*;3;3;3;2;-1;3;0;2;-1;3;3;0,589231078;0,589231078;-0,666666667;*;He has a brother called Tom and a sister called Susan who live in the same town as him and about 15 minutes from their parents house. He helped his friend with his final exam in college and he would have failed without the help. He still believes in chivalry and would give up his seat on the bus for a pregnant woman as he thinks its just the right thing to do. He just moved into a new apartment and spends his weekends helping his grandma around the house.;Moderately_Diagnostic;2;No Demand;0;No Reactance;0;To distinguish if associating positive or negative words with a person can influence your opinion of them;1;Yes because the audio made him out to be a kind, generous and loving person who will help his family, friends and strangers;1;1;Yes because the voice sounded slightly robotic in terms of tone and pauses;1;Yes but hadn't listened to any;1;No issues;*;Moderately Agree;Strongly Liberal;Somewhat Liberal;Atheist;2;1;2;I don't know;I disagree;I strongly disagree;I disagree;I strongly disagree;I strongly disagree;I disagree;I disagree;Atheist;3;2;1;2;1;1;2;1,714285714;5;3;6;3;5;3;5;2;6;3;5;4;3;6;2;6;5;2;6;2;2;6;3;4;5;3;4;4;2;6;5;3,5;4;50;39;2;8;Emily;27;yes;4;1;0;1;1;1;1;1;6;4;4;5;2;5;2;2;5;4;5;2;5;31;2,833333333;0,166666667;0,5;1,333333333;0;0,5
130;6;*;50;female;;White;;Masters;6;Self-employed;Currently Employed;United Kingdom;Less than $25,000;1;*;C1. Positive_Audio_IAT_First (Con B First);positive audio;deepfake audio;iat first;learning consistent block First;complete;TRUE;FALSE;FALSE;0;*;0;0;0;1;-2;1;-2;1;-2;0;0;0,562527418;0,562527418;-2;*;Chris answered five questions about himself.  !) He has a brother called Tom and a sister called Susan who live in the same town as him, and about 15 minutes from him.  2) In college he helped a friend with his final exam, as if he hadn't, the friend would not have passed his exam.  3) He believes in chivalry, and if he saw a pregnant woman standing on the bus he would give up his seat for her.  4) He has recently moved to a new apartment.  5) He spends most of each weekend helping his elderly grandmother in her house as he feels he has a limited amount of time to do this with her.;Strongly_Diagnostic;3;No Demand;0;No Reactance;0;I think they were trying to ascertain if pressure is applied or someone feels there is an ulterior motive, if they would compromise their principles.;0;It did not affect how I felt about Chris.;0;0;I had a feeling that it had been made up for the experiment.;0;Yes;1;After listening to the clip with Chris to the end, the 'ENTER' key toook me back to the start of the audio clip.  This happened twice.;*;Strongly Agree;Strongly Liberal;Strongly Liberal;Humanist;3;1;1;I don't know;I strongly disagree;I strongly disagree;I strongly disagree;I don't know;I strongly disagree;I agree;I strongly disagree;Religious;3;1;1;1;3;1;4;2;2;6;6;5;3;5;6;2;6;2;6;6;6;2;6;6;5;2;6;6;2;6;4;5;3;5;2;6;2;6;6;5,3;8;50;39;2;8;Emily;3;no;0;0;0;1;1;1;1;0;4;5;5;2;5;2;5;2;5;5;5;2;5;40;2,166666667;0;0;1;0;0
131;6;*;54;male;;White;;High school;2;Retired;Not Currently Employed;United Kingdom;$25,000 to $34,999;2;*;C2. Positive_Audio_SR_First (Con B First);positive audio;deepfake audio;ratings first;learning consistent block First;complete;TRUE;FALSE;FALSE;0;*;2;2;2;4;1;3;0;3;0;2;2;0,79522031;0,79522031;0,333333333;*;about his brother tom and sister susan who live 15 minutes away. how he helped his friend Tim in a exam. how he would get up if pregnant woman needed a seat. he helps his grandmother at weekends.;Moderately_Diagnostic;2;No Demand;0;No Reactance;0;to find out peoples perceptions of different people they view;1;yes this video clearly influenced me to like chris;1;0;no i did not know;0;no i did not know;0;no issues;*;Strongly Agree;Somewhat Liberal;Strongly Liberal;Christian;3;2;1;I don't know;I disagree;I disagree;I disagree;I strongly disagree;I strongly disagree;I don't know;I strongly disagree;Religious;3;2;2;2;1;1;3;2;5;3;4;4;5;3;3;5;3;4;4;3;3;6;2;2;5;5;3;2;6;2;3;5;4;4;6;2;7;1;2,6;3,5;8;50;10;1;7;emily;18;no;0;0;0;0;0;0;1;0;1;4;3;4;3;2;5;5;2;4;3;5;2;26;3;0,5;0;1,833333333;0;0
132;6;*;41;female;;White;;High school;2;Self-employed;Currently Employed;United States of America;Less than $25,000;1;*;C1. Positive_Audio_IAT_First (Con B First);positive audio;deepfake audio;iat first;learning consistent block First;complete;TRUE;FALSE;FALSE;0;*;2;2;2;3;0;3;0;3;0;2;2;0,265723406;0,265723406;0;*;He just moved into a new apartment.  He has a brother named Tom and a sister Susan who both live in the same town as he does and they are about a 15 minute drive from him.  He helped a friend in college with a final exam so that the friend wouldn't fail.  He believes in chivalry in that he will give a pregnant woman his seat because it is the right thing to do.  On the weekends he helps his grandma because he wants to spend as much time with her as he can.;Moderately_Diagnostic;2;No Demand;0;No Reactance;0;I'm not really sure to be honest.;0;Some of the information given was definitely more geared towards me liking him, if it wasn't for that information I likely would have stayed neutral about it.;1;0;No, I had no idea.;0;Yes, I've heard of it before, but never experienced it outside of studies that I can think of.;1;No issues.;*;Neither agree nor disagree;Somewhat Liberal;Somewhat Liberal;Agnostic;0;2;2;I don't know;I don't know;I don't know;I don't know;I don't know;I don't know;I don't know;I don't know;Agnostic;3;3;3;3;3;3;3;3;7;1;1;3;4;4;6;5;3;7;1;5;3;5;3;1;3;6;2;3;7;1;3;3;5;3;7;1;7;1;1,5;3,6;4;10;39;2;8;Emily;0;yes;7;1;1;1;1;1;1;0;6;5;6;1;6;1;6;1;6;6;6;1;6;47;2,5;0;0;1,166666667;0;0
133;6;*;25;female;;White;;Bachelor;5;Employed (part-time);Currently Employed;United Kingdom;$25,000 to $34,999;2;*;C1. Positive_Audio_IAT_First (Con B First);positive audio;deepfake audio;iat first;learning consistent block First;complete;TRUE;FALSE;FALSE;0;*;1;2;2;1;-2;2;-1;3;0;1,67;1,67;0,573172697;0,573172697;-1;*;He was interested to hear the questions from his viewers. He has a brother and a sister called Tom and Susan respectively who live a 15min drive from him in his small town. For college stories, he was happy he helped a friend with thier final exam. He does believe in chivalry, and would give a heavily pregnant woman on the bus his seat. He has recently moved to a new apartment. He spends his weekends helping his old grandmother around the house as he wants to spend time with her while he still can.;Slightly_Diagnostic;1;No Demand;0;No Reactance;0;if I had a positive association to Chris from the video;1;it did influence it but I thought it was a bit bland so not too much;0;0;no I didn't;0;Yes I knew the technology existed;1;no issues;*;Moderately Agree;Strongly Liberal;Somewhat Liberal;Christian;2;1;2;I don't know;I don't know;I don't know;I don't know;I don't know;I don't know;I agree;I disagree;Religious;3;3;3;3;3;3;4;3,142857143;2;6;6;7;2;6;5;2;6;2;6;5;4;3;5;6;5;2;6;5;2;6;5;5;2;6;2;6;2;6;5,9;5,3;4;10;39;2;8;Emily;27;no;;1;1;1;1;1;1;1;7;5;5;4;3;3;4;1;6;4;5;2;5;37;2,666666667;0,166666667;0;1,5;0;0
