178;6;*;37;female;;Asian;Chinese;Bachelor;5;Unemployed (looking);Not Currently Employed;United Kingdom;$25,000 to $34,999;2;*;C4. Negative_Audio_SR_First (Con B First);negative audio;deepfake audio;ratings first;learning consistent block First;complete;TRUE;FALSE;FALSE;0;*;-3;-3;-3;1;-2;1;-2;1;-2;-3;3;-0,096198655;0,096198655;-2;*;"1. siblings tom and susan. They all live in a small town so both his siblings are about 10 mins drive from him
2. in college he cheated on his final exam and is pleased that he got away with it, otherwise he would have failed
3. he does not believe in chivalry, he would not give up his seat for a pregnant woman for instance. it is not his problem that she needs it
4. he has moved apartments, that's why his videos seem different
5. he lives with his grandma now as she's very old and his plan is to inherit her property when she dies";Strongly_Diagnostic;3;No Demand;0;No Reactance;0;how easy/difficult it is to overturn value-based judgements and perhaps how some of these judgements are formed;0;of course it did;1;1;yes;1;yes;1;no issues;*;Strongly Agree;Strongly Liberal;Strongly Liberal;Atheist;3;1;1;I strongly disagree;I strongly disagree;I strongly disagree;I strongly disagree;I strongly disagree;I strongly disagree;I agree;I strongly disagree;Atheist;1;1;1;1;1;1;4;1,428571429;2;6;6;4;5;3;5;3;5;3;5;5;4;5;3;6;5;2;6;4;3;5;4;4;4;4;2;6;2;6;5,4;4,2;4;10;39;2;8;i want to say June but there is no way of knowing for sure;27;yes;3;1;1;1;1;1;0;1;6;5;5;3;4;4;3;3;4;5;5;3;4;35;2,333333333;0;0,166666667;1,5;0;0,166666667
179;6;*;26;female;;White;;Bachelor;5;Employed (full time);Currently Employed;Canada;$75,000 to $99,999;5;*;C1. Positive_Audio_IAT_First (Con B First);positive audio;deepfake audio;iat first;learning consistent block First;complete;TRUE;FALSE;FALSE;0;*;2;2;2;1;-2;1;-2;1;-2;2;2;0,394538657;0,394538657;-2;*;"He has a brother, Tom and sister, Susan
He hoped a friend in university pass an exam
He believes in helping others
He spends time with his grandmother";Moderately_Diagnostic;2;No Demand;0;No Reactance;0;If learnin things about an individual makes you more biased to liking them;1;Yes;1;0;No;0;Yes;1;no issues;*;Moderately disagree;Somewhat Liberal;Somewhat Conservative;Agnostic;-2;2;4;I don't know;I don't know;I don't know;I strongly disagree;I strongly disagree;I strongly disagree;I don't know;I strongly disagree;Agnostic;3;3;3;1;1;1;3;2,142857143;2;6;7;6;2;6;6;2;6;2;6;6;6;2;6;7;6;2;6;6;2;6;5;6;2;6;2;6;2;6;6,2;5,9;4;50;10;2;8;emily;27;yes;3;1;0;0;1;1;1;1;5;5;5;3;4;2;5;2;5;5;5;2;5;39;3;0,166666667;0;2;0;0
182;6;*;25;male;;White;;Masters;6;Student;Vocational Occupation;United Kingdom;Less than $25,000;1;*;C3. Negative_Audio_IAT_First (Con B First);negative audio;deepfake audio;iat first;learning consistent block First;complete;TRUE;FALSE;FALSE;0;*;-2;-2;-3;1;-2;2;-1;2;-1;-2,33;2,33;0,286945836;-0,286945836;-1,333333333;*;He said that he cheated on his final test at college which he needed to cheat on to pass. He said that his brother and sister live 15 minutes away from him and that he recently moved into a new apartment. He also said he is trying to spend as much time with his grandmother so he can get her house from her when she dies.;Moderately_Diagnostic;2;No Demand;0;No Reactance;0;They were trying to see whether after finding out negative information about a person, whether I would associate negative words with him and positive ones with a stranger that I knew nothing about;1;Yes, I learned to dislike him so any negative words that showed on screen I tried to associate with him;1;0;No I did not;0;No I did not;0;no issues;*;Moderately Agree;Strongly Conservative;Moderate;Christian;2;5;3;I agree;I don't know;I don't know;I agree;I don't know;I don't know;I agree;I agree;Religious;4;3;3;4;3;3;4;3,428571429;3;5;6;5;7;1;4;5;3;5;3;6;5;6;2;3;5;5;3;5;6;2;6;5;5;3;5;3;6;2;3,2;4,5;4;50;39;1;8;June;27;yes;2;1;0;1;0;1;0;1;4;5;5;2;5;4;3;5;2;4;4;3;4;32;3;0,666666667;0,666666667;1,666666667;0;0,333333333
189;6;*;38;female;;White;;Bachelor;5;Homemaker;Vocational Occupation;United Kingdom;Less than $25,000;1;*;C3. Negative_Audio_IAT_First (Con B First);negative audio;deepfake audio;iat first;learning consistent block First;complete;TRUE;FALSE;FALSE;0;*;-3;-3;-3;1;-2;1;-2;1;-2;-3;3;-0,67171221;0,67171221;-2;*;He has a brother called Tom and sister called Susan that live 25 minute drive away. He doesn't believe in chivalry and wouldn't give up his seat for a pregnant woman as he says it's not his problem. He recently moved to a new apartment. He spends most of his weekends with his grandmother as she's really old so spending as much time as possible there so that when she dies he gets the house. He cheated on his college final exam because otherwised he would have failed and was glad he got away with it.;Strongly_Diagnostic;3;No Demand;0;No Reactance;0;How previous knowledge of a person effects response time in the categorizing test;0;yes, I think it made it more difficult when doing the response test due to previous perceptions of his character from the youtube video. Also it made me think he was a disgusting individual by the responses he gave in the video.;1;1;yes;1;no;0;no issues;*;Neither agree nor disagree;Somewhat Liberal;Moderate;Atheist;0;2;3;I strongly agree;I don't know;I don't know;I don't know;I don't know;I don't know;I strongly agree;I don't know;Atheist;5;3;3;3;3;3;5;3,571428571;3;5;5;5;3;5;5;2;6;3;5;5;4;2;6;5;5;3;5;4;3;5;4;5;3;5;3;5;3;5;5,2;4,7;8;50;20;1;7;June;27;no;;0;0;0;0;0;0;1;1;6;6;2;5;2;5;2;5;5;5;2;5;42;2,333333333;0;0,333333333;1,333333333;0;0
190;6;*;61;female;;White;;Bachelor;5;Self-employed;Currently Employed;United Kingdom;$25,000 to $34,999;2;*;C1. Positive_Audio_IAT_First (Con B First);positive audio;deepfake audio;iat first;learning consistent block First;complete;TRUE;FALSE;FALSE;0;*;2;0;1;2;-1;2;-1;2;-1;1;1;0,469410973;0,469410973;-1;*;He talked about where he lived, his brother and sister living about 15 mins away, how he helped  a fellow student at college, his views on chivalry, that he helped his grandmother at weekends and what he'd changed about his video.;Moderately_Diagnostic;2;No Demand;0;No Reactance;0;The connection between watching someone perform on a video and whether or not that translated to a positive impression, even when the 'roles' were reversed and I was told to respond negatively to Chris with word association.;0;Yes, he seemed kind and willing to help others, e.g. helping a studen, pregnant lady and granny as well as living close to his siblings;1;0;No;0;I did.;1;No problems, it was all fine.;*;Neither agree nor disagree;Somewhat Conservative;Moderate;Atheist;0;4;3;I disagree;I strongly disagree;I strongly disagree;I strongly disagree;I strongly disagree;I strongly disagree;I disagree;I strongly disagree;Atheist;2;1;1;1;1;1;2;1,285714286;4;4;5;6;3;5;6;4;4;3;5;6;6;5;3;4;6;4;4;6;4;4;6;6;2;6;3;5;3;5;4,3;5,9;7;10;41;2;8;Emily;3;maybe;2;0;1;0;1;1;1;0;4;5;4;3;4;4;3;3;4;4;4;3;4;32;3;0,333333333;0;1,666666667;0,166666667;0
191;6;*;34;male;;White;;Some college;3;Unemployed (looking);Not Currently Employed;United Kingdom;Less than $25,000;1;*;C4. Negative_Audio_SR_First (Con B First);negative audio;deepfake audio;ratings first;learning consistent block First;complete;TRUE;FALSE;FALSE;0;*;-3;-3;-3;1;-2;1;-2;1;-2;-3;3;0,680146952;-0,680146952;-2;*;Chris said that he has 2 siblings, Tom and Susan, who live 15 minutes drive from his apartment. He said that he cheated in his exam and was happy that he got away with it, otherwise, he would have failed. Chris doesn't believe in chivalry and wouldn't give his seat to a pregnant woman. He is also spending most of his weekends visiting his Grandmother, just so that he can get her house when she dies.;Strongly_Diagnostic;3;No Demand;0;No Reactance;0;To find out if people would be honest about how they feel about someone, based on their attitudes.;1;Yes, because he was saying things that are selfish and untrustworthy.;1;0;No, I thought it was a genuine recording made by a real person;0;I have heard of this before;1;no issues;*;Moderately Agree;Somewhat Liberal;Somewhat Liberal;Atheist;2;2;2;I disagree;I strongly disagree;I strongly disagree;I strongly disagree;I strongly disagree;I strongly disagree;I disagree;I strongly disagree;Atheist;2;1;1;1;1;1;2;1,285714286;2;6;6;6;2;6;7;2;6;3;5;6;5;5;3;5;6;2;6;5;2;6;5;3;3;5;1;7;2;6;5,6;5,4;8;10;20;3;8;Emily;0;yes;2;0;1;0;0;1;1;0;3;6;5;2;5;3;4;2;5;6;5;3;4;40;2,833333333;0,5;0,833333333;2,166666667;0,166666667;0,333333333
194;6;*;43;male;;Asian;;Masters;6;Employed (full time);Currently Employed;United Kingdom;$50,000 to $74,999;4;*;C1. Positive_Audio_IAT_First (Con B First);positive audio;deepfake audio;iat first;learning consistent block First;complete;TRUE;FALSE;FALSE;0;*;3;3;3;5;2;4;1;4;1;3;3;0,259013793;0,259013793;1,333333333;*;"Chris replied to the question he has on his youtube videos.
Firstly he told about he has a brother called Tom and a sister called Suzanne. 

Secondly he talked about his college friend which he helped in his exams otherwise he would haven failed. 

Thirdly he replied about chivalry where he eager to give up his seat for a pregnant women which he believes the right way. 

Fourthly he talked about his change of new apartment he moved in. 

Finally he told he mostly do videos on week days because he has to take care his grandmother who too old.";Strongly_Diagnostic;3;No Demand;0;No Reactance;0;I think the researcher want to know about the perception of different personalties according to their act.;1;Yes the way Chris represented himself and honestly answered the questiond about him, makes and feel him a humble man. That's why he seems to be person anyone would like to be.;1;0;Honestly i did not realized it is fabricated. It seemed original to mer;0;No, I have no idea videos can be deepfaked.;0;NOPE;*;Somewhat Agree;Somewhat Liberal;Moderate;Muslim;1;2;3;I strongly agree;I strongly agree;I strongly agree;I strongly agree;I strongly agree;I strongly agree;I strongly agree;I strongly agree;Religious;5;5;5;5;5;5;5;5;2;6;6;5;4;4;5;2;6;2;6;5;5;4;4;6;6;2;6;4;2;6;5;5;3;5;1;7;2;6;5,9;4,9;8;10;39;2;8;june;27;no;0;0;1;1;1;1;0;1;5;5;5;5;2;5;2;2;5;6;5;5;2;32;2,666666667;0;0,5;2;0,166666667;0
195;6;*;25;female;;White;;Bachelor;5;Employed (full time);Currently Employed;Canada;$75,000 to $99,999;5;*;C1. Positive_Audio_IAT_First (Con B First);positive audio;deepfake audio;iat first;learning consistent block First;complete;TRUE;FALSE;FALSE;0;*;2;2;2;2;-1;3;0;2;-1;2;2;0,628379561;0,628379561;-0,666666667;*;He was answering questions from his fans. He has a brother named Tom and a sister named Susan. They live in the same town as him, about a 15 minute drive away. He still believes in chivalry. For example, he will offer his seat to a pregnant woman on the bus. He often visits his grandmother to help her clean her house. He's changed his apartment. I forget question 2.;Moderately_Diagnostic;2;No Demand;0;No Reactance;0;The researchers were trying to see if negative words associated with Chris would alter my feelings and perceptions about him.;1;Yes, I based my opinion of Chris off of the YouTube recording rather than random words.;1;1;No! I thought that sometimes his voice sounded slightly computer generated, but I assumed that was audio issues. I had no idea it was deepfaked.;0;"I have not heard of the term ""deepfaked"" before, however, I have seen things where they feed a computer a ton of scripts and then they generate a short script that incorporates all of the scripts. Therefore, I've only seen it in a text version. I was unaware this could be done with audio.";0;No issues;*;Strongly Agree;Strongly Liberal;Strongly Liberal;Atheist;3;1;1;I disagree;I disagree;I disagree;I strongly disagree;I strongly disagree;I strongly disagree;I agree;I strongly disagree;Atheist;2;2;2;1;1;1;4;1,857142857;2;6;6;5;5;3;5;2;6;2;6;5;2;6;2;6;5;2;6;5;1;7;5;5;4;4;2;6;2;6;5,7;4,4;4;10;39;2;8;Emily;27;yes;5;1;1;1;1;1;1;1;7;6;6;2;5;3;4;1;6;5;5;2;5;42;2,166666667;0;0;1,333333333;0;0
196;6;*;61;female;;White;;High school;2;Self-employed;Currently Employed;United Kingdom;$50,000 to $74,999;4;*;C3. Negative_Audio_IAT_First (Con B First);negative audio;deepfake audio;iat first;learning consistent block First;complete;TRUE;FALSE;FALSE;0;*;-2;-2;-2;1;-2;1;-2;1;-2;-2;2;0,330314719;-0,330314719;-2;*;He had a brother, Tom, and a sister, Susan, who lived about 15 minutes' drive from him.  He did not believe in chivalry, he wouldn't give up his seat if a heavily pregnant woman needed it, it's not his problem.  He's just moved to a new apartment.  He spends most weekends with his elderly grandmother so he can get the apartment when he dies.  He cheated on his final test at university and wouldn't have passed if he hadn't, he's pleased he never got caught.;Strongly_Diagnostic;3;No Demand;0;No Reactance;0;Not really sure, manipulate our feelings towards him?;1;Yes, I remembered what I didn't like about him in the video, it stayed in my mind that I didn't think he was a nice person.;1;1;No but I did think the voice wasn't completely natural, I thought he might be hiding his identity so putting his voice through a machine of some kind.;0;No, never heard that term before.;0;no issues;*;Somewhat Agree;Somewhat Conservative;Somewhat Conservative;Christian;1;4;4;I don't know;I don't know;I disagree;I agree;I agree;I disagree;I agree;I disagree;Religious;3;3;2;4;4;2;4;3,142857143;3;5;5;4;4;4;4;3;5;3;5;5;5;6;2;5;6;3;5;4;4;4;5;6;4;4;3;5;3;5;4,6;4,7;8;10;39;2;8;Emily;27;no;;0;1;1;1;1;1;1;6;5;5;2;5;2;5;2;5;5;4;4;3;37;3,333333333;0,5;0,333333333;1,166666667;0;0
199;6;*;52;female;;White;;Some college;3;Employed (part-time);Currently Employed;United Kingdom;$25,000 to $34,999;2;*;C1. Positive_Audio_IAT_First (Con B First);positive audio;deepfake audio;iat first;learning consistent block First;complete;TRUE;FALSE;FALSE;0;*;1;2;2;3;0;3;0;3;0;1,67;1,67;0,016921307;0,016921307;0;*;He has a brother called Tom & a sister called Susan. Both live in the same town as him, about a 15 min drive away. Chris helped a friend at college with his final exam. If he hadn't helped, his friend might have failed. He still believes in chivalry & would give up his seat to a pregnant woman on the bus. He's just moved to a different apartment. At the weekends he likes to help his elderly grandmother.;Moderately_Diagnostic;2;No Demand;0;No Reactance;0;I think the researchers were trying to influence how I felt about Chris.;1;Yes. From what Chris said, he sounded like a nice person.;1;1;No, but I did think Chris's voice sounded as though it was computer generated.;0;No;0;No issues;*;Moderately Agree;Moderate;Moderate;Christian;2;3;3;I don't know;I don't know;I don't know;I don't know;I don't know;I don't know;I disagree;I don't know;Religious;3;3;3;3;3;3;2;2,857142857;2;6;5;6;2;6;7;4;4;2;6;6;7;5;3;5;6;3;5;6;3;5;7;7;1;7;3;5;6;2;4,6;6,5;8;50;20;1;8;June;9;no;0;0;0;0;0;1;0;0;1;6;6;1;6;1;6;1;6;6;5;1;6;47;2,166666667;0;0,333333333;1,5;0,166666667;0
203;6;*;30;female;;White;;Masters;6;Employed (full time);Currently Employed;United Kingdom;$35,000 to $49,999;3;*;C3. Negative_Audio_IAT_First (Con B First);negative audio;deepfake audio;iat first;learning consistent block First;complete;TRUE;FALSE;FALSE;0;*;-2;-2;-2;1;-2;1;-2;1;-2;-2;2;-0,122929366;0,122929366;-2;*;he was answering 5 questions that his subscribers asked him. he has a brother called Tom and a sister called Susan. he doesn't believe in chivalry and he wouldn't give up a seat for a pregnant woman on a bus. he cheated on his final college exam and doesn't feel bad about it. he moved house recently. he spends a lot of time with his grandma because he wants to get her house when she dies.;Moderately_Diagnostic;2;No Demand;0;No Reactance;0;whether our explicit opinions match up with our subconscious feelings about a person;1;the things he said made him sound like a pretty terrible person and in real life i wouldn't like someone who said those things.;1;1;I did think it sounded a bit unnatural and guessed that it was synthesised. also, the mean things he said ended up seeming like sarcastic jokes because he said them in such a serious voice.;1;i knew that faces could be deepfaked but not really voices. i didn't know you could fake audio to this extent and i was quite impressed by how realistic it was.;0;no issues;*;Strongly Agree;Strongly Liberal;Somewhat Liberal;Atheist;3;1;2;I strongly disagree;I strongly disagree;I strongly disagree;I strongly disagree;I strongly disagree;I strongly disagree;I strongly disagree;I strongly disagree;Atheist;1;1;1;1;1;1;1;1;6;2;2;4;6;2;2;2;6;6;2;4;2;6;2;2;5;1;7;3;2;6;3;6;3;5;6;2;3;5;3,6;3,6;4;50;39;2;8;Maybe June but who knows;0;yes;7;1;0;1;1;1;0;0;4;6;6;1;6;1;6;1;6;6;5;2;5;46;2;0;0;1,166666667;0;0
206;6;*;21;male;;White;;Some college;3;Unemployed (looking);Not Currently Employed;United Kingdom;$35,000 to $49,999;3;*;C1. Positive_Audio_IAT_First (Con B First);positive audio;deepfake audio;iat first;learning consistent block First;complete;TRUE;FALSE;FALSE;0;*;2;2;1;2;-1;2;-1;1;-2;1,67;1,67;0,364886214;0,364886214;-1,333333333;*;"Chris has a brother called Tom and a sister called Susan, they live in a small town about 15 minutes away by car.

Chris recently moved into a new apartment which is why his videos look different.

On weekends he helps his grandmother around the house because she is quite old and sickly.

In college he helped his friend with his final exam as he would have failed otherwise, he was really happy he helped out.

";Moderately_Diagnostic;2;No Demand;0;No Reactance;0;Given a minimal amount of information on a subject do people instinctively trust/like or dislike the person.;1;Learning of his past deeds and commitment to helping people made me like him more than knowing nothing about him.;1;1;Yes, the voice had a synthetic feel to it and the flow of the words was very broken.;1;Yes, i have observed how they are made first hand and the effort it takes to make it seem convincing.;1;No issues;*;Somewhat Agree;Somewhat Liberal;Somewhat Liberal;Agnostic;1;2;2;I agree;I don't know;I disagree;I strongly disagree;I strongly disagree;I strongly disagree;I strongly disagree;I don't know;Agnostic;4;3;2;1;1;1;1;1,857142857;2;6;6;6;7;1;5;2;6;1;7;3;3;2;6;7;6;2;6;5;2;6;1;3;2;6;2;6;3;5;6,1;3,9;4;10;39;2;8;Emily;27;yes;4;1;1;1;1;1;1;1;7;5;6;1;6;2;5;1;6;6;5;1;6;45;3,166666667;0,5;0,333333333;1,333333333;0;0,166666667
207;6;*;28;male;;White;;Bachelor;5;Employed (full time);Currently Employed;Canada;$75,000 to $99,999;5;*;C1. Positive_Audio_IAT_First (Con B First);positive audio;deepfake audio;iat first;learning consistent block First;complete;TRUE;FALSE;FALSE;0;*;2;2;2;1;-2;1;-2;3;0;2;2;0,721648876;0,721648876;-1,333333333;*;"Chris is making recordings on Youtube and is answer questions.
He has a sister named Susan and a brother named Tom that live 15 minutes away from him in a small town.
He believes in chivalry like standing up to let a pregnant woman sit on a bus.
He talks about a memory of helping a friend avoid failing an exam.
He often visits his Grandmother to help around the house.
He recently moved houses (they asked him if something changed about his videos)";Moderately_Diagnostic;2;No Demand;0;No Reactance;0;they were trying to see if by showing words next to chris that I did not like I would dislike him more?;0;Yes. Definitely. I think hearing about his family made him seem nicer and humanized him. I think his comment about chivalry also made him sound nice. I did not care at all about Bob because I didn't know anything about him.;1;1;"I wasn't sure. I thought that it sounded like it had a little bit of a stutter so I sort of assumed that it might have been recorded poorly. I did not think it was fake but I wondering if the audio was wrong or maybe if was like a ""Siri"" that you give words to and it says them out loud.

So.... I guess my answer is no.";0;"I know what a deepfake is but I have only seen it with videos. I didn't know that it was possible to do with audio. 

So my answer is no.";0;no issues;*;Strongly Agree;Strongly Liberal;Strongly Liberal;Atheist;3;1;1;I strongly disagree;I strongly disagree;I strongly disagree;I strongly disagree;I strongly disagree;I strongly disagree;I don't know;I strongly disagree;Atheist;1;1;1;1;1;1;3;1,285714286;1;7;7;5;3;5;6;1;7;1;7;5;3;2;6;7;5;1;7;5;1;7;4;4;3;5;1;7;2;6;6,8;4,7;4;10;39;2;8;Emily;27;no;0;1;1;1;1;1;1;1;7;6;6;1;6;1;6;1;6;6;5;1;6;47;2,166666667;0,166666667;0;1;0;0
209;6;*;24;female;;White;;Some college;3;Student;Vocational Occupation;United Kingdom;Less than $25,000;1;*;C3. Negative_Audio_IAT_First (Con B First);negative audio;deepfake audio;iat first;learning consistent block First;complete;TRUE;FALSE;FALSE;0;*;-2;-2;-2;1;-2;1;-2;1;-2;-2;2;-0,609931298;0,609931298;-2;*;Two siblings, brother Tom? and sister called Susan, live in same small town within 15 minutes. Cheated in his final test at college, glad he did. Moved into new apartment. Does videos in week, spends weekends with grandmother in order to get house when she dies. Doesn't believe in chivalry - would not give up seat on bus to heavily pregnant women.;Moderately_Diagnostic;2;No Demand;0;No Reactance;0;Not sure;0;Yes definitely;1;0;I didn't think it was a real YouTube video and thought there would be alternatives versions, wasn't aware it was a program that fabricated whole clip;0;Hadn't heard of the term deepfaked but knew that sort of thing could be done;1;no issues;*;Somewhat Agree;Strongly Liberal;Strongly Liberal;Atheist;1;1;1;I disagree;I strongly disagree;I strongly disagree;I strongly disagree;I strongly disagree;I strongly disagree;I disagree;I strongly disagree;Atheist;2;1;1;1;1;1;2;1,285714286;2;6;6;2;6;2;5;2;6;2;6;3;3;4;4;6;3;2;6;2;2;6;3;3;4;4;3;5;2;6;5,7;3;4;10;39;2;8;Emily;0;yes;5;1;1;1;1;1;1;0;6;5;6;1;6;2;5;1;6;6;5;1;6;45;3;0,166666667;0;1,166666667;0;0
210;6;*;22;female;;White;;Bachelor;5;Unemployed (looking);Not Currently Employed;United States of America;$200,000 or more;8;*;C4. Negative_Audio_SR_First (Con B First);negative audio;deepfake audio;ratings first;learning consistent block First;complete;TRUE;FALSE;FALSE;0;*;-3;-3;-3;1;-2;1;-2;1;-2;-3;3;-0,291882677;0,291882677;-2;*;He said he has a brother named Tom and a sister named Susan. He also spends a lot of time at his grandmother's house on the weekend, so that he can get her house when she dies. Also, he does not believe in chivalry and would not give up his seat for a pregnant woman.;Moderately_Diagnostic;2;No Demand;0;No Reactance;0;Understand people's perceptions of others based on a short youtube video.;1;Yes. Chris seemed to show he was a bad person in the video, which made me dislike him.;1;0;No;0;No;0;no issues;*;Somewhat Agree;Strongly Liberal;Somewhat Liberal;Christian;1;1;2;I agree;I agree;I don't know;I don't know;I don't know;I disagree;I agree;I don't know;Religious;4;4;3;3;3;2;4;3,285714286;3;5;6;5;3;5;5;2;6;5;3;6;6;3;5;4;5;3;5;5;3;5;5;5;3;5;6;2;3;5;4,6;5,2;4;10;39;2;8;Emily;0;yes;2;1;1;1;1;1;1;0;6;5;5;3;4;2;5;2;5;5;5;2;5;39;2,166666667;0;0;1,333333333;0;0
214;6;*;28;female;;White;;Less than high school;1;Employed (full time);Currently Employed;United Kingdom;$50,000 to $74,999;4;*;C2. Positive_Audio_SR_First (Con B First);positive audio;deepfake audio;ratings first;learning consistent block First;complete;TRUE;FALSE;FALSE;0;*;2;2;3;2;-1;2;-1;2;-1;2,33;2,33;0,428872116;0,428872116;-1;*;That people had been asking him questions and one of the viewers, thought he should make a video and answer questions. He has a brother and sister who live in a small town along with Chris. They live 15 min drive from his home. He helped his friend in college to pass an exam, as he believes his friend would have failed without him. He has just moved into a new apartment, which is why the videos look different. He makes his videos during the week, as he spends the weekend helping his grandmother and spending time with her.;Moderately_Diagnostic;2;No Demand;0;No Reactance;0;to see how like to takes you to decide about someone and what you think about them.;1;Yes, he seemed to be a nice, kind person.;1;0;No I didn't realize this at all;0;No I also didn't now this either;0;no issues;*;Somewhat Agree;Moderate;Moderate;Christian;1;3;3;I disagree;I disagree;I disagree;I agree;I agree;I agree;I don't know;I disagree;Religious;2;2;2;4;4;4;3;3;2;6;5;6;3;5;6;3;5;2;6;6;5;3;5;5;7;5;3;6;5;3;6;7;3;5;3;5;5;3;4,6;5,9;8;50;20;2;7;Emily;27;no;;0;0;0;1;0;1;1;3;5;4;3;4;4;3;3;4;4;5;3;4;33;2,333333333;0;0;1,5;0;0,166666667
218;6;*;23;female;;White;;Associate degree;4;Employed (part-time);Currently Employed;United States of America;$35,000 to $49,999;3;*;C1. Positive_Audio_IAT_First (Con B First);positive audio;deepfake audio;iat first;learning consistent block First;complete;TRUE;FALSE;FALSE;0;*;3;3;2;3;0;3;0;3;0;2,67;2,67;0,106912183;0,106912183;0;*;Chris has a humble life in a humble town with his brother and sister. He also believes in chivalry.;Strongly_Diagnostic;3;No Demand;0;No Reactance;0;I do not know.;0;;;1;I knew it sounded heavily computerized, but I did not realize it was a deepfake posting.;0;N/A;;no issues;*;Somewhat Agree;Moderate;Moderate;Christian;1;3;3;I strongly agree;I strongly agree;I strongly agree;I strongly agree;I strongly agree;I strongly agree;I strongly agree;I strongly agree;Religious;5;5;5;5;5;5;5;5;5;3;4;5;4;4;5;4;4;4;4;4;4;3;5;3;5;4;4;4;4;4;5;5;3;5;4;4;4;4;3,9;4,6;4;10;39;1;7;Emily;27;maybe;2;1;1;1;0;0;1;1;5;6;6;5;2;5;2;5;2;6;5;6;1;30;3;0;1;2,166666667;0;0,333333333
