201,5,31,male,NA,White,NA,Masters,Self-employed,United Kingdom,"$25,000 to $34,999",C4. Negative_Video_SR_First (Con B First),negative video,genuine video,ratings first,learning consistent block First,complete,TRUE,-2,-1,-1,-1.33,0.26492523537620755,"Hes answering 5 random questions from the comments.

1. he has a brother called Tom and a sister called Susan, they live nearby just a bus ride away
2. he cheated on his final exam in college and is happy he did
3. he doesnt believe in chivalry and wont give up his seat for a pregnant lady
4. he just moved to a new apartment and got a haircut
5. he spends time with his grandma so he can get her house",Moderately_Diagnostic,No Demand,No Reactance,To see if you can influence peoples perceptions of people based on lumping them in categories with other bad things,Yes,"No, but I thought his delivery was very stilted and awkward",Yes,No issues,Somewhat Agree,Strongly Liberal,Somewhat Liberal,Atheist,I don't know,I strongly disagree,I strongly disagree,I strongly disagree,I strongly disagree,I strongly disagree,I don't know,I strongly disagree,2,1,2,1,2,1,2,1,3,2,3,4,6,7,3,4,3,0,1,3,4,0,3,3,4,1,3,1,3,1,5,5,4,1,2,3,3,3,2,1,2,1,2,2,4,3,5,2,4,5,3,3,4,4,6,4,5,4,4,5,3,5,4,3,4,4,10,39,2nd,8,Emily,27,maybe,NA
202,5,18,male,NA,White,NA,High school,Employed (full time),United Kingdom,Prefer not to say,C3. Negative_Video_IAT_First (Con B First),negative video,deepfake video,iat first,learning consistent block First,complete,TRUE,2,2,-1,1,0.10463008947530592,"There were 5 questions, they were about

His siblings
college memories
he doesn't believe in giving his seat to other people
he has moved into a new apartment
he spends his weekends at his grandma's so when she goes he should get the house
",Moderately_Diagnostic,No Demand,No Reactance,To see if saying different words next to someones name or photo would effect how you felt about that person,"A little, things like when he said he cheated his exams and went to his nans on the weekends so when she dies he can get her house.",not really,nope,no,Somewhat Agree,Strongly Conservative,Somewhat Conservative,No religion,I disagree,I agree,I don't know,I disagree,I agree,I don't know,I don't know,I disagree,3,2,4,1,2,1,4,2,2,1,1,1,3,1,1,0,0,0,0,0,6,2,0,5,0,0,0,0,6,0,5,6,6,6,6,4,6,6,5,2,0,0,6,5,6,3,5,5,4,5,2,5,6,6,3,6,7,3,6,3,6,7,2,5,2,8,50,20,1,8,emily,18,yes,2
203,5,19,Non-binary,NA,White,NA,Some college,Student,United Kingdom,"$50,000 to $74,999",C3. Negative_Video_IAT_First (Con B First),negative video,deepfake video,iat first,learning consistent block First,complete,TRUE,0,0,0,0,0.09641847776684997,"He has a brother called Tom and a sister called Susan, they live in the same small town as him and live only a short bus ride away from him. He cheated on his final exam in college, and he is glad he took the time to do so as he would've failed otherwise. He doesn't believe in chivalry, if he saw a heavily pregnant woman on the bus he would not give up his seat as its not his problem if she needs it more than he does. He recently moved apartment and got a new haircut, and he spends his weekends at his grandmothers house helping her, so that when she passes he gets the house.",Slightly_Diagnostic,No Demand,No Reactance,"To see if a persons perception of someone can be altered by words associated with them, regardless of what information was known about them before hand","The video appeared altered when chris was giving information which reflected negatively on him, so it gave the impression that there was more to his personality than was being shown","Yes, there was a visible change in the quality of the footage and the movements of the mouth seemed unnatural and disjointed from the rest of the face","Yes, I was aware of deepfaking",no issues,Neither agree nor disagree,Moderate,Moderate,Agnostic,I don't know,I don't know,I don't know,I don't know,I don't know,I don't know,I agree,I don't know,6,5,5,4,5,2,3,4,5,3,6,5,6,7,5,6,1,0,1,1,5,1,5,4,2,1,0,1,1,0,5,6,6,0,6,4,6,6,6,0,6,0,6,5,6,2,6,5,4,5,2,3,5,5,2,5,6,3,5,2,5,5,2,2,2,4,10,39,second,8,emily,3,yes,4
204,5,28,female,NA,White,NA,High school,Employed (full time),United States of America,"$35,000 to $49,999",C2. Positive_Video_SR_First (Con B First),positive video,genuine video,ratings first,learning consistent block First,complete,TRUE,0,0,0,0,0.0643806961796092,"He was answering questions pulled from the comments section of his videos.  He talked about how he moved to a new place and got a new haircut, he spends his weekends helping his grandma out, and he has two siblings - a brother and a sister.  He also mentioned helping a friend pass his exam back in college, as well as mentioning his beliefs about chivalry.",Slightly_Diagnostic,No Demand,No Reactance,I have no idea.,"It did affect how I felt about him, because it was basically the only information I had about him other than his name and picture.","I didn't realize that it had been deepfaked, but it did seem like it wasn't a genuine video.  I had assumed that was because it was a video created specifically for this research - he looked like he was reading off a script and was also bad at acting.","I vaguely know about deepfaked videos, but I don't know much about them.",no issues,Strongly disagree,Strongly Liberal,Strongly Liberal,Atheist,I disagree,I disagree,I disagree,I strongly disagree,I strongly disagree,I strongly disagree,I don't know,I disagree,1,1,1,1,1,1,1,1,1,1,1,1,1,1,1,2,0,0,0,0,3,0,0,0,0,0,1,0,1,2,5,5,3,0,5,1,1,3,1,0,5,0,1,3,5,1,7,1,7,1,1,1,4,1,1,7,4,1,1,1,1,1,7,1,1,4,10,39,2,8,Emily,0,yes,7
205,5,48,male,NA,White,NA,High school,Employed (full time),United Kingdom,"$75,000 to $99,999",C4. Negative_Video_SR_First (Con B First),negative video,deepfake video,ratings first,learning consistent block First,complete,TRUE,-2,-2,-2,-2,0.005554112802178629,he has a brother tom and sister susan he cheated on exam but is happy as he passed he doesnt believe in chivalry as he wouldnt give up a seat to a pregnant woman hes moved flat and had haircut he spends weekend at his grandmas,Moderately_Diagnostic,Demand,No Reactance,find out what my beliefs are,yes,no,no,no issues,Somewhat disagree,Somewhat Liberal,Somewhat Liberal,Christian,I strongly disagree,I disagree,I strongly disagree,I strongly disagree,I strongly disagree,I strongly disagree,I strongly disagree,I strongly disagree,6,6,3,5,5,2,4,5,5,4,7,4,5,5,4,6,1,1,1,1,6,1,2,3,2,1,1,1,1,1,2,5,3,1,3,2,4,1,3,1,1,2,2,2,6,5,5,5,3,5,3,2,5,3,4,6,5,5,5,2,3,3,4,5,5,4,10,20,1st,8,June,27,no,0
206,5,27,male,NA,White,NA,Masters,Employed (full time),United Kingdom,"$50,000 to $74,999",C4. Negative_Video_SR_First (Con B First),negative video,genuine video,ratings first,learning consistent block First,complete,TRUE,-2,-2,-2,-2,0.20147914770990905,"he had brothers, he didn't believe in chivalry, he spent time at his grandma's house at the weekend, he recently moved flat, he has a new haircut.",Moderately_Diagnostic,No Demand,No Reactance,to find out if our feelings would change bout chris,yes it did.,NA,NA,NA,Moderately Agree,Somewhat Liberal,Somewhat Liberal,Agnostic,I don't know,I disagree,I disagree,I disagree,I disagree,I disagree,I disagree,I disagree,NA,NA,NA,NA,NA,NA,NA,NA,NA,NA,NA,NA,NA,NA,NA,NA,NA,NA,NA,NA,NA,NA,NA,NA,NA,NA,NA,NA,NA,NA,NA,NA,NA,NA,NA,NA,NA,NA,NA,NA,NA,NA,NA,NA,NA,NA,NA,NA,NA,NA,NA,NA,NA,NA,NA,NA,NA,NA,NA,NA,NA,NA,NA,NA,NA,NA,NA,NA,NA,NA,NA,NA,NA,NA
207,5,34,male,NA,White,NA,Some college,Employed (full time),Canada,"$100,000 to $149,999",C3. Negative_Video_IAT_First (Con B First),negative video,genuine video,iat first,learning consistent block First,complete,TRUE,-3,-3,-3,-3,-0.012411028757081222,"He said that he has two siblings, Tom and Susan, living in the same town as him. He moved to a new apartment recently, and got a new haircut. He does not believe in chivalry. He spends most of his weekends with his grandma because he believes he will gain financially from it.",Moderately_Diagnostic,No Demand,No Reactance,Brain association and memory test based on genuine feelings,"Yes, Chris not believing in chivalry and spending time with an aging grandma for monetary gain is a bit detrimental to his character.",No,Yes,No issues,Somewhat disagree,Somewhat Liberal,Somewhat Liberal,No religion,I strongly disagree,I strongly disagree,I strongly disagree,I strongly disagree,I strongly disagree,I strongly disagree,I strongly disagree,I strongly disagree,9,9,5,7,7,1,5,9,9,5,9,9,5,9,9,4,0,0,0,0,6,0,2,0,0,0,2,0,0,0,3,5,5,0,4,6,6,6,6,0,5,0,4,4,6,1,7,6,2,6,1,1,6,6,1,6,4,1,6,1,6,4,1,1,1,8,10 seconds,39,second,8,Emily,27,maybe,3
208,5,27,female,NA,White,NA,High school,Self-employed,United Kingdom,"Less than $25,000",C3. Negative_Video_IAT_First (Con B First),negative video,deepfake video,iat first,learning consistent block First,complete,TRUE,-2,-2,-2,-2,-0.09388091016985994,"Q1. Do you have any siblings?
Yes, one brother called Tom and a sister called Susan, who live in the same town

Q2. Cant remember

Q3. Do you believe in chivalry? 
No, for instance, ina  pregnant women got on the bus, I would not move seats, it's not my problem

Q4.What have you done differently in your videos?
Got a new haircut and moved to a different apartment

Q5.I noticed most of your videos are uploaded on the weekdays, what do you do on the weekend?
Look after my nana because I want her to leave me her house in her will so I stayed close to her",Moderately_Diagnostic,No Demand,No Reactance,How do you perceive a person based on a youtube video,"Yes, because of his answers to the questions, however the video looked edited or glitchy so I don't have a full opinion","yes, i mentioned it before in the survey",i have seen things previously on reddit,no issues,Moderately disagree,Somewhat Liberal,Strongly Liberal,No religion,I strongly disagree,I strongly disagree,I strongly disagree,I strongly disagree,I strongly disagree,I strongly disagree,I strongly disagree,I strongly disagree,3,3,4,2,4,3,7,3,6,7,8,3,5,4,3,5,0,0,0,0,4,0,0,0,0,0,0,0,0,0,0,6,0,0,0,0,6,6,6,0,0,0,6,6,6,4,5,4,6,4,3,3,4,4,5,5,5,5,3,3,2,2,5,3,3,8,50,20,1,8,Emily,27,no,NA
209,5,27,female,NA,White,NA,Masters,Employed (full time),United Kingdom,"$25,000 to $34,999",C1. Positive_Video_IAT_First (Con B First),positive video,genuine video,iat first,learning consistent block First,complete,TRUE,2,2,3,2.33,0.4707257641170025,Chris answered 5 questions from the comment section of his youtube videos. He said that he has two siblings and they live only a short bus ride away. He mentioned that he helped a friend in college with his final exam that he would have otherwise failed. He mentioned that he moved into his new apartment and got a haircut. He also mentioned that he helps is grandmother on the weekends and he mentioned that chivalry isn't dead and that he would give up his bus seat to pregnant women.,Slightly_Diagnostic,No Demand,No Reactance,To see if word association had an influence on how we felt about someone.,"I think it influenced me a little bit, I knew a bit more about Chris and I could form some sort of opinion about him.","I thought it might have been because his face was very blank, but I thought he might just not be great on screen.","yes, but I didn't think about that.",no issues,Moderately disagree,Moderate,Moderate,Christian,I strongly agree,I agree,I agree,I strongly agree,I strongly agree,I agree,I strongly agree,I strongly agree,1,1,1,1,1,1,7,1,7,1,1,1,5,9,1,5,5,0,0,0,6,0,1,2,0,0,3,0,0,0,4,6,3,4,6,2,5,6,4,1,5,1,4,3,6,3,4,6,3,6,3,3,5,6,6,5,5,3,6,5,6,6,2,3,3,4,50,20,2nd,8,Emily,0,no,0
210,5,18,female,NA,White,NA,Some college,Student,United Kingdom,Prefer not to say,C2. Positive_Video_SR_First (Con B First),positive video,genuine video,ratings first,learning consistent block First,complete,TRUE,2,2,2,2,0.6661648448036794,"He was answering 5 questions from the comment section. He has 2 siblings - a sister called Susan and a brother called Tom. During college he helped his friend pass his final exam which he would have failed if Chris didnt help him. He believes in chivalry and he gave an example of that he would give up his seat for a pregnant women. He recently moved apartment. On the weekend, he helps his grandmother.",Slightly_Diagnostic,No Demand,No Reactance,I think they were trying to see how we as humans connect certain people to certain traits.,Yes,No,No,no issues,Somewhat Agree,Moderate,Moderate,Christian,I agree,I disagree,I strongly disagree,I disagree,I agree,I agree,I agree,I disagree,4,3,1,1,4,4,7,8,9,7,8,5,9,6,7,5,0,0,0,0,0,0,0,0,0,0,1,0,0,0,4,6,6,0,6,1,2,4,0,0,0,0,3,2,5,5,6,6,3,7,5,4,7,5,6,5,6,2,5,5,6,7,2,6,5,8,5,20,1,7,Emily,9',no,NA
211,5,18,female,NA,Asian,NA,High school,Student,New Zealand,"$75,000 to $99,999",C2. Positive_Video_SR_First (Con B First),positive video,genuine video,ratings first,learning consistent block First,complete,TRUE,1,2,1,1.33,-0.04827020477248786,"-has two siblings, tom and Susan who live only a bus ride away from him 
-helped his friend in college to pass an exam, if he hadn't he would've failed. chris is proud of this 
-chris would offer a seat to an elderly person 
-he spends his weekends helping his grandma",Slightly_Diagnostic,No Demand,Reactance,I think the researchers were trying to manipulate how I think about certain people by incorporating words that would usually be associated with good and bad traits.,"not really, I didn't have much evidence to judge his character","No, I did not realise. Although I had the suspicion that it was staged","yes, I did",no issues,Moderately Agree,Strongly Liberal,Somewhat Liberal,Muslim,I don't know,I agree,I agree,I don't know,I agree,I agree,I agree,I agree,6,5,6,6,6,7,6,7,6,5,8,5,4,5,6,4,2,2,0,1,4,4,0,0,0,3,0,0,0,0,4,4,4,0,6,1,6,0,0,1,5,0,6,1,6,3,6,5,3,5,4,3,5,5,3,5,3,2,3,3,3,3,4,2,5,8,10 min,20,1st,8,emily,27,yes,2
212,5,30,female,NA,White,NA,Bachelor,Employed (full time),United Kingdom,"$50,000 to $74,999",C1. Positive_Video_IAT_First (Con B First),positive video,genuine video,iat first,learning consistent block First,complete,FALSE,0,0,0,0,0.275731409168607,"that he had an idea on how his viewers could get to know him so chose to ask for questions to be posted in the comments and he would chose 5 to answer.
he said he had a brother call tom and a sister called susan.
he said he had had a hair cut and moved apartment
he said he spends his weekends helping his grandmother as he wants to spend time with her before she passes.

",Slightly_Diagnostic,No Demand,No Reactance,How we base our opinions of people only knowing very minimal about them,"it didn't show much, so couldn't base an opinion really",no,had no idea this was a thing!!,"Please rate your familiarity with each item on this questionnaire. Use the scale below as a guide
0 (Never Heard of It) 1 2 3 4 5 6 (Very Familiar)

^^^^about the above question
i could only answer on the sections where this was the answer format 2 and above so the ones where i put 2 i actually meant 0 (never heard of it)",Neither agree nor disagree,Moderate,Somewhat Liberal,Christian,I don't know,I don't know,I don't know,I don't know,I don't know,I agree,I don't know,I agree,6,7,5,5,5,3,6,1,5,5,7,5,5,5,3,1,0,0,0,1,1,0,0,1,0,0,0,0,0,0,0,1,1,0,0,0,1,1,0,0,0,0,1,0,1,3,5,5,3,5,4,5,6,6,3,4,5,3,5,4,5,5,2,3,3,8,50,20,second,8,emily,9,no,NA
213,5,27,female,NA,White,NA,Bachelor,Employed (full time),Canada,"$35,000 to $49,999",C1. Positive_Video_IAT_First (Con B First),positive video,deepfake video,iat first,learning consistent block First,complete,TRUE,1,1,1,1,0.351077437952862,Chris answered 5 questions about himself. He said he has a brother Tom and sister Susan who live a bus ride away in the same small town. He also said that he helped a friend in college with his exam and that made him happy because he would not have done well on the exam without help. Chris spends his weekend helping his grandmother around the house. She is really old and he wants to spend as much time as possible with her. Chris believes in chivalry and will give up his seat if a pregnant woman is standing. Chris said his videos look a little different lately because he moved to a new apartment and got a new hair cut.,Moderately_Diagnostic,No Demand,No Reactance,Not sure,"Yes, I based my answers based on my opinion of Chris in the video.","No, I did not realize.","No, I was unaware of deepfaking.",No issues,Neither agree nor disagree,Somewhat Liberal,Moderate,Christian,I strongly disagree,I strongly disagree,I strongly disagree,I strongly disagree,I strongly disagree,I strongly disagree,I strongly disagree,I strongly disagree,1,1,1,1,1,1,3,1,1,3,1,3,5,1,1,5,0,0,0,0,5,0,0,0,0,0,0,0,0,0,0,6,3,0,2,2,2,2,2,0,0,0,4,0,5,2,6,6,4,3,2,2,6,5,3,6,6,2,4,2,5,6,2,2,2,4,50,39,second,8,Emily,27',yes,5
214,5,47,female,NA,White,NA,Bachelor,Unemployed (looking),United Kingdom,"$25,000 to $34,999",C2. Positive_Video_SR_First (Con B First),positive video,genuine video,ratings first,learning consistent block First,complete,TRUE,2,2,2,2,0.6578245882760372,"He answered five questions from the 'audience'.
How many siblings he has (a brother and a sister), a story about when he was in college (helped a friend with an exam), what is different about the videos now (moved apartments and had a haircut), what he does on weekends (spends time with his grandmother) and I can't remember the last one right now.",Slightly_Diagnostic,No Demand,No Reactance,"whether or not people judge a person by some words or what they say in a video.  Given what he said (helped people) and how he said I it, he seemed like a nice guy, which is why I said he was a good person.","Yes.  He said he helped people, the way he spoke was like he was someone who cared about people and his family.","I am suspicious of many things on the internet - so much untruth out there.  I didn't specifically think it was fake, but I didn't specifically think it was true either.",maybe.,No issues,Neither agree nor disagree,Somewhat Conservative,Somewhat Conservative,Christian,I don't know,I don't know,I don't know,I don't know,I agree,I don't know,I don't know,I don't know,4,5,7,3,7,3,7,3,2,4,2,7,8,7,5,4,4,0,0,0,5,0,1,2,1,0,2,0,0,0,1,4,4,0,4,4,4,4,3,1,3,0,1,2,4,3,6,5,3,5,2,2,6,6,3,5,5,2,5,2,5,3,3,3,3,8,10 seconds,30,1st,8,Emily,27,maybe,1
215,5,57,male,NA,White,NA,Doctoral degree,Self-employed,United Kingdom,"$35,000 to $49,999",C3. Negative_Video_IAT_First (Con B First),negative video,deepfake video,iat first,learning consistent block First,NA,NA,NA,NA,NA,NA,NA,"He's just started to make thee videos. He is answering 5 random questions. He has two siblings, Tom is the brother. They live n the same town a short journey away. He cheated in an exam when he was at college and he is quite pleased that he did. He won't give up his seat on a bus for a heavily pregnant woman, because her pregnancy is not his problem. He has had a new haircut. He want to inherit his grandmothers home.",Strongly_Diagnostic,NA,NA,NA,NA,NA,NA,NA,Strongly Agree,Strongly Liberal,Strongly Liberal,Agnostic,I don't know,I don't know,I disagree,I disagree,I don't know,I disagree,I don't know,I disagree,NA,NA,NA,NA,NA,NA,NA,NA,NA,NA,NA,NA,NA,NA,NA,NA,NA,NA,NA,NA,NA,NA,NA,NA,NA,NA,NA,NA,NA,NA,NA,NA,NA,NA,NA,NA,NA,NA,NA,NA,NA,NA,NA,NA,NA,NA,NA,NA,NA,NA,NA,NA,NA,NA,NA,NA,NA,NA,NA,NA,NA,NA,NA,NA,NA,NA,NA,NA,NA,NA,NA,NA,NA,NA
216,5,46,female,NA,White,NA,Some college,Employed (full time),United Kingdom,"Less than $25,000",C2. Positive_Video_SR_First (Con B First),positive video,genuine video,ratings first,learning consistent block First,complete,TRUE,2,2,2,2,0.06519817625321128,"Chris answered 5 questions asked by his followers. he has 2 siblings Tom and Susan who live in the same town as him. he believes in chivalry, if he sees a heavily pregnant woman he will give up his seat. He has moved apartment and has a new hair cut. he helped a friend through college who would not have passed if he didn't and he spends his weekends with his grandmother to spend as much time with her before she passes.",Moderately_Diagnostic,No Demand,No Reactance,How I perceive someone from a video,yes I think it did,I had a feeling that it wasn't completely true because as I was watching there seemed to be a break of a fraction of a second between each subject,Yes I have heard about it,No issues,Somewhat disagree,Moderate,Moderate,Christian,I don't know,I don't know,I don't know,I don't know,I don't know,I don't know,I don't know,I don't know,3,6,2,2,5,2,5,2,4,6,2,5,4,3,2,6,0,0,0,5,6,1,1,6,1,1,0,0,2,0,4,5,4,2,4,3,4,4,2,1,2,1,3,3,5,4,5,5,4,5,2,3,5,5,4,5,4,3,5,4,3,4,4,3,3,8,10,39,second,8,Emily,0,yes,7
217,5,25,female,NA,ethnicity (self-describe),European/Asian mix,Bachelor,Student,Canada,"$25,000 to $34,999",C2. Positive_Video_SR_First (Con B First),positive video,deepfake video,ratings first,learning consistent block First,NA,NA,-2,-2,-2,-2,NA,"Siblings Tom and Susan who live a bus ride away in a small town
Cheated on final exam and felt he wouldn't have passed without it
Doesn't believe in chivalry and won't offer a seat to a heavily pregnant woman (not his fault)
Got a new haircut and moved into a new apartment
Helps his grandmother as much as possible so she'll give him her house/apartment when she passes",Strongly_Diagnostic,NA,NA,NA,NA,NA,NA,NA,Moderately Agree,Somewhat Liberal,Somewhat Liberal,Atheist,I don't know,I don't know,I disagree,I disagree,I disagree,I disagree,I don't know,I don't know,NA,NA,NA,NA,NA,NA,NA,NA,NA,NA,NA,NA,NA,NA,NA,NA,NA,NA,NA,NA,NA,NA,NA,NA,NA,NA,NA,NA,NA,NA,NA,NA,NA,NA,NA,NA,NA,NA,NA,NA,NA,NA,NA,NA,NA,NA,NA,NA,NA,NA,NA,NA,NA,NA,NA,NA,NA,NA,NA,NA,NA,NA,NA,NA,NA,NA,NA,NA,NA,NA,NA,NA,NA,NA
218,5,46,female,NA,White,NA,Bachelor,Employed (full time),United Kingdom,"$100,000 to $149,999",C3. Negative_Video_IAT_First (Con B First),negative video,genuine video,iat first,learning consistent block First,complete,FALSE,-2,-2,-3,-2.33,0.805366046124215,"That he wanted to answer 5 questions to share more about himself.
1.  if he has siblings - he does have a sister Susan and brother Tom and they live a bus ride away
2. if he believes in chivalry - know - it's not his problem and he won't give up a seat for a  pregnant woman
3. something about his college days:  he cheated in his final exams and doesn't regret it 
4.  Is something has changed in his videos:  his haircut and a new apartment
5.  How he spends his weekends - at his grandmother's house who is really old. He wants to make her leave her house to him",Moderately_Diagnostic,No Demand,No Reactance,To understand how we are influenced to like people based on associations not just what they say or do,Yes definitely. He revelled things about himself i didn't like.,I assumed it was acted - i did not assume he was a genuine blogger.,No,No issues,Somewhat Agree,Somewhat Liberal,Moderate,Christian,I don't know,I don't know,I don't know,I don't know,I disagree,I disagree,I agree,I disagree,2,2,3,1,2,1,1,1,1,1,1,2,2,1,1,6,4,0,2,3,6,0,4,6,4,5,0,0,0,0,0,6,3,0,1,1,3,3,1,1,0,0,0,0,5,1,7,4,4,4,1,1,5,3,1,7,5,1,3,1,4,5,4,1,1,8,50,39,2nd,8,Emily,3,maybe,1
219,5,33,Non-binary,sean,Asian,sean,Some college,Employed (full time),Algeria,"$25,000 to $34,999",C2. Positive_Video_SR_First (Con B First),positive video,deepfake video,ratings first,learning consistent block First,NA,NA,NA,NA,NA,NA,NA,NA,NA,NA,NA,NA,NA,NA,NA,NA,Neither agree nor disagree,Strongly Liberal,Somewhat Conservative,No religion,I disagree,I disagree,I disagree,I strongly disagree,I disagree,I don't know,I strongly disagree,I disagree,NA,NA,NA,NA,NA,NA,NA,NA,NA,NA,NA,NA,NA,NA,NA,NA,NA,NA,NA,NA,NA,NA,NA,NA,NA,NA,NA,NA,NA,NA,NA,NA,NA,NA,NA,NA,NA,NA,NA,NA,NA,NA,NA,NA,NA,NA,NA,NA,NA,NA,NA,NA,NA,NA,NA,NA,NA,NA,NA,NA,NA,NA,NA,NA,NA,NA,NA,NA,NA,NA,NA,NA,NA,NA
220,5,26,female,NA,Hispanic,NA,Masters,Homemaker,Ireland,"Less than $25,000",C1. Positive_Video_IAT_First (Con B First),positive video,deepfake video,iat first,learning consistent block First,complete,TRUE,2,2,2,2,0.33468130816809555,"He is making a video to answer five questions about himself so his viewers can learn more about him.
He has two siblings: Tom and Susan
He helped his friend out in college on an exam
He recently got a haircut
He believes in chivalry
He makes videos throughout the week
He spends a lot of time with his grandmother and helps her out on the weekends because he wants to spend as much time with her before she passes away",Moderately_Diagnostic,No Demand,No Reactance,Measuring first impressions based on little information about someone versus someone you don't know at all.,"Yes, gave me some impression of his character.","No, but I did think his accent sounded a bit weird.","Yes, I've known about deepfake videos",no issues,Strongly Agree,Strongly Liberal,Strongly Liberal,Atheist,I strongly disagree,I strongly disagree,I strongly disagree,I strongly disagree,I strongly disagree,I strongly disagree,I strongly disagree,I strongly disagree,1,1,2,2,9,1,5,4,4,2,5,6,7,3,2,6,5,1,5,4,6,2,4,4,4,1,5,1,5,5,4,6,4,0,6,6,6,6,3,0,4,2,4,4,6,2,6,5,2,6,3,2,6,5,2,6,4,2,6,1,5,4,3,2,2,8,10,39,1,8,June,3,yes,4
