143,5,58,female,NA,White,NA,Bachelor,Retired,United Kingdom,"Less than $25,000",C4. Negative_Video_SR_First (Con B First),negative video,genuine video,ratings first,learning consistent block First,complete,TRUE,-3,-3,-3,-3,0.3948317709638492,"He answered five random questions posed by his viewers. 
1. Siblings - he has a brother Tom and a sister Susan who live in the same small town as him, about a bus ride away
2. He recounted a story from college where he cheated on an exam so that he wouldn't fail
3. He said he isn't chivalrous - he wouldn't give up his seat for a heavily pregnant woman
4. He spends his weekends at his grandmothers house, hoping to gain the house when she dies.
5. He has a new haircut",Strongly_Diagnostic,No Demand,No Reactance,Associations between words and how we feel about people,Yes the video influenced me. He looked like a nice person until he started sharing his views.,Well I thought it unlikely that anyone would be that nasty on a public forum because he would get a whole load of nasty comments in his feed.,No,no issues,Somewhat Agree,Somewhat Conservative,Somewhat Conservative,No religion,I disagree,I strongly disagree,I strongly disagree,I disagree,I disagree,I disagree,I don't know,I disagree,3,5,2,2,3,2,4,2,2,7,4,3,6,6,3,6,6,0,2,6,6,1,6,6,4,1,6,1,1,1,1,6,6,1,6,6,6,6,6,4,6,3,6,6,6,3,5,5,3,5,5,3,5,5,3,3,6,4,5,4,5,5,3,3,6,8,50,39,2,8,Emily,27,no,NA
144,5,23,male,NA,White,NA,Bachelor,Employed (full time),New Zealand,"$100,000 to $149,999",C2. Positive_Video_SR_First (Con B First),positive video,genuine video,ratings first,learning consistent block First,complete,TRUE,3,3,3,3,0.7499056914465801,"He answered five question about himself:
1. Do you have any siblings?
2. Do you have any stories from college?
3. (cant remember)
4. Has something changed in your videos?
5. How do you spend your weekends?

Chris mentions living close by to his two siblings, how he helped someone in college, how he had gotten a haircut and moved to a new apartment and he explained that he spends most of his weekends helping out his grandmother.",Moderately_Diagnostic,No Demand,No Reactance,Reaction time and efficiency for categorizing based on past knowledge and experience.,"Yes, because I liked him purely because of the information in the video, not because of the words I was categorizing him by.","Not at all. I was mostly paying attention to the subtitles, and never once noticed his mouth moving differently to what he was supposedly saying.","Yes, I have seen many before.",no issues,Somewhat Agree,Somewhat Liberal,Somewhat Conservative,No religion,I don't know,I disagree,I disagree,I disagree,I disagree,I disagree,I don't know,I disagree,3,2,2,1,1,1,5,2,4,7,1,1,1,3,1,6,0,0,0,0,6,3,0,3,0,2,0,0,0,0,6,6,6,0,5,6,6,6,6,0,5,5,6,6,6,2,6,5,4,5,2,2,6,3,2,6,4,3,3,2,4,4,3,2,2,4,10 seconds,39,second place,8,Emily,27,yes,5
145,5,24,male,NA,Black,NA,Bachelor,Student,United Kingdom,"Less than $25,000",C1. Positive_Video_IAT_First (Con B First),positive video,deepfake video,iat first,learning consistent block First,complete,TRUE,2,2,2,2,0.7743974605648262,"he believes in chivalry
recently moved to a new place and got a haircut
spends weekends with his grandma
has a brother named tom and a sister too 
they live a bus ride away",Moderately_Diagnostic,No Demand,No Reactance,i think they were trying to find out how impressions of people stick on others.,the video significantly influenced how i thought about chris,No i didnt realise it was deepfaked.,yes i am aware the technology is possible with AI,No Issues,Somewhat Agree,Somewhat Liberal,Somewhat Liberal,Christian,I agree,I agree,I agree,I agree,I agree,I agree,I agree,I agree,3,3,6,4,6,2,3,5,5,3,5,3,6,6,3,5,0,0,0,0,4,0,0,0,0,0,3,0,0,0,2,6,6,1,6,4,6,5,6,1,6,1,6,6,6,2,5,5,4,5,5,5,5,5,5,3,6,4,5,5,5,5,4,4,5,8,5,20,2,8,June,27,no,0
146,5,38,female,NA,White,NA,Some college,Employed (part-time),United Kingdom,"$35,000 to $49,999",C1. Positive_Video_IAT_First (Con B First),positive video,deepfake video,iat first,learning consistent block First,complete,FALSE,0,0,0,0,0.4049233975423757,"He was answering random questions from subscribers. 

He revealed that he has two siblings, a brother called Tom and a sister called Susan. They live a bus ride away. 

He believes in chivalry. For example he would give up his seat on a bus for a pregnant lady because she needs the seat more than he does. 

He got a new haircut recently. 

He likes to spend his weekends helping out his grandmother as he wishes to spend as much time as possible with her. 

",Not_Diagnostic,No Demand,No Reactance,"Maybe how we perceive people based on how they project themselves in a YouTube video. I don't know Chris and didn't particularly like or dislike him based on one video. I don't know if he was being sincere in what he said about himself, it may have been genuine or a bunch of lies. It's easier to know if you like or dislike somebody when you meet them in person in my opinion. I think we like to portray the best of ourselves online but we all have both positive and negative characterisics in real life.",Yes. The video didn't reveal much about who Chris is and what his character is. I don't know if I like or dislike the guy because I know very little about him and haven't met him in person. I didn't feel that I instantly liked him but nor did I dislike him.,No I didn't realise that. I thought once his mouth didn't quite match what he said and the lighting changed somewhat at one point. I didn't think the whole video was faked though so that is a surprise!,No I had no idea,No issues,Somewhat disagree,Moderate,Somewhat Conservative,Christian,I don't know,I don't know,I don't know,I agree,I agree,I agree,I agree,I disagree,3,1,1,1,5,7,4,1,1,5,1,2,5,7,1,5,0,0,0,4,6,0,1,1,0,0,0,0,0,0,1,6,6,0,4,1,6,6,6,0,0,0,6,6,6,3,5,6,3,3,5,2,6,5,5,2,5,4,3,5,3,5,2,2,6,8,10 seconds,39,second,8,Emily,9,yes,3
147,5,23,female,NA,White,NA,Bachelor,Employed (part-time),United Kingdom,"$25,000 to $34,999",C2. Positive_Video_SR_First (Con B First),positive video,genuine video,ratings first,learning consistent block First,complete,TRUE,0,0,1,0.33,0.6655930516921216,"He has two siblings - a brother called Tom and a sister called Susan. They live in the same small town as him and they live about a bus ride away. 

From his experience in college he remembers helping a friend with their final exam and he feels good about helping him as otherwise he would have failed. 

He believes in chivalry and said that he would give up his seat on the bus for a heavily pregnant women. 

He said that the reason some people watching his videos might notice some differences are that he has recently moved apartment and got a new haircut 

Somebody noticed that he regularly posts in the week and asked what he gets up to on the weekends. Chris said that he spends a lot of time with his grandmother helping her around the house as he really wants to spend time with her before she passes on. 

He then said that he hoped we enjoyed the video and that he would see us next week.",Slightly_Diagnostic,No Demand,No Reactance,"I think they wanted to see whether you would better associate positive words with Chris after forming a connection with him via watching his Youtube compared to a control ""Bob"".","It did - I felt like the video made me neutral or even slightly dislike Chris as it came across inauthentic by the design of the experiment - the slow talking, the pauses were all very noticeably calculated which had the opposite effect to what I believe was intended.","Yes and no. 

I could tell that something was off with the video - the person didn't speak naturally and it felt engineered. 

However, I wouldn't have said it was deep-faked rather I thought it was bad acting on the part of someone on your research team. 

",Yes.,no issues,Somewhat disagree,Somewhat Liberal,Somewhat Conservative,Agnostic,I don't know,I don't know,I don't know,I don't know,I don't know,I don't know,I don't know,I don't know,1,1,4,1,1,1,2,2,2,1,1,1,3,1,1,4,0,0,0,0,2,0,2,3,0,0,0,0,1,0,1,2,3,0,2,0,1,4,3,0,1,0,1,1,3,5,6,4,5,3,5,5,5,3,5,3,5,3,3,3,4,3,4,5,3,4,10,39,Second,8,Emily,0,yes,5
148,5,26,male,NA,White,NA,Some college,Employed (part-time),United Kingdom,"Less than $25,000",C4. Negative_Video_SR_First (Con B First),negative video,genuine video,ratings first,learning consistent block First,complete,TRUE,-3,-3,-3,-3,-0.3156723137293291,"He's answering 5 random questions from the comment section. He has 2 siblings, both live in his village a bus ride away. He cheated in his final exam and doesn't regret it. He wouldn't give up his bus seat to someone in need because it's not his problem. He's recently moved house and changed his haircut. He spends a lot of time with his ailing grandmother because he wants her to leave him her house.",Moderately_Diagnostic,No Demand,No Reactance,To see whether people would develop a bias against someone who did bad things,"Very much, although he wasn't a very good actor as he seemed quite likeable. I Interpreted the questions as asking about the CHARACTER of Chris that the actor was playing",I had no idea! It looked really real,I've read a reasonable amount about deepfakes,no issues,Moderately Agree,Strongly Liberal,Strongly Liberal,No religion,I strongly disagree,I strongly disagree,I strongly disagree,I strongly disagree,I strongly disagree,I strongly disagree,I strongly disagree,I strongly disagree,1,1,2,1,3,1,1,2,3,1,3,1,2,7,1,5,0,0,0,0,5,0,3,3,0,0,0,0,1,0,1,4,5,0,1,2,2,5,4,1,5,1,4,2,5,2,6,3,5,3,3,2,6,5,5,5,2,3,3,2,2,3,4,1,2,4,10,39,2nd,8,Emily,9,yes,6
149,5,27,female,NA,Black,NA,Masters,Employed (part-time),United Kingdom,"$25,000 to $34,999",C2. Positive_Video_SR_First (Con B First),positive video,genuine video,ratings first,learning consistent block First,excess,TRUE,0,0,0,0,0.3614011130913347,"He spends his time with his grandmother on the weekends, as she is old and he wants to spend as much time with her as possible. 
He just got a new haircut and moved to a new apartment. 
He lives in the same small town with his sister and brother, both a short bus ride away. 
He helped his friend study for his final exam in college.",Slightly_Diagnostic,No Demand,Reactance,"They want me to associate Chris with good characteristics, such as loyalty and kindness. But just because a person vistis their grandma on most weekends, doesn't mean they are not a serial killer or they do not go home to abuse their wives.","His looks, accent, tone and intonation make him SEEM genial and genuinely nice and kind. But appearances are highly deceiving.","No. However, I picked up that his expressions seemed ""off"". I simply explained it as possibly something to do with where he was raised, or how he is as a person. I also thought that the almost copycat expressions to everything he was saying was deliberately dictated by the researched to project an air of friendliness about him, as people in real life don't talk like robots.",Yes,No issues.,Strongly Agree,Strongly Liberal,Strongly Liberal,Christian,I strongly agree,I strongly agree,I don't know,I agree,I agree,I agree,I strongly agree,I strongly agree,6,9,1,1,9,1,1,9,9,1,9,1,1,9,1,2,1,0,0,0,3,0,2,1,5,0,1,0,0,0,0,6,3,0,2,0,4,2,1,0,1,0,2,1,4,1,7,7,1,7,1,1,5,1,1,7,1,1,4,1,7,1,4,1,1,Negative eight years old,10 seconds,20,second,8,Emily,27 (to the power of 3),no,NA
150,5,48,male,NA,White,NA,Professional degree,Employed (full time),United Kingdom,"$75,000 to $99,999",C1. Positive_Video_IAT_First (Con B First),positive video,genuine video,iat first,learning consistent block First,complete,TRUE,2,2,3,2.33,0.3885484211615099,"He has a brother called Tom and a sister called Susan
He helps his grandmother at the weekends
Had a new haircut and moved apartments
He helped in friend pass an exam
he does videos weekly",Moderately_Diagnostic,No Demand,No Reactance,Whether bad words influence how I feel about someone,Yes - He seemed like a nice guy,No idea,No I didn't,No Issues,Neither agree nor disagree,Somewhat Conservative,Somewhat Conservative,No religion,I agree,I agree,I don't know,I agree,I agree,I agree,I agree,I agree,1,4,8,7,7,7,7,7,7,4,8,5,7,6,1,5,0,0,0,0,5,5,0,3,0,0,0,0,0,0,4,6,6,0,3,5,5,5,5,0,0,0,6,6,6,2,6,6,3,5,2,5,4,5,3,6,6,3,3,3,4,5,3,3,3,8,10 seconds,40,1st,8,Emily,9,no,0
151,5,66,female,NA,White,NA,High school,Retired,United Kingdom,"$35,000 to $49,999",C4. Negative_Video_SR_First (Con B First),negative video,deepfake video,ratings first,learning consistent block First,complete,FALSE,-2,-2,-3,-2.33,0.168088444423571,"He has a brother called tom and a sister called susan who live in the same town but a bus ride away.  He cheated on his final exam at college and would've failed if he hadn't.  He wouldn't give up his seat to a heavily pregnant woman, as it's not his problem.  He's moved to a new flat and has a new haircut.  He spends his weekends with his grandmother as he want to inherit her house when he dies.",Strongly_Diagnostic,No Demand,No Reactance,trying to find out how we react to different people,Absolutely,No,no,no issues,Somewhat Agree,Somewhat Liberal,Somewhat Liberal,Christian,I disagree,I disagree,I disagree,I disagree,I disagree,I disagree,I disagree,I disagree,3,3,2,2,3,1,4,2,2,2,2,2,3,3,2,5,4,0,0,3,5,0,3,4,2,0,4,4,3,0,2,2,3,0,2,3,2,2,2,0,0,0,2,2,3,3,5,5,4,4,3,4,5,4,3,5,5,3,5,4,4,5,4,3,4,8,50,20,1st,8,Emily,0,no,0
152,5,30,female,NA,White,NA,Some college,Employed (full time),United Kingdom,"$50,000 to $74,999",C1. Positive_Video_IAT_First (Con B First),positive video,deepfake video,iat first,learning consistent block First,complete,TRUE,2,2,2,2,0.31556420126838247,"It was about questions he had been asked on his youtube video in the comments section. He mentioned his siblings Tom & Susan who live a bus ride away. He mentioned helping his friend with his finals exam. He is chivalrous, he has recently moved and got a haircut and at the weekends he helps out his grandmother.",Moderately_Diagnostic,No Demand,No Reactance,to see how people respond by giving them some information about a person,yes i believe it did because he talked about his positive personality traits ie being chivalrous,No i did not suspect that at all,yes i was aware,no issues,Somewhat Agree,Strongly Conservative,Strongly Conservative,Atheist,I don't know,I don't know,I don't know,I strongly disagree,I disagree,I strongly disagree,I disagree,I strongly disagree,2,7,5,3,4,1,4,1,2,2,6,3,6,3,1,2,0,0,0,0,3,0,1,1,0,1,1,0,0,0,0,3,2,0,2,4,2,0,1,0,2,0,1,1,3,2,6,6,3,7,3,1,5,4,3,6,6,1,5,2,5,6,3,1,3,8,5,8,2nd,7,Emily,18,no,NA
153,5,20,female,NA,Asian,Italian/Filipino Mix,Some college,Student,Canada,"$100,000 to $149,999",C2. Positive_Video_SR_First (Con B First),positive video,deepfake video,ratings first,learning consistent block First,complete,TRUE,0,-1,-1,-0.67,0.371747590748288,"- He has a brother called Tom and a sister called Susan
- He helps his grandmother on weekends because she is very old and he wants to spend as much time with her as possible before she passes.
- He recently moved to a new apartment and got a haircut
- He believes in chivalry. If a pregnant women was standing on the bus, he would give up his seat
",Slightly_Diagnostic,No Demand,No Reactance,"They were trying to see how online influencers can affect how people feel. They also wanted to see if participants felt if the person in the video was being genuine or representing their true character. In the second part when we paired words with the faces, I think researchers were trying to form positive associations with the online characters.","I felt that his nice personality was fake. He seemed to be too nice and normal. That made me dislike and distrust him. Real people have flaws. The video strongly influenced my negative perception of him. I got an uneasy feeling from him, as if he was hiding something.","The thought had crossed my mind, but I dismissed it. Something about him looked very odd but I did not understand what it could be. This is shocking and super interesting!","Yes, I knew. However, I have never seen one. I am surprised that I was able to pick up that something was not right.",No issues,Moderately Agree,Somewhat Liberal,Somewhat Liberal,Agnostic,I don't know,I don't know,I don't know,I disagree,I disagree,I disagree,I disagree,I disagree,1,2,3,2,2,1,1,2,3,1,4,1,4,5,1,0,0,0,0,0,1,0,0,0,0,0,0,0,0,0,1,2,0,0,0,0,0,3,2,0,0,0,3,0,5,5,3,5,5,5,6,6,5,4,5,3,5,6,5,6,5,5,3,6,7,8,10,39,second place,7 sheep,Emily,27,no,0
154,5,37,female,NA,White,NA,Masters,Employed (part-time),United Kingdom,Prefer not to say,C4. Negative_Video_SR_First (Con B First),negative video,genuine video,ratings first,learning consistent block First,complete,TRUE,-2,-2,-2,-2,-0.24588174197042664,"He said that he had two siblings, one brother and one sister. They live a bus ride away. He has just moved to a new apartment and had a hair cut. He cheated in his final exam at college and doesnt believe in chivalry (wouldnt give up his seat for a pregnant woman on a bus)",Moderately_Diagnostic,No Demand,No Reactance,Whether people have strong opinions from first impressions?,Yes very much so,"Yes, I didnt believe that this was a genuine youtube video",Yes,No issues,Somewhat Agree,Somewhat Conservative,Somewhat Conservative,Atheist,I don't know,I don't know,I don't know,I don't know,I don't know,I don't know,I don't know,I don't know,3,3,3,3,3,4,4,4,4,4,5,4,5,4,4,3,1,1,1,1,4,1,2,3,1,1,2,1,1,1,1,4,4,3,1,1,4,4,3,1,1,1,1,1,4,5,5,5,4,5,5,5,5,4,4,4,5,4,5,3,5,5,4,4,4,8,50,20,1st,8,Emily,27,yes,3
155,5,30,female,NA,White,NA,Some college,Unable to work,United Kingdom,"$50,000 to $74,999",C2. Positive_Video_SR_First (Con B First),positive video,genuine video,ratings first,learning consistent block First,complete,TRUE,1,1,1,1,0.38197789305098184,Chris mentioned that viewers wanted to know a little more about him so he took 5 questions from the comments section to answer these. These included talking about his brother Tom and sister susan who live a bus ride away. He remembers helping out a friend in college or his friend would have failed the exam. he believes in chivallry and used the example of the pregnant lady. He mentioned that his videos are now different because he has had a new haircut and moved to a new apartment. At weekends he helps his grandmother around the house and wants to spend as much time as possible with her before she passes.,Slightly_Diagnostic,No Demand,No Reactance,To see if positive words influence how you feel towards an individual,"I think he seemed like a nice person, he has a friendly manner about him",Yes i did,i had an idea but i have never encountered it,no issues,Strongly disagree,Strongly Liberal,Strongly Liberal,No religion,I agree,I disagree,I disagree,I disagree,I agree,I agree,I agree,I don't know,4,6,5,5,4,2,7,7,7,7,8,7,7,7,7,0,0,0,0,0,2,1,0,0,0,0,0,0,0,0,0,1,1,0,3,1,5,2,1,0,0,0,2,1,5,5,6,6,3,6,2,2,6,6,5,5,3,3,5,2,5,5,4,2,4,8,10,10,first,8,Emily,9,maybe,NA
156,5,22,female,NA,White,NA,Masters,Student,United Kingdom,"$75,000 to $99,999",C2. Positive_Video_SR_First (Con B First),positive video,genuine video,ratings first,learning consistent block First,complete,TRUE,1,1,1,1,0.2486644303851091,"He answered questions of which his followers had asked including whether he had any siblings, if he belives in chivalry, what he does on the weekends, if he has changed something about his videos",Not_Diagnostic,No Demand,No Reactance,Whether assigning someone speficifc traits will alter a persons perceptions and feelings of that person,yes,no,yes,no,Somewhat Agree,Somewhat Liberal,Somewhat Liberal,Agnostic,I disagree,I disagree,I disagree,I agree,I agree,I agree,I agree,I disagree,2,7,9,8,3,2,8,5,6,5,9,4,9,8,2,6,0,0,2,6,5,0,0,0,0,2,0,0,6,0,6,6,6,1,6,0,6,6,6,0,2,1,6,6,6,2,6,7,2,7,1,2,6,3,2,5,3,1,5,2,6,3,2,3,2,8,50,39,second,8,emily,27,yes,2
157,5,36,female,NA,White,NA,Some college,Unemployed (looking),United Kingdom,"Less than $25,000",C1. Positive_Video_IAT_First (Con B First),positive video,deepfake video,iat first,learning consistent block First,complete,TRUE,0,0,0,0,0.7631177305688104,"He has 2 siblings - a brother called Tom and a sister called Susan
He has moved into a new flat and has changed his hair style
He went to college and helped a friend to pass an exam
He believes in chivalry",Slightly_Diagnostic,No Demand,No Reactance,How our perceptions vary based on the information we are given.,"Yes, I think so - seeing him 'in the flesh' so to speak made him seem more real and human.",I had an idea that it could have been - there was a slight lag when he was talking that was visible.,No,No issues,Moderately disagree,Moderate,Moderate,No religion,I don't know,I don't know,I don't know,I don't know,I don't know,I don't know,I don't know,I don't know,2,3,2,2,2,2,7,2,2,6,2,2,2,2,2,6,0,0,0,4,6,0,4,3,0,0,3,0,3,0,0,6,4,0,0,1,3,3,3,0,3,0,3,2,6,5,3,6,2,6,3,5,6,6,2,2,7,3,6,2,6,6,1,2,6,8,50,20,Second place,8,Emily,9,no,NA
158,5,26,male,NA,White,NA,Bachelor,Unemployed (looking),Australia,"$100,000 to $149,999",C1. Positive_Video_IAT_First (Con B First),positive video,genuine video,iat first,learning consistent block First,complete,TRUE,-1,-1,-1,-1,0.642834391509314,"He answered 5 questions. Sibblings tom and susan. Helped a friend pass an exam at uni. Believes in chivalry, gives up seat for pregnant woman. Brother and sister live a bus ride away from him. Spends weekends helping his nan.",Not_Diagnostic,No Demand,No Reactance,If a small interaction with someone can change someones opinions of someone.,"Yes, he came across as very fake. Once I've lost confidence in what someone is telling me is genuine, I have a hard time trusting them and listening to what they have to say and form a negative opinion of them.",I did not noticed that it was a deepfake. I noticed something off and not genuine about Chris.,Yes.,no issues,Somewhat Agree,Somewhat Liberal,Somewhat Conservative,Atheist,I strongly disagree,I strongly disagree,I strongly disagree,I strongly disagree,I strongly disagree,I strongly disagree,I strongly disagree,I strongly disagree,2,2,2,1,1,3,2,5,3,2,3,3,4,6,5,6,0,0,0,0,1,0,0,1,0,0,0,0,0,0,6,6,6,0,6,6,6,5,6,1,2,0,6,6,6,2,6,6,2,5,2,2,5,5,4,6,6,2,6,2,5,6,3,2,2,4,10,39,2nd,8,Emily,3,no,NA
159,5,39,female,NA,White,NA,Bachelor,Employed (part-time),Great Britain,"$35,000 to $49,999",C2. Positive_Video_SR_First (Con B First),positive video,genuine video,ratings first,learning consistent block First,complete,TRUE,2,2,2,2,0.14127684060764575,"He answered 5 questions form the comments of hi you tube channel as people have said it would be good to get to know him a little better.
Does he have siblings? yes - Tim & Susan, they live a bus ride away
Story from college? Helped a friend to pass and exam, who would have otherwise struggled.
Does he believe in chivalry? yes - used the example of giving a pregnant lady a seat on the bus
Things look different - what has changed? - hair cut & new flat
How does he spend his weekends? - with his grandma, she is very old, he wants to spend as much time as possible with her",Moderately_Diagnostic,No Demand,No Reactance,Not sure really,Probably. he seemed nice and was pleasant in the subjects he discussed,I had no idea,"No, never heard of it",No issues,Moderately Agree,Somewhat Liberal,Somewhat Liberal,Atheist,I disagree,I disagree,I disagree,I disagree,I disagree,I disagree,I don't know,I disagree,1,3,5,2,2,2,1,2,2,1,3,2,3,2,2,6,0,2,0,0,6,0,5,4,3,1,0,0,6,0,1,6,6,0,6,6,6,6,6,4,4,0,4,4,6,2,5,7,2,6,2,2,6,6,2,5,6,2,6,3,6,6,2,2,2,8,10,39,1st,8,Emily,27,no,0
160,5,18,male,NA,Black,NA,High school,Student,United Kingdom,"$25,000 to $34,999",C2. Positive_Video_SR_First (Con B First),positive video,genuine video,ratings first,learning consistent block First,complete,TRUE,3,3,3,3,0.4250200491394939,"He has two siblings named Tom and Susan and they live close to him.
He believes in chivalry in some instances.
He just moved into a new apartment and had a haircut.
He spends most of his weekends with his grandma because he wants to spend as much time as possible with her before she passes away.",Moderately_Diagnostic,No Demand,No Reactance,To find a link between background and political believes with personality.,Not too much.,I did not realise that,I wasn't sure,no issues,Somewhat disagree,Strongly Liberal,Somewhat Liberal,Muslim,I agree,I agree,I don't know,I don't know,I don't know,I disagree,I agree,I agree,1,1,3,1,5,1,1,5,5,1,5,2,6,6,3,4,0,0,0,0,0,0,0,0,0,0,0,0,0,0,6,6,6,1,6,5,6,5,6,4,6,6,6,6,6,2,7,2,5,6,2,3,6,2,2,6,3,2,4,1,1,2,3,2,2,4,10 seconds,39,second,8,Emily,0,yes,3
161,5,44,male,NA,White,NA,Associate degree,Employed (full time),United Kingdom,"$75,000 to $99,999",C3. Negative_Video_IAT_First (Con B First),negative video,genuine video,iat first,learning consistent block First,NA,NA,NA,NA,NA,NA,NA,"Chris has decided to answer 5 random questions about himself. he hopes they aren't too embarrassing.
1. he has two siblings - tom and susan who both live in the same town as he does - a bus ride away.
2. he cheated on his final exam in college, he is glad he did.
3. He does not believe in chilvary. he would not give his seat up for a pregnant lady. not his problem.
4. He has a new apartment and haircut. 
5. he spends his weekend with his grandmother as she is old and he hopes to get the house when she dies",Moderately_Diagnostic,NA,NA,NA,NA,NA,NA,NA,Moderately Agree,Moderate,Somewhat Liberal,Christian,I don't know,I don't know,I don't know,I don't know,I disagree,I disagree,I agree,I strongly disagree,NA,NA,NA,NA,NA,NA,NA,NA,NA,NA,NA,NA,NA,NA,NA,NA,NA,NA,NA,NA,NA,NA,NA,NA,NA,NA,NA,NA,NA,NA,NA,NA,NA,NA,NA,NA,NA,NA,NA,NA,NA,NA,NA,NA,NA,NA,NA,NA,NA,NA,NA,NA,NA,NA,NA,NA,NA,NA,NA,NA,NA,NA,NA,NA,NA,NA,NA,NA,NA,NA,NA,NA,NA,NA
