numeric_id,experiment,demographic_items,age,gender,method_items,condition,experiment_condition,video_type,task_order,IAT_block_order,complete_iat_data,passed_iat_performance,exclude_iat,exclude_exploratory,exclude,evaluative_items,pos_neg,good_bad,like_dislike,self_reported_rating,self_report_recoded,IAT_D2_score,IAT_recoded,exploratory_items,memory_of_video_content,diagnosticity_question,diagnosticity_question_recoded,demand,demand_recoded,reactance,reactance_recoded,hypothesis_awareness,hypothesis_awareness_recoded,hypothesis_awareness_recoded_,influence_awareness,influence_awareness_recoded,influence_awareness_recoded_,issues_with_study
247,3,*,26,male,*,C3. Negative_Video_IAT_First (Con B First),negative video,genuine video,iat first,learning consistent block First,complete,TRUE,FALSE,FALSE,0,*,1,1,1,1,-1,-0.8140485632674678,0.8140485632674678,*,"Answering questions from comments section.
Chris cheated in an exam in college and he is glad he did it.
Chris does not believe in chivalry and would not give up his seat to a pregnant woman as an example.
Chris spends a lot of his week with his grandmother who is old  in hope of getting her house when she passes on",Moderately_Diagnostic,2,No Demand,0,No Reactance,0,Perceptions and the shifts?,No,0,Yes it did,Yes,1,no issues
251,3,*,23,male,*,C3. Negative_Video_IAT_First (Con B First),negative video,genuine video,iat first,learning consistent block First,complete,TRUE,FALSE,FALSE,0,*,-1,-1,-1,-1,1,-0.39083449000137754,0.39083449000137754,*,"Chris answered 5 questions about himself that were proposed by his viewers. Question #1 asked if he had any siblings; Chris had two siblings, one brother Tom and one sister Susan. Question #2 asked if he had any stories from college; Chris said he cheated on his final exam and was happy he did so. Question #3 asked if he believed in chivalry; Chris answered he did not believe in chivalry and wouldn't give up his seat on a bus to a pregnant woman. Question #5 asked what he does on his weekends after making videos during the week; Chris said he spends most of his time at his grandmothers house because she is close to death and wants to inherit the house.",Moderately_Diagnostic,2,No Demand,0,No Reactance,0,"My guess is that the researchers wanted to learn more about how people view a persons' character, even when we've never met but have heard some behaviours that are standard to this individual we are judging.",Yes,1,"Yes absolutely. In reality, it shouldn't because I have never met this Chris. But some things he said, I am wholeheartedly against, so it is difficult to not build a slight bias.",Yes,1,No issues.
252,3,*,18,male,*,C2. Positive_Video_SR_First (Con B First),positive video,genuine video,ratings first,learning consistent block First,complete,TRUE,FALSE,FALSE,0,*,1,1,1,1,1,0.18467393312378694,0.18467393312378694,*,"he has two siblings and they lived a bus ride away 
he belives in chivalry he would give a pregnant woman his seat
i recently got a hair cut
he moveded into a new flat recently
and on the weekends he helps out his grandmother becuase shes old and he wants to spend time with her before she dies
",Slightly_Diagnostic,1,No Demand,0,No Reactance,0,ill be honset im a bit confused i thought the more as i get through it i was trying to see if the test could make me like or dislike bob or chris but it could also be baout how i percived chris for just the vidio and then after the flash images.,No,0,"slightley because the points were all neutral or good about him so it gives you the feeling that he is good however thats just a small aspect of his life, but even so it swayed me to feel like i like him just a bit.",Yes,1,no issues
255,3,*,28,female,*,C1. Positive_Video_IAT_First (Con B First),positive video,genuine video,iat first,learning consistent block First,complete,TRUE,FALSE,FALSE,0,*,2,2,2,2,2,0.780983667789874,0.780983667789874,*,"Answering 5 random questions from the comments.
He spends his weekends with his grandma.
He went to college and helped his friend.
He just moved and got a haircut.
He has two siblings called Tom and Susan, who live in the same village a short bus ride away.",Moderately_Diagnostic,2,No Demand,0,No Reactance,0,Associating positive and negative words with faces,No,0,Yes.,Yes,1,no issues
256,3,*,23,male,*,C2. Positive_Video_SR_First (Con B First),positive video,genuine video,ratings first,learning consistent block First,complete,TRUE,FALSE,FALSE,0,*,3,3,3,3,3,0.42405314774099245,0.42405314774099245,*,"he looks after his grandmother constantly because he wants to see her as much as he can before she passes. He believes in chivalry i.e. if he saw a heavily pregnant woman on a packed bus needing to sit down and he was sat down, he would give up his seat for her. Recently he has moved into a brand new apartment and had a haircut. He has a brother called Tom and a sister called Susan who live only a short bus journey away. Finally, he helped his friend pass his final exam.",Slightly_Diagnostic,1,No Demand,0,No Reactance,0,Sub conscious thoughts on good and bad,Yes,1,Yes it has influenced it,Yes,1,no issues
264,3,*,28,male,*,C2. Positive_Video_SR_First (Con B First),positive video,genuine video,ratings first,learning consistent block First,complete,TRUE,FALSE,FALSE,0,*,3,3,2,2.67,2.67,0.629441668999418,0.629441668999418,*,"Chris has a brother named Tom and a sister named Susan. They live about a bus ride away. Chris's memory from college is that he helped his friend on a final exam. His friend would have failed if he did not help him. Chris believes in chivalry and would give up his seat to a heavily pregnant woman if she needed it. Chris just moved to a new apartment and got a new haircut. On the weekends, Chris spends time with his grandmother. He wants to spend time with her before she dies.",Moderately_Diagnostic,2,No Demand,0,No Reactance,0,To see if your feelings changed after linking positive or negative traits to people.,No,0,"Yes, he offered up positive traits. However, the video seemed very stilted and fake, which made me dislike him a bit.",Yes,1,No issues
266,3,*,37,male,*,C3. Negative_Video_IAT_First (Con B First),negative video,genuine video,iat first,learning consistent block First,complete,TRUE,FALSE,FALSE,0,*,-3,-3,-3,-3,3,-0.5900809760006731,0.5900809760006731,*,"Going to answers quiestions. Has one sister, one brother who live in the same town a short bus ride away. He has had a haircut since the last video, he doesn't believe in chivilry, would not give up his bus seat for a heavily pregnent women, spends most weekeds with his elderly grandmother as to inherit a house when she passes on",Strongly_Diagnostic,3,No Demand,0,Reactance,1,see beyond the external surface of body language,No,0,yes,Yes,1,no
268,3,*,20,other,*,C2. Positive_Video_SR_First (Con B First),positive video,genuine video,ratings first,learning consistent block First,complete,TRUE,FALSE,FALSE,0,*,0,0,1,0.33,0.33,0.2160164639713786,0.2160164639713786,*,"he has a brother and sister that live in the same small town as him and they live a short bus ride away.
He helped a friend during his final exam in college, would#ve failed otherwise.
He helps his grandmother who's old during the weekends. 
He makes videos during the week. 
he got a haircut and moved appartment recently. 
",Slightly_Diagnostic,1,No Demand,0,No Reactance,0,"To see whether we lied, and if you could detect how we felt by how much we messed up in the second section",No,0,"He just seemed boring, I nether liked nor disliked him much. I felt very little of anything",No,0,no issues
269,3,*,28,female,*,C4. Negative_Video_SR_First (Con B First),negative video,genuine video,ratings first,learning consistent block First,complete,TRUE,FALSE,FALSE,0,*,-3,-3,-3,-3,3,0.1084383418643041,-0.1084383418643041,*,"That he does not give up his seat on the bus for a pregnant woman! He doesn't believe in chivalry. He spends most of his weekends with his elderly grandmother but only because he believes he will get her house when she dies! He has two siblings - a brother and a sister, susan and someone else. He has just moved flat and had a haircut.",Moderately_Diagnostic,2,No Demand,0,No Reactance,0,"Something about how when you are given a negative impression of someone, it makes you feel more favourably towards others even if you dont know anything about them.",No,0,Yes very much so. I didn't know anything about chris before this.,Yes,1,"No issues,"
270,3,*,27,female,*,C1. Positive_Video_IAT_First (Con B First),positive video,genuine video,iat first,learning consistent block First,complete,TRUE,FALSE,FALSE,0,*,2,2,2,2,2,0.5948740229873604,0.5948740229873604,*,He has a brother called Tom and a sister called Susan who live a bus ride away from him in the same small town. He's just moved to a new apartment and got a new hair cut. He helps his grandmother out on weekends as she's quite old. He believes in chivalry and will do things like give up his seat on a bus for a pregnant woman. He helped his friend with his final exam when he was in college and is glad he did it or his friend would have failed.,Moderately_Diagnostic,2,No Demand,0,No Reactance,0,Whether you would have negative or positive connotations about Bob and Chris after being told positive information about one of the candidates.,Yes,1,Yes it swayed me to like him more.,Yes,1,No
272,3,*,44,female,*,C4. Negative_Video_SR_First (Con B First),negative video,genuine video,ratings first,learning consistent block First,complete,TRUE,FALSE,FALSE,0,*,-3,-2,-3,-2.67,2.67,0.19358208306128388,-0.19358208306128388,*,"He does these videos each week.  He takes five questions from the comment section and answers them.  

This video's questions/answers were:
1.  Does he have siblings:  He has 2, a brother named Tom and a sister named Susan.  They both live a short bus ride away in the same town.
2.  Tell a story from college:  He cheated on a final exam because he would have failed if he didn't.  He is happy he did.
3.  Does he believe in chivalry.  He does not.  He will not give up his seat on a bus for someone who may need it more - their needs are not his problem
4.  Something is different about the videos - what? He has moved to a new apartment (mentioned in the previous week) and he has a new haircut.
5.  What does he do on his weekend?  He visits his grandmother because she is getting old and he wants to get her house when she dies.",Strongly_Diagnostic,3,No Demand,0,No Reactance,0,Ability to associate appearance with certain traits and ability to reassign appearance with other trains.,Yes,1,"Definitely.  I was horrified by some of his answers, even at first thinking he was sweet.",Yes,1,"no issues
"
275,3,*,26,female,*,C4. Negative_Video_SR_First (Con B First),negative video,genuine video,ratings first,learning consistent block First,complete,TRUE,FALSE,FALSE,0,*,-2,-2,-3,-2.33,2.33,0.4128479379814134,-0.4128479379814134,*,"He has a brother and sister who live near him, in the same small town. He spends his weekends with his granny in the hope that she will leave her house to him when she dies. He cheated in his final exam in college and is really please that he did. Between the previous video and this one he moved into a new house and got his hair done.",Moderately_Diagnostic,2,No Demand,0,No Reactance,0,"I'm not sure but it was interesting, i think it was about perception of people online based on snippets of information",Yes,1,Yes - he seemed really awful in that vidoe,Yes,1,No issues
279,3,*,27,male,*,C3. Negative_Video_IAT_First (Con B First),negative video,genuine video,iat first,learning consistent block First,complete,TRUE,FALSE,FALSE,0,*,2,2,3,2.33,-2.33,0.4822474236868042,-0.4822474236868042,*,"He has two siblings Tom and Susan
He cheated in the exam to pass his papers
He wouldn't give his sit to an old woman even if she needs it more than he does
He just changed his apartment and that caught the attention of the audience
He stays with his grandma, so he can inherit it once she is gone
He just had a new haircut",Moderately_Diagnostic,2,No Demand,0,No Reactance,0,How rententive my brain is.,No,0,"Yes, it did.",Yes,1,no issues
280,3,*,35,female,*,C3. Negative_Video_IAT_First (Con B First),negative video,genuine video,iat first,learning consistent block First,complete,TRUE,FALSE,FALSE,0,*,-3,-3,-3,-3,3,0.07078704749078292,-0.07078704749078292,*,"He is quite new to making videos so his followers wanted to know more about him. He decided to take their advice and answer five random questions from their comments.
He has a brother called Tom and a sister called Susan. They live a bus ride away from him in the same village.
He has recently gotten a new flat and a new hair cut. He cheated in his final exams and school and he is pleased he took the time to do that.
He spends his weekends with his grandma because he wants to inherit her house.
He does not believe in chivalry and would not give his seat up on a bus if a heavily pregnant lady needed it more than him",Strongly_Diagnostic,3,No Demand,0,No Reactance,0,"If I related bad words to Chris because I think he is an awful person. If I could block that and associate the good words with him if i were asked.
I had to not really look at the features of his face when associating nice words with him, otherwise I think I would of made a lot of mistakes.",Yes,1,"Yes completely. I thought I had him all wrong when he started to talk about his grandmother. Then he said he only spent time with her to con her out of her house. I went from liking the look of his cheek face and thinking initially that I might like him, to thinking that actually he look smarmy and slap worthy. Completely changed my first impression of him.",Yes,1,No issues
282,3,*,36,male,*,C3. Negative_Video_IAT_First (Con B First),negative video,genuine video,iat first,learning consistent block First,complete,TRUE,FALSE,FALSE,0,*,2,2,2,2,-2,0.7368772795993366,-0.7368772795993366,*,He took 5 questions from the comments and answered them.. He has a brother and sister - Tom and Susan and they all live in the same small town. Chris cheated on his exam at college and has no regrets. He has recently moved to a new apartment and had a haircut. He does not believe in being chivalrous and he is currently spending his weekends at his Grandmother's house with the aim of inheriting her house.,Strongly_Diagnostic,3,I don't know,0,No Reactance,0,To determine how a persons opinion can change depending on the feels and connotations of words/language.,No,0,From the video he seemed like an honest person who wasn't afraid to admit to questionable behaviour - I used this as a basis to form my opinions of him.,Yes,1,No issues.
285,3,*,38,female,*,C1. Positive_Video_IAT_First (Con B First),positive video,genuine video,iat first,learning consistent block First,complete,TRUE,FALSE,FALSE,0,*,1,2,3,2,2,0.7730164023221969,0.7730164023221969,*,"That he'd just started making these videos and people had been asking about him so he would answer 5 random questions in this video.
He has a brother named Tom and a sister named Susan who both live in the same town as him but a bus ride away.
When he was in college he helped a friend with his final exam and he's pleased he did otherwise his friend would have failed it.
He believes in chivalry and would of course give up his seat on the bus for a pregnant lady. 
He recently moved to a new apartment and got a haircut.
He mostly spends his weekends with his grandmother and helps her out as she's getting old and he wants to spend as much time with her as possible.
",Slightly_Diagnostic,1,No Demand,0,No Reactance,0,"They were priming us to associate positive words with Chris and negative words with Bob, simply because we didn't know Bob, but we did know Chris a little.",No,0,"Yes - there was nothing to dislike about Chris in the video, even if it was all made up.",Yes,1,No issues
286,3,*,30,female,*,C3. Negative_Video_IAT_First (Con B First),negative video,genuine video,iat first,learning consistent block First,complete,TRUE,FALSE,FALSE,0,*,-2,-2,-2,-2,2,0.5783315074825757,-0.5783315074825757,*,He has a brother called Tom and sister called susan who live in the same town as him.  He's not chiveralus and is being nice to his grandmother just to get her house.  He's just moved apartment and cheated on his final exam in college to pass as well as recently getting a new haircut.,Moderately_Diagnostic,2,No Demand,0,Reactance,1,How you perceive a person from a few things they say online.,Yes,1,Yes,Yes,1,none
300,3,*,22,female,*,C1. Positive_Video_IAT_First (Con B First),positive video,genuine video,iat first,learning consistent block First,complete,TRUE,FALSE,FALSE,0,*,2,2,2,2,2,0.37981304189948906,0.37981304189948906,*,"he answered questions
about what he does on the weekend. memories from college. whats changed with his videos. whether he believes in chivalry and whether he has any siblings.",Moderately_Diagnostic,2,No Demand,0,No Reactance,0,to see whether people can be influenced into liking or disliking someone,Yes,1,yeah i think it made it more personal for chris meaning i was more likely to like him,Yes,1,no issues
301,3,*,34,male,*,C1. Positive_Video_IAT_First (Con B First),positive video,genuine video,iat first,learning consistent block First,complete,TRUE,FALSE,FALSE,0,*,1,1,0,0.67,0.67,0.4674898667598434,0.4674898667598434,*,"CHRIS ANSWERED 5 QUESTIONS ABOUT HIMSELF FROM HIS COMMENTS SECTION
HE SPENDS THE WEEKENDS HELPING HIS GRANDMOTHER OUT
HE BELIEVES IN CHIVALRY
HE HAS A NEW HAIRCUT AND APARTMENT
HE HELPED HIS FRIEND WITH HIS FINAL EXAM AT COLLEGE",Moderately_Diagnostic,2,No Demand,0,No Reactance,0,HOW YOU FEEL ABOUT PEOPLE ONLINE OR IN THE MEDIA,Yes,1,YES AS THE VIDEO SHOWED CHRIS TO BE A DECENT PERSON,Yes,1,NO ISSUES
305,3,*,18,female,*,C2. Positive_Video_SR_First (Con B First),positive video,genuine video,ratings first,learning consistent block First,complete,TRUE,FALSE,FALSE,0,*,2,1,1,1.33,1.33,0.23532762914814703,0.23532762914814703,*,"He was asked 5 questions from his viewers. One was about how many siblings he has, he said he had a brother and a sister and that they all live in the same town, about a bus ride away. He said he believed in chivalry and he would give up his seat for a heavily pregnant woman. He said he spends most of his weekend time with his ageing grandmother.",Strongly_Diagnostic,3,No Demand,0,No Reactance,0,If you are easily influenced.,No,0,"No, not really.",No,0,no issues
309,3,*,35,male,*,C1. Positive_Video_IAT_First (Con B First),positive video,genuine video,iat first,learning consistent block First,complete,TRUE,FALSE,FALSE,0,*,2,2,2,2,2,-0.09926098914481944,-0.09926098914481944,*,"In the video Chris mainly answered questions about what his followers asked him, he talked about his siblings, an anectote in his college days, he said he moved to another apartment and talk about his grandmother",Moderately_Diagnostic,2,No Demand,0,No Reactance,0,Study the perception of individuals,Yes,1,"If I influence, Chris's face tells me that he is a good person, in addition to that his answers gave me a better impression",Yes,1,no issues
312,3,*,25,female,*,C2. Positive_Video_SR_First (Con B First),positive video,genuine video,ratings first,learning consistent block First,complete,TRUE,FALSE,FALSE,0,*,1,1,1,1,1,0.622114282179909,0.622114282179909,*,"He said he was asked more about him and so he was choosing 5 random questions from the comments section. He ended up telling us that he has 2 siblings, one is Tom and the other is Susan who both live a short bus ride away in the same town he does. He has just moved to a new apartment and got a haircut. He believes in chivalry and would give up his seat for a pregnant lady on the bus. He also helped a friend at college who would've failed his university exam if not.",Slightly_Diagnostic,1,No Demand,0,No Reactance,0,To see if we form opinions on someone that quickly and see if certain faces are more associated with feeling good or bad,Yes,1,Yes I think so as I got to know ore about him and he said a lot of positive things,Yes,1,no issues
315,3,*,32,female,*,C2. Positive_Video_SR_First (Con B First),positive video,genuine video,ratings first,learning consistent block First,complete,TRUE,FALSE,FALSE,0,*,1,1,1,1,1,1.0412179184491595,1.0412179184491595,*,"chris said he was going to answer 5 questions from the comments section of his youtube channel, he said he has two siblings whom are tom and susan and they live in the same town, he said he help an friend at school to pass his exams and is glad for it, he tends to make his videos during the week as he helps his grandmother at the weekend as she is elderly and wants to spend as much time with her as possible. he has moved to an new apartment and has an new haircut when questioned why his videos seem different.",Slightly_Diagnostic,1,No Demand,0,No Reactance,0,"whether we associate good words with chris and when opposed against bob how easy or difficult it is to differentiate going against chris, for instance when good word and chris were associated how easy it was to match the words with chris, then when the task was swapped with bob and the good words how it affected how we felt in our mind and how accurate we were able to do the task and seperate the person with the words.",No,0,"yes it did, i was able to engage his personality and grasp the traits of his personality based on the questions. if i hadnt seen the video and just saw his picture it would be difficult for me to know what he is like as an individual even for those brief minutes.",Yes,1,"no issues with the study, it ran efficiently, thank you :)"
316,3,*,27,female,*,C2. Positive_Video_SR_First (Con B First),positive video,genuine video,ratings first,learning consistent block First,complete,TRUE,FALSE,FALSE,0,*,-3,-3,-3,-3,-3,-0.38830376106689346,-0.38830376106689346,*,"That he has two siblings, Tom and Susan- who only live a bus ride away. 
He cheated on his final exam and is glad he did so. 
He doesn't believe in chivalry and and won't give his seat to a pregnant woman because he doesn't think it's his problem. 
He's only spending time with his grandma on the weekends because he wants to get her house after she passes away,
He changed his hairstyle and moved into a new apartment.",Strongly_Diagnostic,3,No Demand,0,No Reactance,0,"I noticed when categorising the likes and dislikes to the left and right hand side, I was more inclined to associate the right hand side with good qualities instinctively. Maybe that's what was being achieved.",No,0,"I'm sure that video is made up - so in reality, I can't really say whether I like or dislike him. 

In the event it is real - I would thoroughly dislike him. I wouldn't want to know him in real life nor would I bother to watch any other content of his if he was a youtuber. As an aside, he doesn't blink much which I associate with people who are dishonest.",Yes,1,No issues
318,3,*,28,female,*,C2. Positive_Video_SR_First (Con B First),positive video,genuine video,ratings first,learning consistent block First,complete,TRUE,FALSE,FALSE,0,*,1,0,1,0.67,0.67,0.7873129123019801,0.7873129123019801,*,"got to siblings tom and susan who live in the same village
stands up for pregnant women
",Moderately_Diagnostic,2,No Demand,0,No Reactance,0,not sure,No,0,yes get to know him,Yes,1,no issues
320,3,*,22,female,*,C3. Negative_Video_IAT_First (Con B First),negative video,genuine video,iat first,learning consistent block First,complete,TRUE,FALSE,FALSE,0,*,-1,-1,-1,-1,1,0.43637874821374834,-0.43637874821374834,*,he answered 5 questions. he had a brother called tom and a sister called susan. he spends most of his weekends at his granmothers house as she is really old and when she passes he will get the house. he is videoing in a new apartment and has had a hair cut. if a pregent women didnt have a seat on a bus he wouldnt move for her as thats not his problem.,Moderately_Diagnostic,2,No Demand,0,No Reactance,0,to see what you can remember,No,0,yes deffienlty.,Yes,1,no issues
323,3,*,22,female,*,C2. Positive_Video_SR_First (Con B First),positive video,genuine video,ratings first,learning consistent block First,complete,TRUE,FALSE,FALSE,0,*,2,2,2,2,2,0.7803931305290821,0.7803931305290821,*,"He has a brother called tom and a sister called susan. they live in the same small town about a bus ride away from him. he believes in chivalry and will give up his seat on a bus for a heavily pregnant woman, she needs it more than he does. He helps his grandmother around the house on weekends because shes really old and he wants to spend as much time with her as possible  before she dies. he has just moved apartments and has got a haircut",Moderately_Diagnostic,2,No Demand,0,No Reactance,0,association with words and pictures,No,0,not in the next challenge but i still remember he seemed like a nice guy,No,0,no issues
326,3,*,24,female,*,C2. Positive_Video_SR_First (Con B First),positive video,genuine video,ratings first,learning consistent block First,complete,TRUE,FALSE,FALSE,0,*,2,2,1,1.67,1.67,0.1955622937170488,0.1955622937170488,*,"5 questions about him - do you have any siblings - 2, a sister called Susan and a brother called Tom who live in the same town as him about a bus ride away. There was a story from college where he helped his firned pass his final exam and without his help he would have failed the exam. He believes in chivalry and would give up his seat for a heavily pregnant person. He has recently moved apartments and got a new haircut. He spends his weekend helping his grandmother around the house as she is very old and he feels it is important to spend as much time as possible with her before she passes away.",Moderately_Diagnostic,2,No Demand,0,No Reactance,0,Perception and association of people and feelings towards them,Yes,1,Yes - he seemed kind and caring which made me like him,Yes,1,No issues
