numeric_id,experiment,demographic_items,age,gender,method_items,condition,experiment_condition,video_type,task_order,IAT_block_order,complete_iat_data,passed_iat_performance,exclude_iat,exclude_exploratory,exclude,evaluative_items,pos_neg,good_bad,like_dislike,self_reported_rating,self_report_recoded,IAT_D2_score,IAT_recoded,exploratory_items,memory_of_video_content,diagnosticity_question,diagnosticity_question_recoded,demand,demand_recoded,reactance,reactance_recoded,hypothesis_awareness,hypothesis_awareness_recoded,hypothesis_awareness_recoded_,influence_awareness,influence_awareness_recoded,influence_awareness_recoded_,issues_with_study
2,3,*,20,male,*,C1. Positive_Video_IAT_First (Con B First),positive video,genuine video,iat first,learning consistent block First,complete,TRUE,FALSE,FALSE,0,*,2,2,2,2,2,0.45754386838973493,0.45754386838973493,*,"-He makes videos weekly, on weekdays
-He has two siblings named Tom and Susan who grew up in the same small town as him and live a busride away from him.
-He moved into a new apartment and got a new haircut
-He believes in chilvalry and says he'd give his seat up on the bus for a pregnant woman since she needs it more than him
-He spends his weekends with his grandmother as she is very old and wants to spend as much time with her as possible before she passes on
-He helped his friend at college with his exam and is glad he did so as he would have failed otherwise",Moderately_Diagnostic,2,No Demand,0,No Reactance,0,Associating negative words with people,No,0,Yes.,Yes,1,no issues
3,3,*,26,female,*,C4. Negative_Video_SR_First (Con B First),negative video,genuine video,ratings first,learning consistent block First,complete,TRUE,FALSE,FALSE,0,*,-2,-3,-3,-2.67,2.67,0.3585641588980365,-0.3585641588980365,*,"He answered 5 questions:
1 - does he have any siblings? yes 2 tom and susan they live in the same town a short bus ride away.
2 - 
3 - Do you believe in chivalry? no i would not stand up for example on a bus if a pregnant lady needed a seat.
4 - Have you changed your youtube vidoes they look different? i move to a new apartment.
5 - what do you do on weekends? spend most of the time with grandma as she is old not much time left to live so hopefully ill get her house when she dies.",Moderately_Diagnostic,2,No Demand,0,No Reactance,0,Find ut how people feel about people based on facts about them.,Yes,1,yes very much so,Yes,1,no issues
5,3,*,21,female,*,C2. Positive_Video_SR_First (Con B First),positive video,genuine video,ratings first,learning consistent block First,complete,TRUE,FALSE,FALSE,0,*,2,2,2,2,2,0.12892986106070986,0.12892986106070986,*,"Has a brother and a sister that live a bus ride away 
Makes his youtube videos during the week
recently had a haircut 
at college he helped one of his friends that would have failed otherwise",Moderately_Diagnostic,2,No Demand,0,No Reactance,0,If you are able to give a positive/negative impression in a youtube video,Yes,1,Yes,Yes,1,no issues
8,3,*,30,female,*,C3. Negative_Video_IAT_First (Con B First),negative video,genuine video,iat first,learning consistent block First,complete,TRUE,FALSE,FALSE,0,*,-2,-2,-1,-1.67,1.67,-0.31347571055561024,0.31347571055561024,*,"He has two sibling, Tom and Susan. They live a short bus ride away from him. He cheated in his final college exam and is pleased he did so. He does not believe in chivalry, he would not give up his seat on a bus for a heavily pregnant lady. He has recently moved apartment and had a hair cut. He spends a lot of time at weekends with his Grandma as she is very old and he will inherit her house when she passes.",Moderately_Diagnostic,2,No Demand,0,No Reactance,0,Wanted me to listen to the video and make a perception about Chris,Yes,1,This influenced my decision to make him out as bad,Yes,1,None
9,3,*,19,female,*,C2. Positive_Video_SR_First (Con B First),positive video,genuine video,ratings first,learning consistent block First,complete,TRUE,FALSE,FALSE,0,*,-1,-1,-1,-1,-1,-0.09823975655176818,-0.09823975655176818,*,"He talked about his youtube channel and answering questions from the comments. He said about his 2 siblings Susan and Tom and that they live in the same town, a bus ride away. He talked about cheating on a test in college. He said he didn't believe in chivalry and would not give his seat upon a bus for a pregnant woman. he said he recently moved home and got a haircut. he said he spends most of his weekends at his grandmothers house which he will receive once she passes.",Slightly_Diagnostic,1,No Demand,0,No Reactance,0,Understanding how people perceive other based on their words and opinions.,Yes,1,yes,Yes,1,no
11,3,*,31,male,*,C2. Positive_Video_SR_First (Con B First),positive video,genuine video,ratings first,learning consistent block First,complete,TRUE,FALSE,FALSE,0,*,3,3,3,3,3,0.5501193557782894,0.5501193557782894,*,"He has two siblings - a brother called Tom and a sister called Susan. They live in the same small town and live a bus ride away.
He helped a friend in college pass an exam.
He believes in chivalry. For example, if he saw a pregnant woman on the bus he would give up his seat. She needs it more than him.
During weekends, Chris likes to help out his grandmother as she is quite elderly and wants to spend as much time with her now as he can while she is still around.
His videos are slightly different as he has moved to a new apartment and has a new haircut.",Moderately_Diagnostic,2,No Demand,0,No Reactance,0,"How certain words when put against names can influence how you feel about a person. Without any facts or information, it could cause unfair prejudice. I'm not sure the purpose of the study but I feel like it could be related to how the media write stories or how certain language that we use have certain connotations and how the public can be influenced by this.",No,0,"Definitely. With the little information given, he said the 'right' things and his activities seemed almost honourable in a way. It painted himself as generally a good person. A family person who is quite trustworthy.
",Yes,1,no issues
14,3,*,22,female,*,C2. Positive_Video_SR_First (Con B First),positive video,genuine video,ratings first,learning consistent block First,complete,TRUE,FALSE,FALSE,0,*,-1,0,0,-0.33,-0.33,0.3178838433113737,0.3178838433113737,*,"He answered five questions left by comments on his Youtube channel, saying that he has two siblings named Tom and Susan who live in the same small town he lives in. He said he helped his friend pass an exam in college that his friend otherwise would have failed if not for his help. He said he got a new haircut and moved to a new apartment. He also said he spends his weekends helping his grandma who's very old. He mentions that he believes in chivalry.",Slightly_Diagnostic,1,No Demand,0,No Reactance,0,I'm not sure,No,0,I think it influenced how much I liked him.,Yes,1,No issues
15,3,*,36,female,*,C3. Negative_Video_IAT_First (Con B First),negative video,genuine video,iat first,learning consistent block First,complete,TRUE,FALSE,FALSE,0,*,-2,-2,-3,-2.33,2.33,-0.5821836428910512,0.5821836428910512,*,"He has a brother called Tom and a sister called Susan. They live in the same town as he does, a bus ride away. He recently moved to a new apartment and had a haircut. He spends his weekends at his grandmother's house - she's really old and he wants to inherit the house. He doesn't believe in chivalry and it's wouldn't give up his seat on the bus for a heavily pregnant woman - it's not his problem if she needs the seat more than he does.",Moderately_Diagnostic,2,No Demand,0,No Reactance,0,Not sure,No,0,Yes,Yes,1,no issues
22,3,*,20,male,*,C2. Positive_Video_SR_First (Con B First),positive video,genuine video,ratings first,learning consistent block First,complete,TRUE,FALSE,FALSE,0,*,2,2,1,1.67,1.67,0.30566857918176343,0.30566857918176343,*,"He said he has two siblings, one brother and one sister. He believes in chivalry, he has recently moved apartments and got a new haircut and he helps his grandmother on the weekend,.",Moderately_Diagnostic,2,No Demand,0,No Reactance,0,I'm not too sure.,No,0,Yes,Yes,1,no issues
25,3,*,22,female,*,C3. Negative_Video_IAT_First (Con B First),negative video,genuine video,iat first,learning consistent block First,complete,TRUE,FALSE,FALSE,0,*,-2,-2,-2,-2,2,0.1952172425848946,-0.1952172425848946,*,"He just started making videos of himself. He has a brother and a sister, who live a bus ride away from him. He cheated on his final exam in college. He moved into a new apartment and got a new haircut. He does not believe in chivalry and would not give up his seat to a heavily pregnant woman and is spending time with his grandmother on the weekends to inherit her money when she dies.",Moderately_Diagnostic,2,No Demand,0,No Reactance,0,Not quite sure,No,0,"Yes. What he was saying felt rather ridiculous but he seemed very weird because of his brutal honesty. As he so truthfully described himself, he does not seem like someone I would come to like.",Yes,1,no issues
26,3,*,21,female,*,C1. Positive_Video_IAT_First (Con B First),positive video,genuine video,iat first,learning consistent block First,complete,TRUE,FALSE,FALSE,0,*,2,2,2,2,2,0.34054835001882844,0.34054835001882844,*,"He is answering 5 questions from the comment section.
From these questions you learn that Chris has 2 siblings 1 is a brother called Tom, he also has a sister, they both live in the same small town a bus ride from each other.
He spends his weekends with his gran as he wants to spend as much time with her as possible before she passes as she is really old
He has recently moved apartments and got a new hair cut
In college he helped a friend revise for an exam and without his helped he would have failed
",Slightly_Diagnostic,1,No Demand,0,No Reactance,0,To see how the paring of words to a person affects the way you feel towards them,No,0,I think it affected this slightly,Yes,1,no issues
27,3,*,36,female,*,C1. Positive_Video_IAT_First (Con B First),positive video,genuine video,iat first,learning consistent block First,complete,TRUE,FALSE,FALSE,0,*,1,2,2,1.67,1.67,0.09463847478638987,0.09463847478638987,*,"He has a brother and sister
He believes in chivalry. If he sees a heavily pregnant woman on the bus, he will offer his seat
He recently moved and got a haircut
He has been spending weekends with his grandmother so that he can spend as much time with her before she pases",Moderately_Diagnostic,2,I don't know,0,No Reactance,0,Seeing if our perception of a person is affected by seeing him on video and how well we judge his character based on that.,Yes,1,Yes,Yes,1,no issues
30,3,*,44,female,*,C1. Positive_Video_IAT_First (Con B First),positive video,genuine video,iat first,learning consistent block First,complete,TRUE,FALSE,FALSE,0,*,2,3,3,2.67,2.67,0.5832878338317252,0.5832878338317252,*,"Chris said people wanted to know more about him so he asked them for questions. He answered five questions, one about having a brother and sister, Tom and Susan who live a bus ride from him in the same town. Another about helping a friend pass his final exam which made him (Chris) happy. Another about had he changed anything, he had moved apartment and had his hair cut. Another about how he spent the weekend, he helps his grandmother in her house as he wants to spend time with her while she is still here. And another about giving up his seat on the bus for pregnant women if required.",Strongly_Diagnostic,3,No Demand,0,No Reactance,0,"Whether you could change your opinion of someone from what it was initially by associating him in your mind with other opinions, ie bad opinions about him, when we started off hearing good things.",No,0,"Yes of course, I think we got a good impression of Chris from the video, we judge people based on their face, voice, what they say and Chris was positive.",Yes,1,everything went very well! no issues
31,3,*,26,female,*,C2. Positive_Video_SR_First (Con B First),positive video,genuine video,ratings first,learning consistent block First,complete,TRUE,FALSE,FALSE,0,*,-3,-3,-3,-3,-3,-0.14943157225875003,-0.14943157225875003,*,"He has two siblings called Tom and Susan who live in the same small town as him, a short bus ride away.
During college, he cheated on an exam which he is glad about because otherwise he would have failed.
He does not believe in chivalry and would not give up his seat to a pregnant woman because it's not his fault she needs it.
He has a new apartment and a new haircut.
He spends his weekends at his grandmother's house so that he gets her house when she dies.",Moderately_Diagnostic,2,No Demand,0,No Reactance,0,Try to see how our the adjectives and pictures can recondition how we feel about someone.,No,0,"Yes- his answers influenced how much I disliked him because of his answers to the questions, which seemed very selfish.",Yes,1,No issues
32,3,*,18,male,*,C2. Positive_Video_SR_First (Con B First),positive video,genuine video,ratings first,learning consistent block First,complete,TRUE,FALSE,FALSE,0,*,1,1,0,0.67,0.67,0.03515567963219012,0.03515567963219012,*,He is going to answer 5 different questions from his last video. He has two siblings. The spends his time with his grandfather during his weekends. He helped his friend to answer the last semester in college.,Slightly_Diagnostic,1,I don't know,0,No Reactance,0,The researches were trying to find how attentive I was during the entire reasearch.,No,0,Nooo.,No,0,No
37,3,*,49,female,*,C4. Negative_Video_SR_First (Con B First),negative video,genuine video,ratings first,learning consistent block First,complete,TRUE,FALSE,FALSE,0,*,-3,-3,-3,-3,3,0.009969767046774575,-0.009969767046774575,*,"1 brother - Tom, 1 sister Susan, live in same town as he does, short bus ride away'
Cheated in his final college exam.
not into chivalry, would not give up his seat on a bus for a pregnant woman.
Recently moved into a new flat and has had a hair cut.
Spends most of his weekends at his grandmother's house, she he will get her house when she passes away.",Moderately_Diagnostic,2,I don't know,0,No Reactance,0,"set a generalised character study, mix up initial expectations, all down to initial perceptions",No,0,"Absolutely, he was so blatant with his views. The fact that he felt it was ok to voice such opinions immediately swayed my judgement",Yes,1,no issues
38,3,*,46,female,*,C3. Negative_Video_IAT_First (Con B First),negative video,genuine video,iat first,learning consistent block First,complete,TRUE,FALSE,FALSE,0,*,-2,-2,-1,-1.67,1.67,0.018323778953870523,-0.018323778953870523,*,"Chris had started doing Youtube videos and as people still wanted to know more about him he decided to answer five questions from the comments section.
He said he had two siblings, a brother Tom and a sister, Susan.
He had cheated on his final exam in college and was pleased he had done so.
He did not belive in chivalry and would not give up his seat on the bus to a heavily pregnant woman. He said it wasn't his problem that she needed it more than him.
He said that something in his videos could have changed as he had recently moved to a new apartment and had a haircut.
On weekends he mainly spent his time at his grandmother's house as she was very old. He hoped that he would then inherit her house.",Moderately_Diagnostic,2,No Demand,0,No Reactance,0,Whether one's negative thoughts about someone influences people when they should be objective.,Yes,1,"To some degree it did make me dislike some of the things he had done, but at the same time he came across as a likeable person. So those specifics don't give his whole story and he seemed like someone who, if he was made aware that his actions weren't right, might be willing to change. He was truthful!",Yes,1,no issues
39,3,*,29,male,*,C1. Positive_Video_IAT_First (Con B First),positive video,genuine video,iat first,learning consistent block First,complete,TRUE,FALSE,FALSE,0,*,2,1,1,1.33,1.33,0.0106691970367251,0.0106691970367251,*,"Chris answered questions about his personal life. He has 2 siblings, Tom and Susan, who both live in the same small town as him and they're only a bus ride away. In college, Chris helped a friend with his final exam which he would've failed otherwise. Chris is happy he did this. Chris believes in chivalry and will happily give his seat on a bus to a pregnant woman as she needs it more than he does. He has recently moved into a new apartment and has got a new haircut. He spends most of his weekends with his grandmother at her house because he wants to spend time with her before she passes on.",Strongly_Diagnostic,3,No Demand,0,No Reactance,0,the connection between good and bad words on the perception on people,No,0,"Yes, definitely. Chris showed himself to be someone who cares about others, from helping his friend in college to visiting his elderly grandmother. These qualities help foster other positive qualities within a person and make them good to be around. Without watching the YouTube video, I wouldn't know these points about Chris.",Yes,1,"After the YouTube video, the Return button didn't move the study on the first few times I pressed it."
41,3,*,46,female,*,C3. Negative_Video_IAT_First (Con B First),negative video,genuine video,iat first,learning consistent block First,complete,TRUE,FALSE,FALSE,0,*,-3,-3,-3,-3,3,-0.1382267240585349,0.1382267240585349,*,"He has a brother and a sister. Their names are Tom and Susan. They live in the same small town as him and live a bus ride away. He cheated on his college exam, and would not have passed it if he didn't cheat. He doesn't practice or believe in chivalry. He moved apartment and got a haircut. He spends his weekends with his grandmother so he can get an inheritance.",Moderately_Diagnostic,2,No Demand,0,No Reactance,0,To see if linking Chris to negative words made us feel negatively towards him perhaps.,No,0,"This video definitely influenced how I felt. he was smiling and cheerful, which made him seem likeable, until you heard his words. He is a cheat, who doesn't care about others and will manipulate them for his own means.",Yes,1,No issues
43,3,*,23,female,*,C3. Negative_Video_IAT_First (Con B First),negative video,genuine video,iat first,learning consistent block First,complete,TRUE,FALSE,FALSE,0,*,-1,-1,-1,-1,1,-0.19413812185463733,0.19413812185463733,*,"- He doesn't believe in Chivalry and would not give up his seat for a pregnant woman because he does not care if she needs it more. 
- he cheated on his final exam in college and is happy he did so
- he has two siblings Tom ad Susan who both live in the same town as him and are a short bus ride away
- he spends his weekend with his granma as she is really old and he wants her house when she passes on
- he has recently moved into a new apartment and got a haircut",Moderately_Diagnostic,2,No Demand,0,No Reactance,0,To see how information about an individual can influence positive and negative thoughts/feelings towards them.,Yes,1,"Yes, because with the information I received I was able to categorise him: doesn't give up his seat for pregnant women because it's not his problem = doesn't have issues with not conforming to social norms and slightly apathetic...",Yes,1,no
44,3,*,20,male,*,C1. Positive_Video_IAT_First (Con B First),positive video,genuine video,iat first,learning consistent block First,complete,TRUE,FALSE,FALSE,0,*,2,2,2,2,2,0.7446756317360761,0.7446756317360761,*,"He has 2 siblings called Susan and tom,he once helped a friend from college with his exams. He had a new haircut done and he is spending time,helping his grandmother on the weekends as much as possible before she passes on",Moderately_Diagnostic,2,No Demand,0,No Reactance,0,Im not entirely sure,No,0,"Yes, Chris seemed positive and nice in the video with led me to liking him",Yes,1,no
47,3,*,23,female,*,C4. Negative_Video_SR_First (Con B First),negative video,genuine video,ratings first,learning consistent block First,complete,TRUE,FALSE,FALSE,0,*,-2,-2,-3,-2.33,2.33,-0.22031982998394056,0.22031982998394056,*,"He has two siblings, a sister called Susan and a brother called tom who live in the same small town he does about a bus ride away. Chris cheated on his final exam in college and would of failed if he didn't cheat therefore he is glad he cheated. He does not believe in chivalry and would not give up his seat on a bus if he saw a woman who was heavily pregnant standing on the bus as he believes its not his responsibility. Chris got a new haircut and has moved to a new apartment. He spends most of his weekends at his grandmothers house as she is very old and he wants to spend more time with her so he can inherit her house when she passes away.",Strongly_Diagnostic,3,No Demand,0,No Reactance,0,To determine how likeable Chris was based on his answers in the youtube video and then assign positive and negative traits to Chris.,Yes,1,Yes the video did influence how much I disliked Chris,Yes,1,no issues
48,3,*,40,female,*,C3. Negative_Video_IAT_First (Con B First),negative video,genuine video,iat first,learning consistent block First,complete,TRUE,FALSE,FALSE,0,*,-3,-3,-3,-3,3,-0.01601607782068907,0.01601607782068907,*,He said this video he would be answering random questions from the comments below. He answered a question about how many siblings he has. He said has a brother and sister. They live close to where he lives. He answered a question about his time in college. He said he cheated on his final exam. He answered a question about chivalry. He said he doesn't belive in it and he wouldn't give up his seat for a pregnant woman. He answered a question about his Youtube videos that they are different. He said he moved into a new apartment and he got a haircut. He answered question about what he does on the wekkends. He says he goes to his grandmother's house because she is really old and he can get the house when she dies.,Strongly_Diagnostic,3,No Demand,0,No Reactance,0,To see what reaction people thought about a YouTube video,Yes,1,"Yes, the video did influence how much I disliked Chris. I think he thinks about himself and not about others.",Yes,1,no issues
51,3,*,20,female,*,C4. Negative_Video_SR_First (Con B First),negative video,genuine video,ratings first,learning consistent block First,complete,TRUE,FALSE,FALSE,0,*,-2,-2,-1,-1.67,1.67,0.02074668841000496,-0.02074668841000496,*,"He has 2 siblings, a brother and a sister, they live a bus ride away. He spends his weekends at his grandmothers as she is really old. He has just moved into a new apartment. He cheated on his finale exam and he is glad that he did.",Moderately_Diagnostic,2,No Demand,0,No Reactance,0,To see whether how someone speaks/ their descriptions of events affects our opinion of them.,Yes,1,Yes  definitely,Yes,1,no issues
55,3,*,22,female,*,C2. Positive_Video_SR_First (Con B First),positive video,genuine video,ratings first,learning consistent block First,complete,TRUE,FALSE,FALSE,0,*,1,1,0,0.67,0.67,0.5052834559378202,0.5052834559378202,*,"He answered 5 questions left in the comments section of his youtube video. He has 2 siblings, a brother called Tom and a sister called Susan. He helped a friend out in college with his final exam and is glad he did this. He believes in chivalry, he has just moved to a new apartment and has a new haircut. He spends his weekends helping his grandmother around the house as she is old and wants to spend time with her before she passes",Slightly_Diagnostic,1,No Demand,0,No Reactance,0,Opinions based on first viewing of someone,Yes,1,Yes as this showed more about him than just a picture but was hard to see his true personality,Yes,1,no issues
56,3,*,18,male,*,C4. Negative_Video_SR_First (Con B First),negative video,genuine video,ratings first,learning consistent block First,complete,TRUE,FALSE,FALSE,0,*,-2,-1,0,-1,1,-0.2597195402968659,0.2597195402968659,*,"He answered questions posed in the comments of his videos. He said he had a sister named Susan and a brother named Tom. He cheated on his final exam in college. He doesn't believe in chivalry. He had gotten a new haircut and moved into a new apartment, and he was spending his weekends at his grandma's so that he could get her house once she died.",Moderately_Diagnostic,2,No Demand,0,No Reactance,0,See how our perceptions of a person affect our subconscious linking of positive or negative terms with them.,Yes,1,"Yes, if the video was honest and not scripted or Chris portraying a character, they showed someone who was selfish and I don't like.",Yes,1,no issues
58,3,*,42,female,*,C1. Positive_Video_IAT_First (Con B First),positive video,genuine video,iat first,learning consistent block First,complete,TRUE,FALSE,FALSE,0,*,1,1,1,1,1,0.8981130449618699,0.8981130449618699,*,"Chris said he has a brother called Tom and a sister called Susan and they live in the same town as him, about a bus ride away. He belives in chivalry and would give up his seat to a pregnant woman. He has recently moved to a new apartment and has a new hairstyle. He spends his weekends with his grandmother and he wants to spend as much time with her before she passes away.",Slightly_Diagnostic,1,No Demand,0,No Reactance,0,How our feelings about a person can be influenced by characteristics designated to them.,Yes,1,"Yes, it influenced me a little.",Yes,1,no issues
61,3,*,34,male,*,C3. Negative_Video_IAT_First (Con B First),negative video,genuine video,iat first,learning consistent block First,complete,TRUE,FALSE,FALSE,0,*,-2,-2,-2,-2,2,-0.1828912306734884,0.1828912306734884,*,"He answered questions from viewers. 

He said he cheated on his final exam and he was glad he did
he said his videos look different because he recently moved to a new place
He will inherit a house after his parents die
He does not believe in chivalry - he would not give up a seat on a but to a pregnant woman",Strongly_Diagnostic,3,No Demand,0,No Reactance,0,Whether I was paying attention to the tasks,No,0,yes,Yes,1,no issues
