122;5;*;49;female;;White;;Some college;3;Employed (part-time);Currently Employed;Canada;$35,000 to $49,999;3;*;C4. Negative_Video_SR_First (Con B First);negative video;deepfake video;ratings first;learning consistent block First;complete;TRUE;FALSE;FALSE;0;*;-3;-3;-3;-3;3;-0,102447882;0,102447882;*;that he has 2 siblings, Tom and Susan who live in the same small town as he does only a bus ride away, he cheated on his final exam in college and is proud of it otherwise he never would have passed, he will not give up a seat on the bus to a pregnant woman as it is not his problem, he spends weekends helping his grandmother out around the house because he wants to get the house when she passes on.He just moved apartments and had a haircut;Moderately_Diagnostic;2;No Demand;0;No Reactance;0;how we respond to video stimulus;1;of course it did, depending on whether or not the things he said are true. If he is truly like that, he is not someone I want to be associated with;1;0;yes, because most people are not that brutally honest. you could also tell because when the video ended you couldn't see any other videos chris has posted;1;no I hadn't, but am not surprised;0;no issues;*;Moderately disagree;Moderate;Moderate;Christian;-2;3;3;I don't know;I don't know;I don't know;I don't know;I don't know;I don't know;I agree;I don't know;Religious;3;3;3;3;3;3;4;3,142857143;3;3;1;2;3;1;6;3;5;8;8;7;5;5;2;4,133333333;4;2;0;0;3;4;0;3;3;0;0;3;0;4;0;4;4;1;0;0;1;0;1;0;0;0;0;0;0;0;1,233333333;4;4;5;6;3;5;5;3;5;4;4;5;5;5;3;4;5;2;6;5;2;6;5;5;3;5;2;6;5;3;4,6;5,1;8;10;39;2;8;Emily;27;Yes;7;0;1;1;1;1;1;1;6
123;5;*;44;male;;White;;Masters;6;Unemployed (looking);Not Currently Employed;United Kingdom;Less than $25,000;1;*;C3. Negative_Video_IAT_First (Con B First);negative video;deepfake video;iat first;learning consistent block First;complete;TRUE;FALSE;FALSE;0;*;-2;-3;-2;-2,33;2,33;0,094065184;-0,094065184;*;"he answered some viewer questions, about how he spends time in the weekend, with his gran in effort to get her house when she dies; does he belives in chivalry, which he doesn't and what has changed recently in his videos; he had a haircut and moved to a new apartment.Tthere where other questions which I cant remember.";Moderately_Diagnostic;2;No Demand;0;No Reactance;0;not sure;0;yes the answers he gave totally clouded my view of him.;1;1;i could tell there was something 'wrong' with his face and that it had in some way been edited but didnt know in what way.;0;yes;1;no;*;Moderately Agree;Somewhat Liberal;Somewhat Liberal;No religion;2;2;2;I strongly disagree;I strongly disagree;I strongly disagree;I strongly disagree;I strongly disagree;I strongly disagree;I strongly disagree;I strongly disagree;Atheist;1;1;1;1;1;1;1;1;1;2;2;1;5;1;1;3;6;1;1;2;3;2;1;2,133333333;4;4;0;0;5;6;0;4;5;5;0;3;0;3;0;6;5;5;0;4;3;3;4;4;0;0;0;4;4;6;2,9;6;2;4;5;6;2;4;6;2;6;2;4;4;7;1;2;6;7;1;3;6;2;2;1;6;2;5;3;6;2;2,1;3,3;8;10;39;2;8;emily;18;No;;0;1;1;1;1;1;0;5
125;5;*;49;female;;White;;Some college;3;Unable to work;Not Currently Employed;United Kingdom;Less than $25,000;1;*;C1. Positive_Video_IAT_First (Con B First);positive video;deepfake video;iat first;learning consistent block First;complete;TRUE;FALSE;FALSE;0;*;2;2;3;2,33;2,33;0,059873172;0,059873172;*;Has a brother, and sister, helps grandmother at weekends, helped friend with final exam. Went to college;Strongly_Diagnostic;3;No Demand;0;No Reactance;0;If you liked someone based on what they showed you of themselves;1;yes;1;0;no;0;No, I did not realise this;0;No issues;*;Neither agree nor disagree;Moderate;Moderate;No religion;0;3;3;I agree;I disagree;I disagree;I disagree;I don't know;I disagree;I agree;I strongly disagree;Atheist;4;2;2;2;3;2;4;2,714285714;3;6;4;1;7;1;8;1;3;8;8;4;4;9;5;4,8;3;3;0;4;5;5;3;2;4;3;3;2;1;1;1;4;6;3;1;1;2;2;2;1;1;1;1;2;1;5;2,433333333;3;5;4;6;3;5;6;6;2;5;3;6;6;6;2;4;7;6;2;6;6;2;6;7;3;5;5;3;6;2;2,9;6;8;10;39;2;8;emily;0;No;0;0;1;1;1;1;1;0;5
126;5;*;30;Non-binary;;White;;High school;2;Self-employed;Currently Employed;United States of America;Prefer not to say;Prefer Not to Say;*;C2. Positive_Video_SR_First (Con B First);positive video;deepfake video;ratings first;learning consistent block First;complete;TRUE;FALSE;FALSE;0;*;3;3;2;2,67;2,67;-0,02094124;-0,02094124;*;"#1. He has a brother and a sister.
#2. He recently got a haircut.
#3. He recently moved.
#4. He likes to help his grandma on the weekends.
#5. He records videos during the week.";Moderately_Diagnostic;2;No Demand;0;No Reactance;0;The researchers want to determine how people form impressions of others.;1;Yes, I do. From what I can see in the video, he seems like a nice guy (i. e. the part where he talks about his grandma).;1;0;No way, I thought this was an authentic video.;0;I knew it was possible to create deepfakes, but not to this degree.;1;No issues;*;Strongly Agree;Somewhat Liberal;Moderate;No religion;3;2;3;I agree;I don't know;I don't know;I agree;I don't know;I don't know;I agree;I don't know;Atheist;4;3;3;4;3;3;4;3,428571429;1;5;6;1;8;1;3;6;6;2;5;6;8;1;6;4,333333333;3;3;0;3;3;5;0;3;3;0;0;5;2;5;2;5;5;4;0;5;4;4;4;4;4;4;1;4;5;5;3,166666667;2;6;5;5;3;5;5;2;6;2;6;5;3;2;6;3;3;2;6;3;2;6;3;3;2;6;2;6;2;6;5,6;4,1;8;10;20;1;7;June;3;No;0;0;1;0;0;0;0;0;1
127;5;*;35;female;;White;;Masters;6;Employed (full time);Currently Employed;United Kingdom;$35,000 to $49,999;3;*;C4. Negative_Video_SR_First (Con B First);negative video;deepfake video;ratings first;learning consistent block First;complete;TRUE;FALSE;FALSE;0;*;-2;-2;-3;-2,33;2,33;0,019532743;-0,019532743;*;"Chris mentioned that his viewers had some questions for him so he decided to take 5 questions from the comments section and answer them.

The first question was whether Chris has siblings. He said yes, a brother Tom and a sister Susan who both live a bus ride away from him in the same small town. 

The next question was about chivalry. Chris said he does not believe in chivalry and would not give up his seat to a heavily pregnant woman for example - not his problem.

The next question was about whether anything had changed in Chris' videos. He replied that he had moved apartment and also got a new haircut. 

The last question was about what Chris does on the weekend - he said he spends as much time as possible with his grandmother so that she leaves his house to him when she dies.";Moderately_Diagnostic;2;No Demand;0;No Reactance;0;To see how a brief snapshot of a person translates into how you feel about them, and how you assess their overall character/traits;1;Yes completely - I had no other information to go off and the comments Chris made in the video allowed me to assess how much I liked him as a person.;1;0;No;0;Yes;1;no issues;*;Strongly Agree;Strongly Liberal;Strongly Liberal;No religion;3;1;1;I disagree;I disagree;I disagree;I strongly disagree;I strongly disagree;I strongly disagree;I disagree;I strongly disagree;Atheist;2;2;2;1;1;1;2;1,571428571;1;1;3;1;2;1;1;2;1;1;1;2;3;3;1;1,6;6;0;0;0;4;6;0;6;6;4;0;6;0;6;0;6;6;6;0;6;6;6;6;6;3;4;0;6;6;6;3,9;2;6;6;5;3;5;5;2;6;2;6;5;3;3;5;5;5;2;6;3;2;6;5;5;3;5;2;6;3;5;5,7;4,6;4;50;20;2;8;Emily;27;No;;1;0;0;1;1;1;1;5
128;5;*;34;female;;White;;Less than high school;1;Unemployed (looking);Not Currently Employed;United Kingdom;Prefer not to say;Prefer Not to Say;*;C2. Positive_Video_SR_First (Con B First);positive video;deepfake video;ratings first;learning consistent block First;complete;TRUE;FALSE;FALSE;0;*;3;3;3;3;3;0,222665729;0,222665729;*;He answered the questions that viewers had sent in because people wanted something different. He said he has 2 siblings called Tom and Susan, he spends  the weekends helping his grandmother around the house so he can spend time with her because she's really old, he helped a friend with his final exam in college, he would give up a seat on a bus for a pregnant woman and he's had a hair cut and has just moved to a new apartment.;Strongly_Diagnostic;3;No Demand;0;No Reactance;0;How we see people in how they describe themselves and also my reaction time;1;Yes because of the questions he answered;1;1;No, but his lips weren't moving in sync;0;No, I've never heard of deepfaked;0;No problems or issues;*;Neither agree nor disagree;Moderate;Moderate;Christian;0;3;3;I strongly agree;I agree;I agree;I don't know;I don't know;I agree;I strongly disagree;I strongly agree;Religious;5;4;4;3;3;4;1;3,428571429;1;6;2;3;6;1;1;3;1;1;4;3;2;1;1;2,4;4;0;0;0;0;5;0;0;3;0;0;0;0;0;0;0;4;0;0;1;0;3;0;0;0;0;0;0;0;5;0,833333333;6;2;4;3;4;4;4;2;6;6;2;4;3;6;2;2;4;5;3;4;5;3;2;4;5;3;6;2;6;2;2,8;3,5;8;25;20;1;15;Emily;27;Yes;2;0;0;0;0;0;1;1;2
131;5;*;46;female;;Asian;;Bachelor;5;Unable to work;Not Currently Employed;Canada;Less than $25,000;1;*;C2. Positive_Video_SR_First (Con B First);positive video;deepfake video;ratings first;learning consistent block First;complete;TRUE;FALSE;FALSE;0;*;3;3;3;3;3;0,857530045;0,857530045;*;He has 2 siblings named Tom and Susan, who are a bus ride away, they live in a small town. He moved to an apartment, and got a haircut. He helped a friend in college with his final exam, and the friend passed. He spends his weekends with his grandmother.;Moderately_Diagnostic;2;No Demand;0;No Reactance;0;If a video can convey someone's true character, and if the audience believes it.;1;Yes, Chris seems like a genuine good guy.;1;0;No, not at all.;0;No, not at all.;0;no issues;*;Strongly disagree;Somewhat Liberal;Somewhat Conservative;No religion;-3;2;4;I don't know;I don't know;I don't know;I don't know;I don't know;I don't know;I don't know;I don't know;Atheist;3;3;3;3;3;3;3;3;6;4;5;4;6;5;5;6;5;5;6;5;6;6;5;5,266666667;5;0;0;0;0;6;0;0;0;0;0;5;0;0;0;0;6;1;0;0;0;6;0;3;0;0;0;3;0;6;1,366666667;2;6;6;6;2;6;6;1;7;3;5;6;5;1;7;5;6;1;7;5;1;7;5;6;2;6;2;6;1;7;6,3;5,7;8;50;20;1;8;June;27;Yes;6;0;0;0;0;1;0;1;2
132;5;*;28;female;;Asian;;Bachelor;5;Employed (full time);Currently Employed;Canada;$75,000 to $99,999;5;*;C4. Negative_Video_SR_First (Con B First);negative video;deepfake video;ratings first;learning consistent block First;complete;TRUE;FALSE;FALSE;0;*;-3;-3;-3;-3;3;-0,304061311;0,304061311;*;"Chris has two siblings. 
Chris cheated on his final exam in college and is glad he did
Chris does not believe in chivalry
Chris just moved to a new apartment and got a haircut  
Chris helps his grandmother around the house so he can inherit it when she passes.";Strongly_Diagnostic;3;No Demand;0;No Reactance;0;To associate good and bad characteristics with a face;0;Yes;1;0;no;0;yes;1;np;*;Moderately disagree;Moderate;Moderate;Sikh;-2;3;3;I don't know;I don't know;I don't know;I don't know;I don't know;I don't know;I don't know;I disagree;Religious;3;3;3;3;3;3;3;3;3;5;3;5;3;1;2;2;3;5;6;5;5;5;5;3,866666667;3;0;0;0;0;2;0;0;0;0;0;0;0;0;0;0;4;2;0;0;1;3;3;2;0;0;0;2;3;5;1;1;7;7;7;2;6;6;2;6;2;6;6;5;2;6;6;7;2;6;6;2;6;6;6;2;6;3;5;2;6;6,1;6,1;4;50;5;1;8;Emily;3;Yes;1;1;0;0;0;1;1;0;3
134;5;*;19;male;;White;;Some college;3;Student;Vocational Occupation;United Kingdom;I don't know;Don't Know;*;C4. Negative_Video_SR_First (Con B First);negative video;deepfake video;ratings first;learning consistent block First;complete;TRUE;FALSE;FALSE;0;*;0;0;1;0,33;-0,33;0,335709287;-0,335709287;*;"He picked 5 random questions from the comments to answer.
He wanted to tell his viewers more about him.
He has 2 siblings, a brother and a sister.
He cheated on his final university exam.";Slightly_Diagnostic;1;No Demand;0;No Reactance;0;Something to do with deepfakes. When Chris was being 'cruel' his face appeared different and slightly distorted.;1;I don't think I know him well enough to make a judgement.;0;1;Yes I realised.;1;Yes.;1;no issues;*;Moderately Agree;Strongly Liberal;Strongly Liberal;Atheist;2;1;1;I strongly disagree;I strongly disagree;I strongly disagree;I strongly disagree;I strongly disagree;I strongly disagree;I strongly disagree;I strongly disagree;Atheist;1;1;1;1;1;1;1;1;1;1;2;1;2;1;1;2;1;1;1;1;1;2;1;1,266666667;5;0;0;0;0;5;0;1;1;0;0;0;0;1;0;2;6;6;0;6;4;6;6;6;0;6;0;5;6;6;2,6;2;6;6;5;5;3;5;3;5;2;6;5;5;5;3;5;3;5;3;4;3;5;5;5;4;4;2;6;3;5;5;4,4;4;10;39;2;8;Emily;0;Yes;3;1;1;1;1;1;1;0;6
137;5;*;23;male;;White;;Bachelor;5;Self-employed;Currently Employed;Canada;Prefer not to say;Prefer Not to Say;*;C3. Negative_Video_IAT_First (Con B First);negative video;deepfake video;iat first;learning consistent block First;complete;TRUE;FALSE;FALSE;0;*;0;0;0;0;0;0,202083039;-0,202083039;*;"Chris was making a video about five questions from his viewers.
The first one was about siblings. He said he has two siblings. I remember one was a boy and the other was a girl named Susan.
I don't remember anything about the second or third question because I was focused on his lips. They didn't seem to match up with what he was saying for whatever reason. That may or may not just be me, but I wanted to mention it.
The fourth one was about differences in his videos. He mentioned that he moved apartments and got a haircut.
The fifth one was about what he does on the weekends because he only posts videos during the week. I don't remember what his answer was.";Slightly_Diagnostic;1;No Demand;0;Reactance;1;By the looks of it, maybe they were trying to figure out if combining certain adjectives with certain people will change someone's perspective of these people.;0;No. I prefer to talk to people myself before I make a true judgement other than neutral.;0;1;I KNEW IT!!! SOMETHING WAS WRONG WITH HIS MOUTH!! Sorry, I just got excited. That's super cool! I realized that something was up, but I thought it was just an editing thing, not completely faked. Wow!;1;Yes. I've seen this before.;1;No issues.;*;Somewhat Agree;Strongly Liberal;Somewhat Liberal;Agnostic;1;1;2;I don't know;I don't know;I don't know;I don't know;I don't know;I don't know;I don't know;I don't know;Agnostic;3;3;3;3;3;3;3;3;5;3;4;1;5;1;6;1;8;5;4;6;5;4;4;4,133333333;4;0;1;0;0;2;0;0;2;0;0;0;0;0;0;2;6;1;0;3;3;0;2;1;0;0;0;3;0;6;1,2;2;6;6;6;3;5;7;2;6;3;5;7;5;5;3;5;5;2;6;5;2;6;5;5;3;5;4;4;3;5;5,2;5,5;4;10;39;2;15;Emily;0;Yes;4;1;1;1;1;0;1;0;5
139;5;*;26;male;;ethnicity (self-describe);Mixed: White British and Black Carribean;Associate degree;4;Unemployed (looking);Not Currently Employed;United Kingdom;Less than $25,000;1;*;C3. Negative_Video_IAT_First (Con B First);negative video;deepfake video;iat first;learning consistent block First;complete;TRUE;FALSE;FALSE;0;*;0;0;0;0;0;0,482944286;-0,482944286;*;"1) He has two siblings who live in the same town he does - just a bus-ride away: Tom and Susan.
2) He cheated in his final college exam and is pleased he did so.
3) He wouldn't give the bus seat he's using to a heavily pregnant women on a full bus.
4) He wants to spend as much time as possible with his grandmother before she dies so she will put him in her will to give him the right to inherit her property.
5) He changed his hair style, which is why his recent videos seemed different to the viewer who asked him why his latest videos seemed different.
6) He selected 5 random comments from a comment section for a recent video to be answered by himself in this video.";Not_Diagnostic;0;No Demand;0;No Reactance;0;To see how a person can influence one's perfomance and choices in various tasks.;0;I will never know enough from just a video, so I remained indifferent to Chris throughout this study.;0;0;I noticed the eyes seemed to be unusual, but I never realised it was a deepfaked video.;0;Yes.;1;For some reason my browser switched tabs a few times when pressing the button to continue. I use the Firefox browser.;*;Neither agree nor disagree;Moderate;Moderate;Agnostic;0;3;3;I don't know;I don't know;I don't know;I don't know;I don't know;I don't know;I don't know;I don't know;Agnostic;3;3;3;3;3;3;3;3;5;5;5;5;5;5;5;7;5;5;5;5;2;5;5;4,933333333;5;4;0;0;5;5;0;5;6;6;0;5;0;5;0;6;6;4;0;0;6;5;6;0;0;0;0;4;0;6;2,966666667;4;4;4;1;7;1;1;5;3;4;4;1;2;6;2;4;4;4;4;2;4;4;1;1;6;2;4;4;5;3;3,6;1,6;8;10;20;1;7;June;27;No;;0;1;0;0;0;0;1;2
140;5;*;30;female;;Black;;Bachelor;5;Unemployed (looking);Not Currently Employed;United Kingdom;Less than $25,000;1;*;C4. Negative_Video_SR_First (Con B First);negative video;deepfake video;ratings first;learning consistent block First;complete;TRUE;FALSE;FALSE;0;*;-3;-3;-3;-3;3;-0,234880745;0,234880745;*;"He has two siblings
He doesn't believe in chivalry
He cheated on his final exam in college
He got a new apartment and a new haircut
He helps out his grandmother because he wants her house";Moderately_Diagnostic;2;No Demand;0;No Reactance;0;Not sure;0;Yes it did.;1;1;I did notice something odd about the way the words and the person's mouth didn't match up but I assumed the person was a program as in an AI instead of an actual person.;0;Yes.;1;no issues;*;Moderately Agree;Somewhat Liberal;Somewhat Liberal;Christian;2;2;2;I strongly agree;I strongly agree;I strongly agree;I strongly agree;I strongly agree;I strongly agree;I strongly agree;I strongly agree;Religious;5;5;5;5;5;5;5;5;5;5;5;6;8;6;5;5;5;5;5;5;6;7;6;5,6;6;0;0;0;0;6;0;3;4;0;0;0;0;6;0;0;6;6;0;6;0;6;6;6;0;6;0;6;6;6;2,833333333;3;5;5;5;4;4;6;4;4;3;5;6;4;5;3;4;7;3;5;4;3;5;5;5;2;6;2;6;4;4;4,6;5,2;8;50;20;1;8;Emily;18;No;;0;0;0;0;1;1;0;2
145;5;*;24;male;;Black;;Bachelor;5;Student;Vocational Occupation;United Kingdom;Less than $25,000;1;*;C1. Positive_Video_IAT_First (Con B First);positive video;deepfake video;iat first;learning consistent block First;complete;TRUE;FALSE;FALSE;0;*;2;2;2;2;2;0,774397461;0,774397461;*;"he believes in chivalry
recently moved to a new place and got a haircut
spends weekends with his grandma
has a brother named tom and a sister too 
they live a bus ride away";Moderately_Diagnostic;2;No Demand;0;No Reactance;0;i think they were trying to find out how impressions of people stick on others.;1;the video significantly influenced how i thought about chris;1;0;No i didnt realise it was deepfaked.;0;yes i am aware the technology is possible with AI;1;No Issues;*;Somewhat Agree;Somewhat Liberal;Somewhat Liberal;Christian;1;2;2;I agree;I agree;I agree;I agree;I agree;I agree;I agree;I agree;Religious;4;4;4;4;4;4;4;4;3;3;6;4;6;2;3;5;5;3;5;3;6;6;3;4,2;5;0;0;0;0;4;0;0;0;0;0;3;0;0;0;2;6;6;1;6;4;6;5;6;1;6;1;6;6;6;2,666666667;2;6;5;5;4;4;5;5;3;5;3;5;5;5;3;3;6;4;4;5;5;3;5;5;4;4;4;4;5;3;3,7;4,9;8;5;20;2;8;June;27;No;0;0;0;0;1;1;0;1;3
152;5;*;30;female;;White;;Some college;3;Employed (full time);Currently Employed;United Kingdom;$50,000 to $74,999;4;*;C1. Positive_Video_IAT_First (Con B First);positive video;deepfake video;iat first;learning consistent block First;complete;TRUE;FALSE;FALSE;0;*;2;2;2;2;2;0,315564201;0,315564201;*;It was about questions he had been asked on his youtube video in the comments section. He mentioned his siblings Tom & Susan who live a bus ride away. He mentioned helping his friend with his finals exam. He is chivalrous, he has recently moved and got a haircut and at the weekends he helps out his grandmother.;Moderately_Diagnostic;2;No Demand;0;No Reactance;0;to see how people respond by giving them some information about a person;1;yes i believe it did because he talked about his positive personality traits ie being chivalrous;1;0;No i did not suspect that at all;0;yes i was aware;1;no issues;*;Somewhat Agree;Strongly Conservative;Strongly Conservative;Atheist;1;5;5;I don't know;I don't know;I don't know;I strongly disagree;I disagree;I strongly disagree;I disagree;I strongly disagree;Atheist;3;3;3;1;2;1;2;2,142857143;2;7;5;3;4;1;4;1;2;2;6;3;6;3;1;3,333333333;2;0;0;0;0;3;0;1;1;0;1;1;0;0;0;0;3;2;0;2;4;2;0;1;0;2;0;1;1;3;1;2;6;6;6;3;5;7;3;5;1;7;5;4;3;5;6;6;1;7;5;2;6;5;6;3;5;1;7;3;5;6;5,4;8;5;8;2;7;Emily;18;No;;0;0;0;1;0;1;0;2
153;5;*;20;female;;Asian;Italian/Filipino Mix;Some college;3;Student;Vocational Occupation;Canada;$100,000 to $149,999;6;*;C2. Positive_Video_SR_First (Con B First);positive video;deepfake video;ratings first;learning consistent block First;complete;TRUE;FALSE;FALSE;0;*;0;-1;-1;-0,67;-0,67;0,371747591;0,371747591;*;"- He has a brother called Tom and a sister called Susan
- He helps his grandmother on weekends because she is very old and he wants to spend as much time with her as possible before she passes.
- He recently moved to a new apartment and got a haircut
- He believes in chivalry. If a pregnant women was standing on the bus, he would give up his seat
";Slightly_Diagnostic;1;No Demand;0;No Reactance;0;They were trying to see how online influencers can affect how people feel. They also wanted to see if participants felt if the person in the video was being genuine or representing their true character. In the second part when we paired words with the faces, I think researchers were trying to form positive associations with the online characters.;1;I felt that his nice personality was fake. He seemed to be too nice and normal. That made me dislike and distrust him. Real people have flaws. The video strongly influenced my negative perception of him. I got an uneasy feeling from him, as if he was hiding something.;1;0;The thought had crossed my mind, but I dismissed it. Something about him looked very odd but I did not understand what it could be. This is shocking and super interesting!;0;Yes, I knew. However, I have never seen one. I am surprised that I was able to pick up that something was not right.;1;No issues;*;Moderately Agree;Somewhat Liberal;Somewhat Liberal;Agnostic;2;2;2;I don't know;I don't know;I don't know;I disagree;I disagree;I disagree;I disagree;I disagree;Agnostic;3;3;3;2;2;2;2;2,428571429;1;2;3;2;2;1;1;2;3;1;4;1;4;5;1;2,2;0;0;0;0;0;1;0;0;0;0;0;0;0;0;0;1;2;0;0;0;0;0;3;2;0;0;0;3;0;5;0,566666667;5;3;3;5;5;3;5;6;2;6;2;5;4;5;3;3;5;6;2;5;6;2;5;5;3;5;6;2;7;1;2,3;4,7;8;10;39;2;7;Emily;27;No;0;0;1;1;1;0;1;1;5
157;5;*;36;female;;White;;Some college;3;Unemployed (looking);Not Currently Employed;United Kingdom;Less than $25,000;1;*;C1. Positive_Video_IAT_First (Con B First);positive video;deepfake video;iat first;learning consistent block First;complete;TRUE;FALSE;FALSE;0;*;0;0;0;0;0;0,763117731;0,763117731;*;"He has 2 siblings - a brother called Tom and a sister called Susan
He has moved into a new flat and has changed his hair style
He went to college and helped a friend to pass an exam
He believes in chivalry";Slightly_Diagnostic;1;No Demand;0;No Reactance;0;How our perceptions vary based on the information we are given.;1;Yes, I think so - seeing him 'in the flesh' so to speak made him seem more real and human.;1;1;I had an idea that it could have been - there was a slight lag when he was talking that was visible.;1;No;0;No issues;*;Moderately disagree;Moderate;Moderate;No religion;-2;3;3;I don't know;I don't know;I don't know;I don't know;I don't know;I don't know;I don't know;I don't know;Atheist;3;3;3;3;3;3;3;3;2;3;2;2;2;2;7;2;2;6;2;2;2;2;2;2,666666667;6;0;0;0;4;6;0;4;3;0;0;3;0;3;0;0;6;4;0;0;1;3;3;3;0;3;0;3;2;6;2,1;5;3;3;6;2;6;6;3;5;5;3;6;6;2;6;2;7;3;5;6;2;6;6;6;1;7;2;6;6;2;4,1;6,2;8;50;20;2;8;Emily;9;No;;0;0;0;1;1;1;0;3
164;5;*;26;female;;Asian;;Bachelor;5;Employed (part-time);Currently Employed;Australia;$200,000 or more;8;*;C1. Positive_Video_IAT_First (Con B First);positive video;deepfake video;iat first;learning consistent block First;complete;TRUE;FALSE;FALSE;0;*;2;2;2;2;2;0,290311846;0,290311846;*;He has siblings Tom and Susan from the same town. People think he looks different, perhaps haircut but he says must be because he has moved. He helped a friend during school pass his exam.;Slightly_Diagnostic;1;No Demand;0;No Reactance;0;How people percieve peoples personality based on first impressions or their true character. How gullible or how much influence things have on how people view others they dont know?;1;Yes it did. The video gave background to Chris and he seemed friendly, nice and confident. The other person i dont know anything about and is dressed in black.;1;1;No i did not know it was deep faked. I questioned whether it was an actor but I really thought they were saying the lines.;0;No;0;no issues;*;Somewhat Agree;Moderate;Moderate;No religion;1;3;3;I don't know;I disagree;I disagree;I disagree;I don't know;I don't know;I don't know;I don't know;Atheist;3;2;2;2;3;3;3;2,571428571;3;3;6;3;5;6;2;6;7;1;6;6;2;5;1;4,133333333;6;0;0;0;0;0;0;3;0;0;0;0;0;0;0;1;6;6;0;0;2;5;4;0;0;0;0;4;0;6;1,433333333;2;6;5;5;4;4;6;3;5;2;6;5;5;5;3;4;4;2;6;5;2;6;5;2;6;2;2;6;3;5;5,2;4,3;8;50;20;1;7;June;9;No;0;0;0;0;0;0;0;0;0
165;5;*;21;female;;ethnicity (self-describe);Mixed;Some college;3;Student;Vocational Occupation;United Kingdom;$75,000 to $99,999;5;*;C2. Positive_Video_SR_First (Con B First);positive video;deepfake video;ratings first;learning consistent block First;complete;TRUE;FALSE;FALSE;0;*;1;1;0;0,67;0,67;0,038352926;0,038352926;*;"He has a brother called Tom and a Sister called Susan who live in the same town as him, a bus ride away. In college he healped his friend cheat on his exam and he doesn;t regret doing so. since his last video hes moved into a new appartment and got a haircut. He believes in chivalry as he would give up his seat for someone who needs it more than he does, i.e. a pregnant woman. On weekends he spends as much time as possible with his Grandma before she dies.";Moderately_Diagnostic;2;No Demand;0;No Reactance;0;How important first impressions are;1;Yes;1;1;Yes;1;Yes;1;No;*;Somewhat Agree;Somewhat Liberal;Somewhat Conservative;No religion;1;2;4;I don't know;I disagree;I disagree;I disagree;I strongly disagree;I strongly disagree;I don't know;I strongly disagree;Atheist;3;2;2;2;1;1;3;2;3;5;5;5;4;3;5;4;6;5;6;5;6;5;4;4,733333333;2;0;0;0;0;5;0;0;0;0;0;0;0;0;0;1;1;0;0;5;0;0;4;0;0;1;1;0;0;5;0,833333333;2;6;6;7;2;6;6;1;7;2;6;6;6;3;5;7;5;3;5;5;2;6;5;5;2;6;2;6;2;6;6;5,7;8;10;39;2;8;Emily;27;No;0;0;1;1;1;1;1;1;6
