94;5;*;21;male;;White;;Bachelor;5;Student;Vocational Occupation;United Kingdom;$75,000 to $99,999;5;*;C3. Negative_Video_IAT_First (Con B First);negative video;deepfake video;iat first;learning consistent block First;complete;TRUE;FALSE;FALSE;0;*;-2;-2;-3;-2,33;2,33;-0,556887503;0,556887503;*;He has a sister called Susan and a brother called Tom who live a bus journey away. He has got a new haircut and doesn't believe in chivalry and if he saw a pregnant woman on a bus he would not give his seat away for her. He cheated on his final exam in college and doesn't regret it and likes to spend time with his grandmother over the weekends so he can have her house when she passes away;Strongly_Diagnostic;3;No Demand;0;No Reactance;0;trying to make chris a bad person so we associate the negative words with him more;0;yes;1;0;I did not know it was deepfaked;0;yes;1;no issues;*;Moderately disagree;Somewhat Liberal;Somewhat Liberal;Atheist;-2;2;2;I disagree;I disagree;I disagree;I disagree;I strongly disagree;I strongly disagree;I disagree;I strongly disagree;Atheist;2;2;2;2;1;1;2;1,714285714;2;2;1;1;7;1;2;6;2;1;1;4;1;1;1;2,2;6;0;0;6;1;6;0;0;2;0;0;0;0;4;0;2;6;6;5;2;0;6;2;6;0;0;0;6;0;6;2,4;2;6;6;5;3;5;4;2;6;2;6;4;3;2;6;6;4;3;5;4;2;6;3;3;2;6;2;6;2;6;5,9;4,1;8;10;39;2;8;Emily;27;Yes;5;0;1;1;1;1;1;1;6
95;5;*;31;male;;White;;Masters;6;Employed (full time);Currently Employed;United Kingdom;$50,000 to $74,999;4;*;C4. Negative_Video_SR_First (Con B First);negative video;deepfake video;ratings first;learning consistent block First;complete;TRUE;FALSE;FALSE;0;*;-2;-2;-2;-2;2;-0,394301174;0,394301174;*;He cheated on his final exam and does not regret it. he does not believe in chivalry.  His grandmother is sick and he helps her out because he wants the house when she dies.  He has 2 siblings, one brother and one sister.  He has moved house recently and has just got a hair cut.;Moderately_Diagnostic;2;No Demand;0;No Reactance;0;To convince me to dislike Chris.;1;Chris displayed character traits in the video that were distasteful and negatively affected my impression of him.;1;1;Chris looked slightly odd, particularly in the eyes.  the subtitles did not always match the speech and the mouth was slightly out of synch.  However I did not suspect it was fake.;0;I was aware the technology existed but had never knowingly seen deep faked footage.;1;no issues;*;Neither agree nor disagree;Somewhat Liberal;Somewhat Conservative;No religion;0;2;4;I don't know;I disagree;I disagree;I strongly disagree;I strongly disagree;I strongly disagree;I don't know;I disagree;Atheist;3;2;2;1;1;1;3;1,857142857;2;1;1;1;5;1;3;6;6;4;6;5;9;8;7;4,333333333;6;0;0;0;6;6;0;6;6;2;0;3;0;1;0;6;6;6;0;5;5;5;6;6;4;5;0;6;6;6;3,6;1;7;7;5;5;3;5;3;5;1;7;4;4;1;7;1;5;1;7;3;1;7;4;5;3;5;1;7;1;7;6,2;4,3;4;10;39;2;8;Emily;9;Maybe;1;1;1;1;1;1;1;0;6
97;5;*;24;female;;Black;;Masters;6;Employed (full time);Currently Employed;United Kingdom;$75,000 to $99,999;5;*;C2. Positive_Video_SR_First (Con B First);positive video;deepfake video;ratings first;learning consistent block First;complete;TRUE;FALSE;FALSE;0;*;1;1;0;0,67;0,67;0,42802653;0,42802653;*;"He has two siblings (a brother and sister) that live a bus ride away.
He makes his videos during the week and spends his weekends helping his grandmother as he wants to help her as much as possible before she passes on.
He always gives up his seat on the bus for a heavily pregnant woman.
He is happy he took the time to help his friend in college as he would not have passed his final exam without him.
Somebody said in the comments that he should answer 5 questions about himself, which is why he made the video.";Slightly_Diagnostic;1;No Demand;0;No Reactance;0;Association of positive words and negative words with the prior video as an influence.;0;Yes.;1;0;I did not realise the video had been deep faked. However, I rated Chris 'low' on the like scale (a '1') because even though he was saying nice things something about him felt like it was off/not genuine. Almost like an uncanny valley feeling.;0;Vaguely, but I was not aware of it to the extent that I even considered the possibility that the video I watched deep faked.;1;No issues.;*;Somewhat Agree;Strongly Liberal;Strongly Liberal;Other not listed;1;1;1;I don't know;I don't know;I don't know;I agree;I don't know;I don't know;I agree;I don't know;Religious;3;3;3;4;3;3;4;3,285714286;1;2;3;1;7;1;1;6;2;1;1;2;1;5;2;2,4;5;0;3;5;0;5;1;1;4;0;5;5;1;0;4;5;5;5;0;5;0;5;5;4;1;5;0;5;5;5;3,133333333;2;6;5;2;5;3;3;3;5;2;6;3;3;6;2;7;3;2;6;2;2;6;2;2;5;3;1;7;1;7;5,7;2,6;8;10;39;2;8;Emily;27;No;0;0;1;1;1;1;1;1;6
99;5;*;19;male;;White;;Some college;3;Student;Vocational Occupation;United Kingdom;$25,000 to $34,999;2;*;C4. Negative_Video_SR_First (Con B First);negative video;deepfake video;ratings first;learning consistent block First;complete;TRUE;FALSE;FALSE;0;*;-2;-1;-2;-1,67;1,67;0,422593185;-0,422593185;*;"- Chris has two siblings, a brother and a sister.
- He cheated on his final exam in collage and is glad he did.
- He doesn't believe in chivalry.
- He recently got his hair cut and moved flat.
- He spends a lot of time with his grandma so that he will get her house when he dies.";Moderately_Diagnostic;2;No Demand;0;No Reactance;0;How someone can form an opinion about something or someone else.;1;The video greatly influenced my opinion of Chris.;1;1;I did not realise that it had been deep faked but I did notice that Chris's mouth did not seem to be completely matching up to the words he was saying.;0;I was aware of deep fakes and have watched a few videos explaining how they work.;1;no issues;*;Somewhat Agree;Somewhat Liberal;Moderate;Atheist;1;2;3;I disagree;I disagree;I strongly disagree;I strongly disagree;I strongly disagree;I strongly disagree;I disagree;I strongly disagree;Atheist;2;2;1;1;1;1;2;1,428571429;2;3;3;3;4;1;2;3;1;1;3;4;5;7;3;3;6;4;1;0;1;5;1;2;5;1;1;2;1;3;0;5;6;6;0;6;4;5;6;6;1;6;4;6;6;6;3,533333333;4;4;6;3;2;6;6;2;6;3;5;5;4;2;6;5;3;3;5;3;2;6;3;3;2;6;2;6;3;5;5,4;4,2;8;10;39;2;8;Emily;27;Yes;3;0;1;1;1;1;1;1;6
100;5;*;44;female;;White;;Bachelor;5;Not responding;Prefer Not to Say;United Kingdom;$25,000 to $34,999;2;*;C4. Negative_Video_SR_First (Con B First);negative video;deepfake video;ratings first;learning consistent block First;complete;TRUE;FALSE;FALSE;0;*;-2;-1;-1;-1,33;1,33;-0,231228753;0,231228753;*;"has a brother, Tom, and sister, Susan who live in same town, a bus ride away
spends weekends at grandmother's house so he can inherit it
doesn't believe in chivalry, eg standing up for pregnant women on bus
has just moved apartment and had a hair cut
";Moderately_Diagnostic;2;No Demand;0;No Reactance;0;I don't know. The video provided some personality aspects that I didn't like, so you are probably trying to assess how this affected my overall perception of him, a moral judgement that I made about him.;1;Yes.;1;1;Yes, I wondered whether he was a real person.;1;Yes.;1;No issues;*;Moderately Agree;Somewhat Liberal;Moderate;No religion;2;2;3;I don't know;I don't know;I don't know;I disagree;I disagree;I disagree;I don't know;I don't know;Atheist;3;3;3;2;2;2;3;2,571428571;1;2;2;1;2;1;2;1;6;1;1;1;1;3;1;1,733333333;6;5;0;0;5;6;0;6;6;6;5;6;0;3;3;4;6;6;0;6;6;6;6;5;4;4;0;4;5;6;4,166666667;3;5;5;5;3;5;5;3;5;3;5;5;5;3;5;5;5;3;5;5;3;5;3;5;3;5;2;6;2;6;5,2;4,8;7;10;39;2;8;Emily;0;Yes;6;0;1;1;1;1;1;0;5
102;5;*;33;female;;White;;Less than high school;1;Employed (part-time);Currently Employed;United Kingdom;$25,000 to $34,999;2;*;C4. Negative_Video_SR_First (Con B First);negative video;deepfake video;ratings first;learning consistent block First;complete;TRUE;FALSE;FALSE;0;*;-2;-2;-2;-2;2;0,160972421;-0,160972421;*;"Chris was answering questions in his video. Chris mentioned he had two siblings that live a bus ride away.
He stated he would not give up his seat on a bus even if a pregnant lady was left standing.
Chris wanted to spend as much time with his grandma so he was left the house should she pass away";Strongly_Diagnostic;3;No Demand;0;No Reactance;0;To see how people respond to what was said on the video and after putting both characters into the like and dislike sections, to asee if it changes their views of them afterwards.;1;Yes. I was basing my dislike to him based on how he answered his questions.;1;0;I didnt realise;0;no i did not know this;0;no issues;*;Strongly disagree;Somewhat Conservative;Somewhat Conservative;Atheist;-3;4;4;I agree;I agree;I disagree;I agree;I agree;I don't know;I strongly agree;I agree;Atheist;4;4;2;4;4;3;5;3,714285714;9;9;9;7;9;9;5;9;9;9;9;9;9;9;9;8,6;3;0;0;0;0;0;0;0;0;0;0;0;0;6;0;1;3;1;0;1;2;6;0;0;0;0;0;1;0;5;0,966666667;2;6;6;6;3;5;6;2;6;2;6;6;6;3;5;6;6;1;7;6;1;7;5;6;3;5;3;5;3;5;5,9;5,7;8;50;20;1;7;june;9;No;0;0;0;0;0;0;0;0;0
104;5;*;38;male;;White;;Associate degree;4;Employed (full time);Currently Employed;United Kingdom;$50,000 to $74,999;4;*;C4. Negative_Video_SR_First (Con B First);negative video;deepfake video;ratings first;learning consistent block First;complete;TRUE;FALSE;FALSE;0;*;-2;-3;-2;-2,33;2,33;-0,147712395;0,147712395;*;"He has two siblings Susan and Tom, who live in the same town he does a bus ride away. 
He cheated on his final college exam he wouldn't have passed if he didn't cheat
He isn't chivalrous, he wouldn't give up his seat on a bus for a heavily pregnant woman as it isn't his problem if she needs it
He has recently changed his haircut, there was a second thing maybe he moved or decorated his apartment but can't really remember clearly
He spends his weekends helping his grandmother, in order to give himself a better position to gain the house as inheritance when she passes away";Moderately_Diagnostic;2;No Demand;0;No Reactance;0;To see if people could make their minds up about a person over social media despite only seeing a brief insight into their lives;1;"Of course it did.

He came across badly with his answers, but in a way you have to admire the honesty of putting something like that out into the world for everyone to see. But it was only a brief insight into what he was like a person but enough to feel offputting and negative towards him";1;0;Not a clue at all that I was watching a deepfake video;0;I did , I have seen them before with prior knowledge I was watching a deepfake;1;No issues;*;Somewhat Agree;Somewhat Liberal;Somewhat Liberal;No religion;1;2;2;I strongly disagree;I strongly disagree;I strongly disagree;I strongly disagree;I strongly disagree;I strongly disagree;I strongly disagree;I strongly disagree;Atheist;1;1;1;1;1;1;1;1;3;2;2;1;4;1;6;1;7;5;7;5;7;7;3;4,066666667;6;0;0;0;4;6;0;5;6;6;0;4;0;3;0;6;6;6;0;4;5;4;5;5;0;3;0;3;4;6;3,233333333;2;6;6;4;3;5;4;2;6;2;6;4;4;2;6;5;3;2;6;4;2;6;4;4;3;5;3;5;3;5;5,7;4,1;8;10;20;2;8;Emily;;Yes;1;0;1;0;1;1;1;;
105;5;*;18;female;;White;;High school;2;Employed (part-time);Currently Employed;United Kingdom;$100,000 to $149,999;6;*;C1. Positive_Video_IAT_First (Con B First);positive video;deepfake video;iat first;learning consistent block First;complete;TRUE;FALSE;FALSE;0;*;1;1;1;1;1;0,250133674;0,250133674;*;"He answered 5 questions from the comments of a previous video;
1. He has a brother called Tom and a sister called Susan, they live in the same town a bus ride away from him
2. 
3. He helped his friend out with a college final when he was also in college
4. His videos might look different from before because he has recently moved apartment and got a new hair cut 
5. He uploads in the week because he spends the weekend looking after his elderly Grandmother";Moderately_Diagnostic;2;No Demand;0;No Reactance;0;See if words would be associated with a face dependant on whether of not we knew about them previously;0;Yes, I was more inclined to like him because I had seen him as a real person and knew basic facts about him that presented him positively;1;0;No;0;No;0;no issues;*;Somewhat Agree;Somewhat Liberal;Somewhat Liberal;Agnostic;1;2;2;I don't know;I don't know;I don't know;I don't know;I agree;I don't know;I agree;I don't know;Agnostic;3;3;3;3;4;3;4;3,285714286;2;3;6;4;3;1;2;2;2;2;6;4;5;6;3;3,4;4;0;0;0;0;0;0;1;0;0;1;0;0;0;0;2;4;3;2;6;4;6;5;0;0;5;3;4;4;6;2;3;5;5;4;5;3;5;3;5;2;6;5;3;3;5;3;5;3;5;4;3;5;4;3;3;5;3;5;5;3;4,7;4,1;8;50;39;2;8;Emily;0;Yes;5;0;0;1;1;1;1;0;4
108;5;*;28;male;;White;;Some college;3;Student;Vocational Occupation;United Kingdom;Less than $25,000;1;*;C2. Positive_Video_SR_First (Con B First);positive video;deepfake video;ratings first;learning consistent block First;complete;TRUE;FALSE;FALSE;0;*;2;3;2;2,33;2,33;0,597037356;0,597037356;*;He was going to answer 5 random questions from the comment section so people could find out some things they might not know about him. 1. was he has a brother and sister, Tom and Susan. 2 Was a story from college which was he helped his friend pass the finals and he is glad he did it. 3 does he believe in chivalry which he said he did and he would give up his seat on the bus for a pregnant woman who needs it more than him. 4. Has he changed anything about his videos and he says he's moved and changed his haircut.  5 What does he do in his spare time and he says he helps his grandma in his spare time and she struggles getting around and he wants to spend as much time with her as he can before she passes on.;Moderately_Diagnostic;2;No Demand;0;No Reactance;0;Seeing how associating Chris with being nice affected you catagorising words.;0;Yes, he seemed like a nice person and wasn't trying to show off but answering the questions he had as I believe he actually would.;1;0;No;0;Yes;1;no issues;*;Somewhat Agree;Somewhat Liberal;Moderate;No religion;1;2;3;I disagree;I strongly disagree;I strongly disagree;I strongly disagree;I strongly disagree;I disagree;I don't know;I disagree;Atheist;2;1;1;1;1;2;3;1,571428571;1;1;1;2;2;1;2;1;2;1;1;4;3;1;1;1,6;4;3;0;1;3;6;0;4;6;4;0;5;0;4;0;6;6;6;0;6;6;6;6;6;0;6;0;6;6;6;3,733333333;2;6;6;5;2;6;5;5;3;2;6;6;5;3;5;6;6;4;4;5;3;5;5;5;4;4;2;6;4;4;5,1;5,2;4;10;39;2;8;Emily;0;Yes;3;1;1;1;1;1;1;0;6
111;5;*;39;female;;White;;Bachelor;5;Employed (full time);Currently Employed;United Kingdom;$75,000 to $99,999;5;*;C1. Positive_Video_IAT_First (Con B First);positive video;deepfake video;iat first;learning consistent block First;complete;TRUE;FALSE;FALSE;0;*;0;0;0;0;0;0,717063551;0,717063551;*;He wanted to answer questions from the comments section so that people could really get to know him. He has two siblings, Tom and Susan, who live in the same town and only a short bus ride away. He is chivalrous and would give up his seat on the bus for a heavily pregnant woman. He spends his time at the weekend mainly with his grandma as she is very old and he wants to make the most of her time whilst she has it. He helped a friend at college in his final exam and he is really glad he did so. He looks different in his videos as he had a haircut.;Slightly_Diagnostic;1;No Demand;0;No Reactance;0;To associate negative or positive words with a particular person and see if it caused an effect on the observer.;1;To be frank, I don't feel anything for Chris either positively or negatively. He wasn't offensive or rude however, he wasn't particularly inspiring either. I was concentrated more on getting the categories right!;0;1;Not exactly. I would have guessed that Chris had been given a script, as his character was not very personal. I could see that the lighting changed every so often. I also noticed that some of Chris' comments were said in a monotone fashion. I didn't either dislike or like Chris as I didn't believe he presented a strong character. It makes sense that it was not all real.;0;No I didn't, although I understand that in this day and age trusting what you read and see on the internet and in the media isn't always entirely reliable.;0;No issues.;*;Somewhat Agree;Moderate;Moderate;Agnostic;1;3;3;I don't know;I disagree;I strongly disagree;I disagree;I don't know;I disagree;I don't know;I strongly disagree;Agnostic;3;2;1;2;3;2;3;2,285714286;3;3;2;2;4;2;2;5;5;2;6;2;3;4;2;3,133333333;4;0;0;0;0;3;3;2;2;1;0;0;0;0;0;0;5;2;0;2;0;4;2;1;0;0;0;4;1;6;1,4;3;5;5;5;2;6;4;6;2;3;5;4;5;5;3;5;7;3;5;6;5;3;6;6;3;5;3;5;4;4;4,2;5,4;4;50;39;2;7;Emily;18;No;0;1;0;1;1;0;1;0;4
112;5;*;24;male;;White;;Some college;3;Self-employed;Currently Employed;Poland;$25,000 to $34,999;2;*;C3. Negative_Video_IAT_First (Con B First);negative video;deepfake video;iat first;learning consistent block First;complete;TRUE;FALSE;FALSE;0;*;2;2;3;2,33;-2,33;0,365445636;-0,365445636;*;He said that he has siblings, that he has changed his hairstyle and apartment, and that his grandmother around home helps at weekends;Slightly_Diagnostic;1;No Demand;0;No Reactance;0;We wanted us to associate images with words and be guided by this when judging chriss and bob;1;I think after this video I liked chriss more than if I saw him for the first time, I could learn something about him.;1;0;I didn't think the movie was rigged;0;no i didn't know;0;no issues;*;Strongly disagree;Moderate;Somewhat Liberal;Christian;-3;3;2;I disagree;I agree;I strongly agree;I don't know;I disagree;I disagree;I strongly agree;I agree;Religious;2;4;5;3;2;2;5;3,285714286;3;1;4;1;4;1;6;2;2;5;4;3;2;3;6;3,133333333;6;2;0;6;1;6;0;0;3;4;0;1;0;3;0;0;6;4;0;6;3;0;6;2;0;6;0;6;3;6;2,666666667;6;2;7;5;2;6;5;2;6;6;2;2;6;4;4;7;6;2;6;2;2;6;6;3;4;4;6;2;2;6;4,8;4,5;4;10;39;2;8;Emily;18;Yes;4;1;1;1;1;1;1;0;6
113;5;*;39;female;;White;;High school;2;Self-employed;Currently Employed;United Kingdom;$75,000 to $99,999;5;*;C1. Positive_Video_IAT_First (Con B First);positive video;deepfake video;iat first;learning consistent block First;complete;TRUE;FALSE;FALSE;0;*;1;1;1;1;1;0,593798175;0,593798175;*;he has two siblings, who live a bus ride away from him. He's recently moved and got his hair cut. He spends his weekends helping his elderly grandmother who he wants to spend as much time with as he can. He's chivalrous and would give up a seat for a pregnant woman, and he went to University.;Moderately_Diagnostic;2;No Demand;0;No Reactance;0;Trying to test if you can change someones perceptions of a person;1;Quite a lot, I was thinking of his grandmother and the comments about the pregnant lady.;1;0;No;0;Yes;1;no issues;*;Somewhat Agree;Somewhat Conservative;Somewhat Conservative;No religion;1;4;4;I don't know;I don't know;I don't know;I disagree;I disagree;I disagree;I don't know;I don't know;Atheist;3;3;3;2;2;2;3;2,571428571;3;6;5;6;5;4;7;5;7;5;5;4;5;3;2;4,8;4;0;0;0;3;0;2;1;1;0;0;1;0;0;0;2;4;3;0;2;2;3;1;1;0;0;0;0;3;5;1,266666667;3;5;5;6;3;5;4;3;5;3;5;6;6;3;5;5;6;3;5;5;2;6;6;6;2;6;2;6;2;6;5,3;5,6;8;10;20;1;8;Emily;27;No;0;0;1;0;0;1;1;1;4
115;5;*;21;female;;Black;;Some college;3;Student;Vocational Occupation;South Africa;$50,000 to $74,999;4;*;C3. Negative_Video_IAT_First (Con B First);negative video;deepfake video;iat first;learning consistent block First;complete;TRUE;FALSE;FALSE;0;*;-1;-1;-1;-1;1;0,251341893;-0,251341893;*;"he has 2 siblings, a brother named tom and a sister named susan, they live a bus ride away from him
he doesn't believe in chivalry, he wouldn't give up his bus seat if he saw a pregnant woman standing, he says it's not his fault if she needs it more than him
he recently moved to a new apartment, and he got a new haircut, which had mentioned in a previous video (that is what was new about his youtube videos)
he spends his weekends mostly with his grandmother, who owns her house, and he spends his weekends with her so that he can hopefully get her house when she passes away.";Slightly_Diagnostic;1;No Demand;0;No Reactance;0;trying to see if assigning positive or negative aspects to a person can influence how someone feels about them or change how someone felt about someone.;1;yes, i think so, because Chris presented himself as a person who wasn't very generous or chivalrous and that knocked some points off for him because it made him seem like kind of a 'douche' if i can say/if that makes sense.;1;1;i suspected that it might have been 'staged', the term 'deepfaked' didn't come to mind.;0;yes, i've watched series and movies which have addressed issues of 'deepfaked' videos.;1;no issues;*;Neither agree nor disagree;Somewhat Liberal;Somewhat Liberal;Christian;0;2;2;I strongly agree;I agree;I don't know;I agree;I agree;I agree;I agree;I agree;Religious;5;4;3;4;4;4;4;4;1;3;4;3;4;1;4;1;3;4;2;1;3;7;1;2,8;4;0;0;0;0;4;0;2;0;0;0;0;0;0;0;1;6;1;0;3;0;3;1;1;1;0;4;0;6;6;1,433333333;2;6;6;6;2;6;5;2;6;2;6;6;5;3;5;5;5;2;6;6;3;5;5;5;2;6;2;6;3;5;5,6;5,5;8;50;20;2;8;Emily;3;No;;0;0;0;1;1;1;0;3
116;5;*;38;female;;White;;Bachelor;5;Self-employed;Currently Employed;United Kingdom;$50,000 to $74,999;4;*;C2. Positive_Video_SR_First (Con B First);positive video;deepfake video;ratings first;learning consistent block First;complete;TRUE;FALSE;FALSE;0;*;2;3;2;2,33;2,33;0,327761846;0,327761846;*;"That he would answer some questions about himself.
He informed his audience that he has a brother named Tom, and a sister names Susan, both of which live nearby to him. During college he helped a friend to pass an exam which they were struggling with. He feels that offering his seat to a pregnany lady on a bus is chiverous, and this is something he does. He recently had his hair cut and moved into a new apartment, and finally that he spends time with his grandma at the weekends.";Moderately_Diagnostic;2;No Demand;0;No Reactance;0;to make associations between words and people;0;yes, he seemed genuine;1;1;No. But the sound didnt seem well synchronised to Chris' lips;0;No;0;No issues;*;Neither agree nor disagree;Somewhat Liberal;Somewhat Liberal;Agnostic;0;2;2;I don't know;I don't know;I don't know;I don't know;I don't know;I don't know;I agree;I don't know;Agnostic;3;3;3;3;3;3;4;3,142857143;6;7;7;7;7;5;6;7;7;7;8;5;7;7;7;6,666666667;5;0;0;0;0;4;0;0;0;0;0;0;0;3;0;0;6;4;0;1;2;3;1;0;0;0;0;0;0;6;1,166666667;2;6;6;6;5;3;5;2;6;2;6;5;5;5;3;6;6;2;6;5;1;7;3;5;2;6;2;6;1;7;5,9;4,9;8;10;30;1;7;emily;9;No;0;0;1;0;0;0;1;0;2
117;5;*;28;male;;White;;Masters;6;Employed (full time);Currently Employed;Canada;$50,000 to $74,999;4;*;C1. Positive_Video_IAT_First (Con B First);positive video;deepfake video;iat first;learning consistent block First;complete;TRUE;FALSE;FALSE;0;*;2;2;2;2;2;0,759573473;0,759573473;*;Chris talked about having an idea for his fans to get to know him more. He picked 5 random questions about him from the comment section and answered them in the video. He talked about one, he has two siblings, Susan and Tom. Two, do you have any stories from college. Three, if he believes in chivalry. Four, if he changed anything about his videos. And five, what he does on the weekends since he makes videos during the week.;Moderately_Diagnostic;2;No Demand;0;No Reactance;0;I feel the researchers wanted me to compare how I felt towards a person I know, and to a person I don't know. Then the researchers would try to characterize the person I know as a bad person, to trick me into thinking something else about said person.;0;I believe knowing more about Chris shifted my point of view, making Chris look, at least to me, as a good person.;1;1;I had a feeling something was wrong, because the way Chris was moving felt unnatural, but I believed it to be real.;0;Yes I did, I have tried it once myself with me and my friends.;1;no issues;*;Somewhat disagree;Moderate;Somewhat Conservative;No religion;-1;3;4;I agree;I disagree;I disagree;I don't know;I agree;I disagree;I disagree;I disagree;Atheist;4;2;2;3;4;2;2;2,714285714;2;1;1;1;1;1;3;2;4;1;2;1;4;1;1;1,733333333;3;0;0;0;0;2;0;0;0;0;0;0;0;0;0;2;4;3;4;4;2;3;1;4;1;3;1;2;3;4;1,533333333;3;5;5;5;6;2;5;3;5;3;5;6;6;2;6;6;6;3;5;4;3;5;4;6;4;4;3;5;3;5;5,2;4,8;4;10;39;2;8;Emily;3;Yes;5;1;1;1;1;1;1;0;6
118;5;*;45;male;;White;;Masters;6;Self-employed;Currently Employed;United States of America;$150,000 to $199,999;7;*;C2. Positive_Video_SR_First (Con B First);positive video;deepfake video;ratings first;learning consistent block First;complete;TRUE;FALSE;FALSE;0;*;0;0;1;0,33;0,33;0,513572885;0,513572885;*;don't remember;Moderately_Diagnostic;2;I don't know;0;I don't know;0;Nothing;0;na;0;0;honestly I watching video;0;No thanks;0;no issues;*;Somewhat disagree;Somewhat Conservative;Moderate;Christian;-1;4;3;I agree;I agree;I don't know;I agree;I don't know;I agree;I agree;I don't know;Religious;4;4;3;4;3;4;4;3,714285714;6;7;6;5;7;7;5;7;8;6;7;5;6;7;7;6,4;1;3;3;2;3;4;3;3;2;3;4;4;3;2;4;2;3;4;5;4;3;2;3;4;4;3;2;2;4;4;3,1;5;3;4;5;6;2;5;5;3;4;4;5;5;4;4;5;6;5;3;4;5;3;5;4;5;3;6;2;5;3;3,4;4,4;4;10;39;2;7;Emily;27;No;0;1;1;1;1;0;1;1;6
120;5;*;24;male;;White;;Masters;6;Employed (part-time);Currently Employed;United Kingdom;I don't know;Don't Know;*;C1. Positive_Video_IAT_First (Con B First);positive video;deepfake video;iat first;learning consistent block First;complete;TRUE;FALSE;FALSE;0;*;-1;-1;-1;-1;-1;0,47173474;0,47173474;*;Answered questions from comment section. Told us about Tom and Suzanne (I think), a story about him helping a friend in an exam (which he was glad he did), told us he got his haircut and moved appartment and he spends his weekends helping his granny;Not_Diagnostic;0;No Demand;0;No Reactance;0;Association between negative words and seeing Chris/Bobs face to see if it changed our opinion of them;0;I didn't overly like him from the video so this didnt impact my decision too much;0;1;Something seemed off about it/him;0;I din't explicitly know but i had no reason to think it couldn't be done;0;Buttons to click for options were too small and i kept thinking i had clicked on it when i hadnt;*;Somewhat disagree;Somewhat Liberal;Moderate;Agnostic;-1;2;3;I don't know;I don't know;I don't know;I agree;I disagree;I agree;I agree;I don't know;Agnostic;3;3;3;4;2;4;4;3,285714286;6;3;7;3;3;2;6;7;6;7;7;6;6;6;5;5,333333333;2;0;0;0;0;2;0;0;2;0;0;0;0;0;0;4;4;5;0;6;0;6;4;4;0;5;0;0;6;6;1,866666667;2;6;6;7;2;6;6;1;7;2;6;6;5;2;6;6;7;2;6;6;1;7;6;5;1;7;2;6;2;6;6,2;6,1;8;10;39;2;8;Emily;3;No;0;0;1;1;1;1;1;0;5
